profiling_results_2a6/m16384n8192k2048_rtx_a6000.gemm.csv
Problem,Provider,OperationKind,Operation,Disposition,Status,gemm_kind,m,n,k,A,B,C,D,alpha,beta,split_k_mode,split_k_slices,batch_count,raster_order,runtime_input_datatype_a,runtime_input_datatype_b,use_pdl,enable_sm90_mixed_dtype_shuffle_test,swizzle_size,op_class,accum,cta_m,cta_n,cta_k,cluster_m,cluster_n,cluster_k,cluster_m_fallback,cluster_n_fallback,cluster_k_fallback,stages,warps_m,warps_n,warps_k,inst_m,inst_n,inst_k,min_cc,max_cc,Bytes,Flops,Flops/Byte,Runtime,GB/s,GFLOPs
1,CUTLASS,gemm,cutlass_simt_sgemm_128x128_8x2_nn_align1,not_verified,success,universal,16384,8192,2048,f32:column,f32:column,f32:column,f32:column,1,0,serial,1,1,heuristic,invalid,invalid,false,false,1,simt,f32,128,128,8,1,1,1,0,0,0,2,4,2,1,1,1,1,50,1024,738197504,550024249344,745,24.7347,27.7949,22236.9
1,CUTLASS,gemm,cutlass_simt_sgemm_128x128_8x2_nt_align1,not_verified,success,universal,16384,8192,2048,f32:column,f32:row,f32:column,f32:column,1,0,serial,1,1,heuristic,invalid,invalid,false,false,1,simt,f32,128,128,8,1,1,1,0,0,0,2,4,2,1,1,1,1,50,1024,738197504,550024249344,745,23.9691,28.6828,22947.2
1,CUTLASS,gemm,cutlass_simt_sgemm_128x128_8x2_tn_align1,not_verified,success,universal,16384,8192,2048,f32:row,f32:column,f32:column,f32:column,1,0,serial,1,1,heuristic,invalid,invalid,false,false,1,simt,f32,128,128,8,1,1,1,0,0,0,2,4,2,1,1,1,1,50,1024,738197504,550024249344,745,26.2202,26.2202,20977.1
1,CUTLASS,gemm,cutlass_simt_sgemm_128x128_8x2_tt_align1,not_verified,success,universal,16384,8192,2048,f32:row,f32:row,f32:column,f32:column,1,0,serial,1,1,heuristic,invalid,invalid,false,false,1,simt,f32,128,128,8,1,1,1,0,0,0,2,4,2,1,1,1,1,50,1024,738197504,550024249344,745,25.3454,27.1253,21701.2
1,CUTLASS,gemm,cutlass_simt_dgemm_128x128_8x2_nn_align1,not_verified,success,universal,16384,8192,2048,f64:column,f64:column,f64:column,f64:column,1,0,serial,1,1,heuristic,invalid,invalid,false,false,1,simt,f64,128,128,8,1,1,1,0,0,0,2,4,2,1,1,1,1,50,1024,1476395008,550024249344,372,862.911,1.59344,637.405
1,CUTLASS,gemm,cutlass_simt_dgemm_128x128_8x2_nt_align1,not_verified,success,universal,16384,8192,2048,f64:column,f64:row,f64:column,f64:column,1,0,serial,1,1,heuristic,invalid,invalid,false,false,1,simt,f64,128,128,8,1,1,1,0,0,0,2,4,2,1,1,1,1,50,1024,1476395008,550024249344,372,862.288,1.5946,637.866
1,CUTLASS,gemm,cutlass_simt_dgemm_128x128_8x2_tn_align1,not_verified,success,universal,16384,8192,2048,f64:row,f64:column,f64:column,f64:column,1,0,serial,1,1,heuristic,invalid,invalid,false,false,1,simt,f64,128,128,8,1,1,1,0,0,0,2,4,2,1,1,1,1,50,1024,1476395008,550024249344,372,862.111,1.59492,637.997
1,CUTLASS,gemm,cutlass_simt_dgemm_128x128_8x2_tt_align1,not_verified,success,universal,16384,8192,2048,f64:row,f64:row,f64:column,f64:column,1,0,serial,1,1,heuristic,invalid,invalid,false,false,1,simt,f64,128,128,8,1,1,1,0,0,0,2,4,2,1,1,1,1,50,1024,1476395008,550024249344,372,862.101,1.59494,638.005
1,CUTLASS,gemm,cutlass_simt_cgemm_128x64_8x2_nn_align1,not_verified,success,universal,16384,8192,2048,cf32:column,cf32:column,cf32:column,cf32:column,1,0,serial,1,1,heuristic,invalid,invalid,false,false,1,simt,cf32,128,64,8,1,1,1,0,0,0,2,2,2,1,1,1,1,50,1024,1476395008,2200096997376,1490,84.4066,16.2902,26065.5
1,CUTLASS,gemm,cutlass_simt_cgemm_128x64_8x2_nt_align1,not_verified,success,universal,16384,8192,2048,cf32:column,cf32:row,cf32:column,cf32:column,1,0,serial,1,1,heuristic,invalid,invalid,false,false,1,simt,cf32,128,64,8,1,1,1,0,0,0,2,2,2,1,1,1,1,50,1024,1476395008,2200096997376,1490,84.0004,16.369,26191.5
1,CUTLASS,gemm,cutlass_simt_cgemm_128x64_8x2_tn_align1,not_verified,success,universal,16384,8192,2048,cf32:row,cf32:column,cf32:column,cf32:column,1,0,serial,1,1,heuristic,invalid,invalid,false,false,1,simt,cf32,128,64,8,1,1,1,0,0,0,2,2,2,1,1,1,1,50,1024,1476395008,2200096997376,1490,85.4211,16.0967,25755.9
1,CUTLASS,gemm,cutlass_simt_cgemm_128x64_8x2_tt_align1,not_verified,success,universal,16384,8192,2048,cf32:row,cf32:row,cf32:column,cf32:column,1,0,serial,1,1,heuristic,invalid,invalid,false,false,1,simt,cf32,128,64,8,1,1,1,0,0,0,2,2,2,1,1,1,1,50,1024,1476395008,2200096997376,1490,84.7561,16.223,25958
1,CUTLASS,gemm,cutlass_simt_hgemm_256x128_8x2_nn_align1,not_verified,success,universal,16384,8192,2048,f16:column,f16:column,f16:column,f16:column,1,0,serial,1,1,heuristic,invalid,invalid,false,false,1,simt,f16,256,128,8,1,1,1,0,0,0,2,4,2,1,1,1,1,50,1024,369098752,550024249344,1490,16.2935,21.0973,33757.2
1,CUTLASS,gemm,cutlass_simt_hgemm_256x128_8x2_nt_align1,not_verified,success,universal,16384,8192,2048,f16:column,f16:row,f16:column,f16:column,1,0,serial,1,1,heuristic,invalid,invalid,false,false,1,simt,f16,256,128,8,1,1,1,0,0,0,2,4,2,1,1,1,1,50,1024,369098752,550024249344,1490,16.1768,21.2496,34000.8
1,CUTLASS,gemm,cutlass_simt_hgemm_256x128_8x2_tn_align1,not_verified,success,universal,16384,8192,2048,f16:row,f16:column,f16:column,f16:column,1,0,serial,1,1,heuristic,invalid,invalid,false,false,1,simt,f16,256,128,8,1,1,1,0,0,0,2,4,2,1,1,1,1,50,1024,369098752,550024249344,1490,16.5902,20.7201,33153.6
1,CUTLASS,gemm,cutlass_simt_hgemm_256x128_8x2_tt_align1,not_verified,success,universal,16384,8192,2048,f16:row,f16:row,f16:column,f16:column,1,0,serial,1,1,heuristic,invalid,invalid,false,false,1,simt,f16,256,128,8,1,1,1,0,0,0,2,4,2,1,1,1,1,50,1024,369098752,550024249344,1490,16.5164,20.8126,33301.6
1,CUTLASS,gemm,cutlass_simt_igemm_s8_128x128_32x2_nn_align1,not_verified,success,universal,16384,8192,2048,s8:column,s8:column,s32:column,s32:column,1,0,serial,1,1,heuristic,invalid,invalid,false,false,1,simt,s32,128,128,32,1,1,1,0,0,0,2,4,2,1,1,1,4,50,1024,587202560,550024249344,936,7.7527,70.5399,70946.1
1,CUTLASS,gemm,cutlass_simt_igemm_s8_128x128_32x2_nt_align1,not_verified,success,universal,16384,8192,2048,s8:column,s8:row,s32:column,s32:column,1,0,serial,1,1,heuristic,invalid,invalid,false,false,1,simt,s32,128,128,32,1,1,1,0,0,0,2,4,2,1,1,1,4,50,1024,587202560,550024249344,936,7.81175,70.0067,70409.8
1,CUTLASS,gemm,cutlass_simt_igemm_s8_128x128_32x2_tn_align1,not_verified,success,universal,16384,8192,2048,s8:row,s8:column,s32:column,s32:column,1,0,serial,1,1,heuristic,invalid,invalid,false,false,1,simt,s32,128,128,32,1,1,1,0,0,0,2,4,2,1,1,1,4,50,1024,587202560,550024249344,936,7.53152,72.6115,73029.6
1,CUTLASS,gemm,cutlass_simt_igemm_s8_128x128_32x2_tt_align1,not_verified,success,universal,16384,8192,2048,s8:row,s8:row,s32:column,s32:column,1,0,serial,1,1,heuristic,invalid,invalid,false,false,1,simt,s32,128,128,32,1,1,1,0,0,0,2,4,2,1,1,1,4,50,1024,587202560,550024249344,936,7.72847,70.7611,71168.6
1,CUTLASS,gemm,cutlass_simt_s8_igemm_s8_128x128_32x2_nn_align1,not_verified,success,universal,16384,8192,2048,s8:column,s8:column,s8:column,s8:column,1,0,serial,1,1,heuristic,invalid,invalid,false,false,1,simt,s32,128,128,32,1,1,1,0,0,0,2,4,2,1,1,1,4,50,1024,184549376,550024249344,2980,7.54176,22.7898,72930.5
1,CUTLASS,gemm,cutlass_simt_s8_igemm_s8_128x128_32x2_nt_align1,not_verified,success,universal,16384,8192,2048,s8:column,s8:row,s8:column,s8:column,1,0,serial,1,1,heuristic,invalid,invalid,false,false,1,simt,s32,128,128,32,1,1,1,0,0,0,2,4,2,1,1,1,4,50,1024,184549376,550024249344,2980,7.58477,22.6605,72516.9
1,CUTLASS,gemm,cutlass_simt_s8_igemm_s8_128x128_32x2_tn_align1,not_verified,success,universal,16384,8192,2048,s8:row,s8:column,s8:column,s8:column,1,0,serial,1,1,heuristic,invalid,invalid,false,false,1,simt,s32,128,128,32,1,1,1,0,0,0,2,4,2,1,1,1,4,50,1024,184549376,550024249344,2980,7.40147,23.2217,74312.8
1,CUTLASS,gemm,cutlass_simt_s8_igemm_s8_128x128_32x2_tt_align1,not_verified,success,universal,16384,8192,2048,s8:row,s8:row,s8:column,s8:column,1,0,serial,1,1,heuristic,invalid,invalid,false,false,1,simt,s32,128,128,32,1,1,1,0,0,0,2,4,2,1,1,1,4,50,1024,184549376,550024249344,2980,7.60866,22.5894,72289.2
1,CUTLASS,gemm,cutlass_tensorop_s1688gemm_f16_256x128_32x2_nn_align8,not_verified,success,universal,16384,8192,2048,f16:column,f16:column,f32:column,f32:column,1,0,serial,1,1,heuristic,invalid,invalid,false,false,1,tensorop,f32,256,128,32,1,1,1,0,0,0,2,4,2,1,16,8,8,75,1024,637534208,550024249344,862,5.76785,102.941,95360.3
1,CUTLASS,gemm,cutlass_tensorop_s1688gemm_f16_256x128_32x2_nt_align8,not_verified,success,universal,16384,8192,2048,f16:column,f16:row,f32:column,f32:column,1,0,serial,1,1,heuristic,invalid,invalid,false,false,1,tensorop,f32,256,128,32,1,1,1,0,0,0,2,4,2,1,16,8,8,75,1024,637534208,550024249344,862,5.61596,105.726,97939.5
1,CUTLASS,gemm,cutlass_tensorop_s1688gemm_f16_256x128_32x2_tn_align8,not_verified,success,universal,16384,8192,2048,f16:row,f16:column,f32:column,f32:column,1,0,serial,1,1,heuristic,invalid,invalid,false,false,1,tensorop,f32,256,128,32,1,1,1,0,0,0,2,4,2,1,16,8,8,75,1024,637534208,550024249344,862,5.65487,104.998,97265.6
1,CUTLASS,gemm,cutlass_tensorop_s1688gemm_f16_256x128_32x2_tt_align8,not_verified,success,universal,16384,8192,2048,f16:row,f16:row,f32:column,f32:column,1,0,serial,1,1,heuristic,invalid,invalid,false,false,1,tensorop,f32,256,128,32,1,1,1,0,0,0,2,4,2,1,16,8,8,75,1024,637534208,550024249344,862,5.68115,104.512,96815.6
1,CUTLASS,gemm,cutlass_tensorop_f16_s1688gemm_f16_256x128_32x2_nn_align8,not_verified,success,universal,16384,8192,2048,f16:column,f16:column,f16:column,f16:column,1,0,serial,1,1,heuristic,invalid,invalid,false,false,1,tensorop,f32,256,128,32,1,1,1,0,0,0,2,4,2,1,16,8,8,75,1024,369098752,550024249344,1490,5.38965,63.7796,102052
1,CUTLASS,gemm,cutlass_tensorop_f16_s1688gemm_f16_256x128_32x2_nt_align8,not_verified,success,universal,16384,8192,2048,f16:column,f16:row,f16:column,f16:column,1,0,serial,1,1,heuristic,invalid,invalid,false,false,1,tensorop,f32,256,128,32,1,1,1,0,0,0,2,4,2,1,16,8,8,75,1024,369098752,550024249344,1490,5.23196,65.702,105128
1,CUTLASS,gemm,cutlass_tensorop_f16_s1688gemm_f16_256x128_32x2_tn_align8,not_verified,success,universal,16384,8192,2048,f16:row,f16:column,f16:column,f16:column,1,0,serial,1,1,heuristic,invalid,invalid,false,false,1,tensorop,f32,256,128,32,1,1,1,0,0,0,2,4,2,1,16,8,8,75,1024,369098752,550024249344,1490,5.29988,64.8599,103780
1,CUTLASS,gemm,cutlass_tensorop_f16_s1688gemm_f16_256x128_32x2_tt_align8,not_verified,success,universal,16384,8192,2048,f16:row,f16:row,f16:column,f16:column,1,0,serial,1,1,heuristic,invalid,invalid,false,false,1,tensorop,f32,256,128,32,1,1,1,0,0,0,2,4,2,1,16,8,8,75,1024,369098752,550024249344,1490,5.29101,64.9687,103955
1,CUTLASS,gemm,cutlass_tensorop_h1688gemm_256x128_32x2_nn_align8,not_verified,success,universal,16384,8192,2048,f16:column,f16:column,f16:column,f16:column,1,0,serial,1,1,heuristic,invalid,invalid,false,false,1,tensorop,f16,256,128,32,1,1,1,0,0,0,2,4,2,1,16,8,8,75,1024,369098752,550024249344,1490,4.32265,79.5231,127243
1,CUTLASS,gemm,cutlass_tensorop_h1688gemm_256x128_32x2_nt_align8,not_verified,success,universal,16384,8192,2048,f16:column,f16:row,f16:column,f16:column,1,0,serial,1,1,heuristic,invalid,invalid,false,false,1,tensorop,f16,256,128,32,1,1,1,0,0,0,2,4,2,1,16,8,8,75,1024,369098752,550024249344,1490,4.02364,85.4326,136698
1,CUTLASS,gemm,cutlass_tensorop_h1688gemm_256x128_32x2_tn_align8,not_verified,success,universal,16384,8192,2048,f16:row,f16:column,f16:column,f16:column,1,0,serial,1,1,heuristic,invalid,invalid,false,false,1,tensorop,f16,256,128,32,1,1,1,0,0,0,2,4,2,1,16,8,8,75,1024,369098752,550024249344,1490,4.43221,77.5572,124097
1,CUTLASS,gemm,cutlass_tensorop_h1688gemm_256x128_32x2_tt_align8,not_verified,success,universal,16384,8192,2048,f16:row,f16:row,f16:column,f16:column,1,0,serial,1,1,heuristic,invalid,invalid,false,false,1,tensorop,f16,256,128,32,1,1,1,0,0,0,2,4,2,1,16,8,8,75,1024,369098752,550024249344,1490,4.08201,84.2111,134744
1,CUTLASS,gemm,cutlass_tensorop_i8816gemm_s8_256x128_64x2_tn_align16,not_verified,success,universal,16384,8192,2048,s8:row,s8:column,s32:column,s32:column,1,0,serial,1,1,heuristic,invalid,invalid,false,false,1,tensorop,s32,256,128,64,1,1,1,0,0,0,2,4,2,1,8,8,16,75,1024,587202560,550024249344,936,2.58628,211.452,212670
1,CUTLASS,gemm,cutlass_tensorop_s8_i8816gemm_s8_256x128_64x2_tn_align16,not_verified,success,universal,16384,8192,2048,s8:row,s8:column,s8:column,s8:column,1,0,serial,1,1,heuristic,invalid,invalid,false,false,1,tensorop,s32,256,128,64,1,1,1,0,0,0,2,4,2,1,8,8,16,75,1024,184549376,550024249344,2980,2.09886,81.8897,262059
1,CUTLASS,gemm,cutlass_tensorop_i8816gemm_u8_256x128_64x2_tn_align16,not_verified,success,universal,16384,8192,2048,u8:row,u8:column,s32:column,s32:column,1,0,serial,1,1,heuristic,invalid,invalid,false,false,1,tensorop,s32,256,128,64,1,1,1,0,0,0,2,4,2,1,8,8,16,75,1024,587202560,550024249344,936,2.65387,206.067,207254
1,CUTLASS,gemm,cutlass_tensorop_u8_i8816gemm_u8_256x128_64x2_tn_align16,not_verified,success,universal,16384,8192,2048,u8:row,u8:column,u8:column,u8:column,1,0,serial,1,1,heuristic,invalid,invalid,false,false,1,tensorop,s32,256,128,64,1,1,1,0,0,0,2,4,2,1,8,8,16,75,1024,184549376,550024249344,2980,2.03264,84.5575,270596
1,CUTLASS,gemm,cutlass_tensorop_s8_i8816gemm_s8_256x128_64x2_n32t32_align16,not_verified,success,universal,16384,8192,2048,s8:nk32,s8:tk32,s8:nk32,s8:nk32,1,0,serial,1,1,heuristic,invalid,invalid,false,false,1,tensorop,s32,256,128,64,1,1,1,0,0,0,2,4,2,1,8,8,16,75,1024,184549376,550024249344,2980,2.0009,85.899,274889
1,CUTLASS,gemm,cutlass_tensorop_u8_i8816gemm_u8_256x128_64x2_n32t32_align16,not_verified,success,universal,16384,8192,2048,u8:nk32,u8:tk32,u8:nk32,u8:nk32,1,0,serial,1,1,heuristic,invalid,invalid,false,false,1,tensorop,s32,256,128,64,1,1,1,0,0,0,2,4,2,1,8,8,16,75,1024,184549376,550024249344,2980,1.94389,88.4179,282950
1,CUTLASS,gemm,cutlass_tensorop_i8832gemm_s4_256x128_128x2_tn_align32,not_verified,success,universal,16384,8192,2048,s4:row,s4:column,s32:column,s32:column,1,0,serial,1,1,heuristic,invalid,invalid,false,false,1,tensorop,s32,256,128,128,1,1,1,0,0,0,2,4,2,1,8,8,32,75,1024,562036736,550024249344,978,1.69609,308.615,324290
1,CUTLASS,gemm,cutlass_tensorop_s4_i8832gemm_s4_256x128_128x2_tn_align32,not_verified,success,universal,16384,8192,2048,s4:row,s4:column,s4:column,s4:column,1,0,serial,1,1,heuristic,invalid,invalid,false,false,1,tensorop,s32,256,128,128,1,1,1,0,0,0,2,4,2,1,8,8,32,75,1024,92274688,550024249344,5960,1.14176,75.2676,481734
1,CUTLASS,gemm,cutlass_tensorop_i8832gemm_u4_256x128_128x2_tn_align32,not_verified,success,universal,16384,8192,2048,u4:row,u4:column,s32:column,s32:column,1,0,serial,1,1,heuristic,invalid,invalid,false,false,1,tensorop,s32,256,128,128,1,1,1,0,0,0,2,4,2,1,8,8,32,75,1024,562036736,550024249344,978,1.6838,310.867,326657
1,CUTLASS,gemm,cutlass_tensorop_u4_i8832gemm_u4_256x128_128x2_tn_align32,not_verified,success,universal,16384,8192,2048,u4:row,u4:column,u4:column,u4:column,1,0,serial,1,1,heuristic,invalid,invalid,false,false,1,tensorop,s32,256,128,128,1,1,1,0,0,0,2,4,2,1,8,8,32,75,1024,92274688,550024249344,5960,1.08817,78.9743,505458
1,CUTLASS,gemm,cutlass_tensorop_s4_i8832gemm_s4_256x128_128x2_n64t64_align32,not_verified,success,universal,16384,8192,2048,s4:nk64,s4:tk64,s4:nk64,s4:nk64,1,0,serial,1,1,heuristic,invalid,invalid,false,false,1,tensorop,s32,256,128,128,1,1,1,0,0,0,2,4,2,1,8,8,32,75,1024,92274688,550024249344,5960,1.06018,81.0592,518802
1,CUTLASS,gemm,cutlass_tensorop_u4_i8832gemm_u4_256x128_128x2_n64t64_align32,not_verified,success,universal,16384,8192,2048,u4:nk64,u4:tk64,u4:nk64,u4:nk64,1,0,serial,1,1,heuristic,invalid,invalid,false,false,1,tensorop,s32,256,128,128,1,1,1,0,0,0,2,4,2,1,8,8,32,75,1024,92274688,550024249344,5960,1.00796,85.2591,545682
1,CUTLASS,gemm,cutlass_tensorop_i88128xorgemm_b1_256x128_512x2_tn_align128,not_verified,success,universal,16384,8192,2048,b1:row,b1:column,s32:column,s32:column,1,0,serial,1,1,heuristic,invalid,invalid,false,false,1,tensorop,s32,256,128,512,1,1,1,0,0,0,2,4,2,1,8,8,128,75,1024,543162368,550024249344,1012,1.06701,474.091,515483
1,CUTLASS,gemm,cutlass_tensorop_s16816gemm_f16_256x128_32x3_nn_align8,not_verified,success,universal,16384,8192,2048,f16:column,f16:column,f32:column,f32:column,1,0,serial,1,1,heuristic,invalid,invalid,false,false,1,tensorop,f32,256,128,32,1,1,1,0,0,0,3,4,2,1,16,8,16,80,1024,637534208,550024249344,862,4.09463,145.007,134328
1,CUTLASS,gemm,cutlass_tensorop_s16816gemm_f16_256x128_32x3_nt_align8,not_verified,success,universal,16384,8192,2048,f16:column,f16:row,f32:column,f32:column,1,0,serial,1,1,heuristic,invalid,invalid,false,false,1,tensorop,f32,256,128,32,1,1,1,0,0,0,3,4,2,1,16,8,16,80,1024,637534208,550024249344,862,3.93353,150.946,139830
1,CUTLASS,gemm,cutlass_tensorop_s16816gemm_f16_256x128_32x3_tn_align8,not_verified,success,universal,16384,8192,2048,f16:row,f16:column,f32:column,f32:column,1,0,serial,1,1,heuristic,invalid,invalid,false,false,1,tensorop,f32,256,128,32,1,1,1,0,0,0,3,4,2,1,16,8,16,80,1024,637534208,550024249344,862,4.30421,137.946,127787
1,CUTLASS,gemm,cutlass_tensorop_s16816gemm_f16_256x128_32x3_tt_align8,not_verified,success,universal,16384,8192,2048,f16:row,f16:row,f32:column,f32:column,1,0,serial,1,1,heuristic,invalid,invalid,false,false,1,tensorop,f32,256,128,32,1,1,1,0,0,0,3,4,2,1,16,8,16,80,1024,637534208,550024249344,862,4.12501,143.939,133339
1,CUTLASS,gemm,cutlass_tensorop_f16_s16816gemm_f16_256x128_32x3_nn_align8,not_verified,success,universal,16384,8192,2048,f16:column,f16:column,f16:column,f16:column,1,0,serial,1,1,heuristic,invalid,invalid,false,false,1,tensorop,f32,256,128,32,1,1,1,0,0,0,3,4,2,1,16,8,16,80,1024,369098752,550024249344,1490,3.83351,89.6697,143478
1,CUTLASS,gemm,cutlass_tensorop_f16_s16816gemm_f16_256x128_32x3_nt_align8,not_verified,success,universal,16384,8192,2048,f16:column,f16:row,f16:column,f16:column,1,0,serial,1,1,heuristic,invalid,invalid,false,false,1,tensorop,f32,256,128,32,1,1,1,0,0,0,3,4,2,1,16,8,16,80,1024,369098752,550024249344,1490,3.73453,92.0464,147281
1,CUTLASS,gemm,cutlass_tensorop_f16_s16816gemm_f16_256x128_32x3_tn_align8,not_verified,success,universal,16384,8192,2048,f16:row,f16:column,f16:column,f16:column,1,0,serial,1,1,heuristic,invalid,invalid,false,false,1,tensorop,f32,256,128,32,1,1,1,0,0,0,3,4,2,1,16,8,16,80,1024,369098752,550024249344,1490,3.89222,88.3171,141314
1,CUTLASS,gemm,cutlass_tensorop_f16_s16816gemm_f16_256x128_32x3_tt_align8,not_verified,success,universal,16384,8192,2048,f16:row,f16:row,f16:column,f16:column,1,0,serial,1,1,heuristic,invalid,invalid,false,false,1,tensorop,f32,256,128,32,1,1,1,0,0,0,3,4,2,1,16,8,16,80,1024,369098752,550024249344,1490,3.79426,90.5973,144962
1,CUTLASS,gemm,cutlass_tensorop_h16816gemm_256x128_32x3_nn_align8,not_verified,success,universal,16384,8192,2048,f16:column,f16:column,f16:column,f16:column,1,0,serial,1,1,heuristic,invalid,invalid,false,false,1,tensorop,f16,256,128,32,1,1,1,0,0,0,3,4,2,1,16,8,16,80,1024,369098752,550024249344,1490,3.76934,91.1962,145920
1,CUTLASS,gemm,cutlass_tensorop_h16816gemm_256x128_32x3_nt_align8,not_verified,success,universal,16384,8192,2048,f16:column,f16:row,f16:column,f16:column,1,0,serial,1,1,heuristic,invalid,invalid,false,false,1,tensorop,f16,256,128,32,1,1,1,0,0,0,3,4,2,1,16,8,16,80,1024,369098752,550024249344,1490,3.6922,93.1016,148969
1,CUTLASS,gemm,cutlass_tensorop_h16816gemm_256x128_32x3_tn_align8,not_verified,success,universal,16384,8192,2048,f16:row,f16:column,f16:column,f16:column,1,0,serial,1,1,heuristic,invalid,invalid,false,false,1,tensorop,f16,256,128,32,1,1,1,0,0,0,3,4,2,1,16,8,16,80,1024,369098752,550024249344,1490,3.80518,90.3373,144546
1,CUTLASS,gemm,cutlass_tensorop_h16816gemm_256x128_32x3_tt_align8,not_verified,success,universal,16384,8192,2048,f16:row,f16:row,f16:column,f16:column,1,0,serial,1,1,heuristic,invalid,invalid,false,false,1,tensorop,f16,256,128,32,1,1,1,0,0,0,3,4,2,1,16,8,16,80,1024,369098752,550024249344,1490,3.70927,92.6732,148284
1,CUTLASS,gemm,cutlass_tensorop_s16816gemm_bf16_256x128_32x3_nn_align8,not_verified,success,universal,16384,8192,2048,bf16:column,bf16:column,f32:column,f32:column,1,0,serial,1,1,heuristic,invalid,invalid,false,false,1,tensorop,f32,256,128,32,1,1,1,0,0,0,3,4,2,1,16,8,16,80,1024,637534208,550024249344,862,4.03934,146.992,136167
1,CUTLASS,gemm,cutlass_tensorop_s16816gemm_bf16_256x128_32x3_nt_align8,not_verified,success,universal,16384,8192,2048,bf16:column,bf16:row,f32:column,f32:column,1,0,serial,1,1,heuristic,invalid,invalid,false,false,1,tensorop,f32,256,128,32,1,1,1,0,0,0,3,4,2,1,16,8,16,80,1024,637534208,550024249344,862,3.88267,152.923,141661
1,CUTLASS,gemm,cutlass_tensorop_s16816gemm_bf16_256x128_32x3_tn_align8,not_verified,success,universal,16384,8192,2048,bf16:row,bf16:column,f32:column,f32:column,1,0,serial,1,1,heuristic,invalid,invalid,false,false,1,tensorop,f32,256,128,32,1,1,1,0,0,0,3,4,2,1,16,8,16,80,1024,637534208,550024249344,862,4.25745,139.461,129191
1,CUTLASS,gemm,cutlass_tensorop_s16816gemm_bf16_256x128_32x3_tt_align8,not_verified,success,universal,16384,8192,2048,bf16:row,bf16:row,f32:column,f32:column,1,0,serial,1,1,heuristic,invalid,invalid,false,false,1,tensorop,f32,256,128,32,1,1,1,0,0,0,3,4,2,1,16,8,16,80,1024,637534208,550024249344,862,4.05606,146.386,135605
1,CUTLASS,gemm,cutlass_tensorop_bf16_s16816gemm_bf16_256x128_32x3_nn_align8,not_verified,success,universal,16384,8192,2048,bf16:column,bf16:column,bf16:column,bf16:column,1,0,serial,1,1,heuristic,invalid,invalid,false,false,1,tensorop,f32,256,128,32,1,1,1,0,0,0,3,4,2,1,16,8,16,80,1024,369098752,550024249344,1490,3.79802,90.5078,144819
1,CUTLASS,gemm,cutlass_tensorop_bf16_s16816gemm_bf16_256x128_32x3_nt_align8,not_verified,success,universal,16384,8192,2048,bf16:column,bf16:row,bf16:column,bf16:column,1,0,serial,1,1,heuristic,invalid,invalid,false,false,1,tensorop,f32,256,128,32,1,1,1,0,0,0,3,4,2,1,16,8,16,80,1024,369098752,550024249344,1490,3.7079,92.7074,148338
1,CUTLASS,gemm,cutlass_tensorop_bf16_s16816gemm_bf16_256x128_32x3_tn_align8,not_verified,success,universal,16384,8192,2048,bf16:row,bf16:column,bf16:column,bf16:column,1,0,serial,1,1,heuristic,invalid,invalid,false,false,1,tensorop,f32,256,128,32,1,1,1,0,0,0,3,4,2,1,16,8,16,80,1024,369098752,550024249344,1490,3.87379,88.7373,141986
1,CUTLASS,gemm,cutlass_tensorop_bf16_s16816gemm_bf16_256x128_32x3_tt_align8,not_verified,success,universal,16384,8192,2048,bf16:row,bf16:row,bf16:column,bf16:column,1,0,serial,1,1,heuristic,invalid,invalid,false,false,1,tensorop,f32,256,128,32,1,1,1,0,0,0,3,4,2,1,16,8,16,80,1024,369098752,550024249344,1490,3.78231,90.8835,145420
1,CUTLASS,gemm,cutlass_tensorop_s1688gemm_tf32_256x128_16x3_nn_align4,not_verified,success,universal,16384,8192,2048,tf32:column,tf32:column,f32:column,f32:column,1,0,serial,1,1,heuristic,invalid,invalid,false,false,1,tensorop,f32,256,128,16,1,1,1,0,0,0,3,4,2,1,16,8,8,80,1024,738197504,550024249344,745,7.3827,93.1231,74501.8
1,CUTLASS,gemm,cutlass_tensorop_s1688gemm_tf32_256x128_16x3_nt_align4,not_verified,success,universal,16384,8192,2048,tf32:column,tf32:row,f32:column,f32:column,1,0,serial,1,1,heuristic,invalid,invalid,false,false,1,tensorop,f32,256,128,16,1,1,1,0,0,0,3,4,2,1,16,8,8,80,1024,738197504,550024249344,745,7.37792,93.1834,74550
1,CUTLASS,gemm,cutlass_tensorop_s1688gemm_tf32_256x128_16x3_tn_align4,not_verified,success,universal,16384,8192,2048,tf32:row,tf32:column,f32:column,f32:column,1,0,serial,1,1,heuristic,invalid,invalid,false,false,1,tensorop,f32,256,128,16,1,1,1,0,0,0,3,4,2,1,16,8,8,80,1024,738197504,550024249344,745,7.73564,88.8744,71102.6
1,CUTLASS,gemm,cutlass_tensorop_s1688gemm_tf32_256x128_16x3_tt_align4,not_verified,success,universal,16384,8192,2048,tf32:row,tf32:row,f32:column,f32:column,1,0,serial,1,1,heuristic,invalid,invalid,false,false,1,tensorop,f32,256,128,16,1,1,1,0,0,0,3,4,2,1,16,8,8,80,1024,738197504,550024249344,745,7.49397,91.7404,73395.5
1,CUTLASS,gemm,cutlass_tensorop_tf32_s1688gemm_tf32_256x128_16x3_nn_align4,not_verified,success,universal,16384,8192,2048,tf32:column,tf32:column,tf32:column,tf32:column,1,0,serial,1,1,heuristic,invalid,invalid,false,false,1,tensorop,f32,256,128,16,1,1,1,0,0,0,3,4,2,1,16,8,8,80,1024,738197504,550024249344,745,7.83462,87.7515,70204.3
1,CUTLASS,gemm,cutlass_tensorop_tf32_s1688gemm_tf32_256x128_16x3_nt_align4,not_verified,success,universal,16384,8192,2048,tf32:column,tf32:row,tf32:column,tf32:column,1,0,serial,1,1,heuristic,invalid,invalid,false,false,1,tensorop,f32,256,128,16,1,1,1,0,0,0,3,4,2,1,16,8,8,80,1024,738197504,550024249344,745,7.76875,88.4956,70799.6
1,CUTLASS,gemm,cutlass_tensorop_tf32_s1688gemm_tf32_256x128_16x3_tn_align4,not_verified,success,universal,16384,8192,2048,tf32:row,tf32:column,tf32:column,tf32:column,1,0,serial,1,1,heuristic,invalid,invalid,false,false,1,tensorop,f32,256,128,16,1,1,1,0,0,0,3,4,2,1,16,8,8,80,1024,738197504,550024249344,745,7.82029,87.9124,70333
1,CUTLASS,gemm,cutlass_tensorop_tf32_s1688gemm_tf32_256x128_16x3_tt_align4,not_verified,success,universal,16384,8192,2048,tf32:row,tf32:row,tf32:column,tf32:column,1,0,serial,1,1,heuristic,invalid,invalid,false,false,1,tensorop,f32,256,128,16,1,1,1,0,0,0,3,4,2,1,16,8,8,80,1024,738197504,550024249344,745,7.81175,88.0084,70409.8
1,CUTLASS,gemm,cutlass_tensorop_s1688tf32gemm_256x128_16x3_nn_align4,not_verified,success,universal,16384,8192,2048,f32:column,f32:column,f32:column,f32:column,1,0,serial,1,1,heuristic,invalid,invalid,false,false,1,tensorop,f32,256,128,16,1,1,1,0,0,0,3,4,2,1,16,8,8,80,1024,738197504,550024249344,745,7.77387,88.4373,70753
1,CUTLASS,gemm,cutlass_tensorop_s1688tf32gemm_256x128_16x3_nt_align4,not_verified,success,universal,16384,8192,2048,f32:column,f32:row,f32:column,f32:column,1,0,serial,1,1,heuristic,invalid,invalid,false,false,1,tensorop,f32,256,128,16,1,1,1,0,0,0,3,4,2,1,16,8,8,80,1024,738197504,550024249344,745,7.59228,90.5525,72445.2
1,CUTLASS,gemm,cutlass_tensorop_s1688tf32gemm_256x128_16x3_tn_align4,not_verified,success,universal,16384,8192,2048,f32:row,f32:column,f32:column,f32:column,1,0,serial,1,1,heuristic,invalid,invalid,false,false,1,tensorop,f32,256,128,16,1,1,1,0,0,0,3,4,2,1,16,8,8,80,1024,738197504,550024249344,745,7.78889,88.2668,70616.6
1,CUTLASS,gemm,cutlass_tensorop_s1688tf32gemm_256x128_16x3_tt_align4,not_verified,success,universal,16384,8192,2048,f32:row,f32:row,f32:column,f32:column,1,0,serial,1,1,heuristic,invalid,invalid,false,false,1,tensorop,f32,256,128,16,1,1,1,0,0,0,3,4,2,1,16,8,8,80,1024,738197504,550024249344,745,7.62743,90.1352,72111.3
1,CUTLASS,gemm,cutlass_tensorop_s1688f16gemm_256x128_16x3_nn_align4,not_verified,success,universal,16384,8192,2048,f32:column,f32:column,f32:column,f32:column,1,0,serial,1,1,heuristic,invalid,invalid,false,false,1,tensorop,f32,256,128,16,1,1,1,0,0,0,3,4,2,1,16,8,8,75,1024,738197504,550024249344,745,5.8368,117.787,94233.9
1,CUTLASS,gemm,cutlass_tensorop_s1688f16gemm_256x128_16x3_nt_align4,not_verified,success,universal,16384,8192,2048,f32:column,f32:row,f32:column,f32:column,1,0,serial,1,1,heuristic,invalid,invalid,false,false,1,tensorop,f32,256,128,16,1,1,1,0,0,0,3,4,2,1,16,8,8,75,1024,738197504,550024249344,745,6.21739,110.577,88465.5
1,CUTLASS,gemm,cutlass_tensorop_s1688f16gemm_256x128_16x3_tn_align4,not_verified,success,universal,16384,8192,2048,f32:row,f32:column,f32:column,f32:column,1,0,serial,1,1,heuristic,invalid,invalid,false,false,1,tensorop,f32,256,128,16,1,1,1,0,0,0,3,4,2,1,16,8,8,75,1024,738197504,550024249344,745,5.70061,120.601,96485.2
1,CUTLASS,gemm,cutlass_tensorop_s1688f16gemm_256x128_16x3_tt_align4,not_verified,success,universal,16384,8192,2048,f32:row,f32:row,f32:column,f32:column,1,0,serial,1,1,heuristic,invalid,invalid,false,false,1,tensorop,f32,256,128,16,1,1,1,0,0,0,3,4,2,1,16,8,8,75,1024,738197504,550024249344,745,5.99142,114.747,91801.9
1,CUTLASS,gemm,cutlass_tensorop_s1688bf16gemm_256x128_16x3_nn_align4,not_verified,success,universal,16384,8192,2048,f32:column,f32:column,f32:column,f32:column,1,0,serial,1,1,heuristic,invalid,invalid,false,false,1,tensorop,f32,256,128,16,1,1,1,0,0,0,3,4,2,1,16,8,8,80,1024,738197504,550024249344,745,5.84124,117.698,94162.3
1,CUTLASS,gemm,cutlass_tensorop_s1688bf16gemm_256x128_16x3_nt_align4,not_verified,success,universal,16384,8192,2048,f32:column,f32:row,f32:column,f32:column,1,0,serial,1,1,heuristic,invalid,invalid,false,false,1,tensorop,f32,256,128,16,1,1,1,0,0,0,3,4,2,1,16,8,8,80,1024,738197504,550024249344,745,6.16277,111.557,89249.5
1,CUTLASS,gemm,cutlass_tensorop_s1688bf16gemm_256x128_16x3_tn_align4,not_verified,success,universal,16384,8192,2048,f32:row,f32:column,f32:column,f32:column,1,0,serial,1,1,heuristic,invalid,invalid,false,false,1,tensorop,f32,256,128,16,1,1,1,0,0,0,3,4,2,1,16,8,8,80,1024,738197504,550024249344,745,5.64531,121.782,97430.3
1,CUTLASS,gemm,cutlass_tensorop_s1688bf16gemm_256x128_16x3_tt_align4,not_verified,success,universal,16384,8192,2048,f32:row,f32:row,f32:column,f32:column,1,0,serial,1,1,heuristic,invalid,invalid,false,false,1,tensorop,f32,256,128,16,1,1,1,0,0,0,3,4,2,1,16,8,8,80,1024,738197504,550024249344,745,5.95866,115.378,92306.8
1,CUTLASS,gemm,cutlass_tensorop_s1688gemm_128x128_16x4_nn_align4,not_verified,success,universal,16384,8192,2048,f32:column,f32:column,f32:column,f32:column,1,0,serial,1,1,heuristic,invalid,invalid,false,false,1,tensorop,f32,128,128,16,1,1,1,0,0,0,4,4,2,1,16,8,8,80,1024,738197504,550024249344,745,24.5603,27.9923,22394.9
1,CUTLASS,gemm,cutlass_tensorop_s1688gemm_128x128_16x4_nt_align4,not_verified,success,universal,16384,8192,2048,f32:column,f32:row,f32:column,f32:column,1,0,serial,1,1,heuristic,invalid,invalid,false,false,1,tensorop,f32,128,128,16,1,1,1,0,0,0,4,4,2,1,16,8,8,80,1024,738197504,550024249344,745,24.8552,27.6602,22129.1
1,CUTLASS,gemm,cutlass_tensorop_s1688gemm_128x128_16x4_tn_align4,not_verified,success,universal,16384,8192,2048,f32:row,f32:column,f32:column,f32:column,1,0,serial,1,1,heuristic,invalid,invalid,false,false,1,tensorop,f32,128,128,16,1,1,1,0,0,0,4,4,2,1,16,8,8,80,1024,738197504,550024249344,745,22.0095,31.2365,24990.3
1,CUTLASS,gemm,cutlass_tensorop_s1688gemm_128x128_16x4_tt_align4,not_verified,success,universal,16384,8192,2048,f32:row,f32:row,f32:column,f32:column,1,0,serial,1,1,heuristic,invalid,invalid,false,false,1,tensorop,f32,128,128,16,1,1,1,0,0,0,4,4,2,1,16,8,8,80,1024,738197504,550024249344,745,22.9222,29.9927,23995.2
1,CUTLASS,gemm,cutlass_tensorop_c1688gemm_128x64_16x3_nn_align1,not_verified,success,universal,16384,8192,2048,cf32:column,cf32:column,cf32:column,cf32:column,1,0,serial,1,1,heuristic,invalid,invalid,false,false,1,tensorop,cf32,128,64,16,1,1,1,0,0,0,3,4,2,1,16,8,8,80,1024,1476395008,2200096997376,1490,95.6781,14.3711,22994.8
1,CUTLASS,gemm,cutlass_tensorop_c1688gemm_128x64_16x3_cn_align1,not_verified,success,universal,16384,8192,2048,cf32:column,cf32:column,cf32:column,cf32:column,1,0,serial,1,1,heuristic,invalid,invalid,false,false,1,tensorop,cf32,128,64,16,1,1,1,0,0,0,3,4,2,1,16,8,8,80,1024,1476395008,2200096997376,1490,91.4842,15.0299,24048.9
1,CUTLASS,gemm,cutlass_tensorop_c1688gemm_128x64_16x3_nc_align1,not_verified,success,universal,16384,8192,2048,cf32:column,cf32:column,cf32:column,cf32:column,1,0,serial,1,1,heuristic,invalid,invalid,false,false,1,tensorop,cf32,128,64,16,1,1,1,0,0,0,3,4,2,1,16,8,8,80,1024,1476395008,2200096997376,1490,90.881,15.1297,24208.5
1,CUTLASS,gemm,cutlass_tensorop_c1688gemm_128x64_16x3_cc_align1,not_verified,success,universal,16384,8192,2048,cf32:column,cf32:column,cf32:column,cf32:column,1,0,serial,1,1,heuristic,invalid,invalid,false,false,1,tensorop,cf32,128,64,16,1,1,1,0,0,0,3,4,2,1,16,8,8,80,1024,1476395008,2200096997376,1490,92.9137,14.7987,23678.9
1,CUTLASS,gemm,cutlass_tensorop_c1688gemm_128x64_16x3_nt_align1,not_verified,success,universal,16384,8192,2048,cf32:column,cf32:row,cf32:column,cf32:column,1,0,serial,1,1,heuristic,invalid,invalid,false,false,1,tensorop,cf32,128,64,16,1,1,1,0,0,0,3,4,2,1,16,8,8,80,1024,1476395008,2200096997376,1490,90.9373,15.1203,24193.5
1,CUTLASS,gemm,cutlass_tensorop_c1688gemm_128x64_16x3_ct_align1,not_verified,success,universal,16384,8192,2048,cf32:column,cf32:row,cf32:column,cf32:column,1,0,serial,1,1,heuristic,invalid,invalid,false,false,1,tensorop,cf32,128,64,16,1,1,1,0,0,0,3,4,2,1,16,8,8,80,1024,1476395008,2200096997376,1490,91.2985,15.0605,24097.9
1,CUTLASS,gemm,cutlass_tensorop_c1688gemm_128x64_16x3_nh_align1,not_verified,success,universal,16384,8192,2048,cf32:column,cf32:row,cf32:column,cf32:column,1,0,serial,1,1,heuristic,invalid,invalid,false,false,1,tensorop,cf32,128,64,16,1,1,1,0,0,0,3,4,2,1,16,8,8,80,1024,1476395008,2200096997376,1490,90.4974,15.1938,24311.2
1,CUTLASS,gemm,cutlass_tensorop_c1688gemm_128x64_16x3_ch_align1,not_verified,success,universal,16384,8192,2048,cf32:column,cf32:row,cf32:column,cf32:column,1,0,serial,1,1,heuristic,invalid,invalid,false,false,1,tensorop,cf32,128,64,16,1,1,1,0,0,0,3,4,2,1,16,8,8,80,1024,1476395008,2200096997376,1490,89.1921,15.4162,24666.9
1,CUTLASS,gemm,cutlass_tensorop_c1688gemm_128x64_16x3_tn_align1,not_verified,success,universal,16384,8192,2048,cf32:row,cf32:column,cf32:column,cf32:column,1,0,serial,1,1,heuristic,invalid,invalid,false,false,1,tensorop,cf32,128,64,16,1,1,1,0,0,0,3,4,2,1,16,8,8,80,1024,1476395008,2200096997376,1490,91.8009,14.9781,23966
1,CUTLASS,gemm,cutlass_tensorop_c1688gemm_128x64_16x3_hn_align1,not_verified,success,universal,16384,8192,2048,cf32:row,cf32:column,cf32:column,cf32:column,1,0,serial,1,1,heuristic,invalid,invalid,false,false,1,tensorop,cf32,128,64,16,1,1,1,0,0,0,3,4,2,1,16,8,8,80,1024,1476395008,2200096997376,1490,93.7236,14.6708,23474.3
1,CUTLASS,gemm,cutlass_tensorop_c1688gemm_128x64_16x3_tc_align1,not_verified,success,universal,16384,8192,2048,cf32:row,cf32:column,cf32:column,cf32:column,1,0,serial,1,1,heuristic,invalid,invalid,false,false,1,tensorop,cf32,128,64,16,1,1,1,0,0,0,3,4,2,1,16,8,8,80,1024,1476395008,2200096997376,1490,91.9757,14.9496,23920.4
1,CUTLASS,gemm,cutlass_tensorop_c1688gemm_128x64_16x3_hc_align1,not_verified,success,universal,16384,8192,2048,cf32:row,cf32:column,cf32:column,cf32:column,1,0,serial,1,1,heuristic,invalid,invalid,false,false,1,tensorop,cf32,128,64,16,1,1,1,0,0,0,3,4,2,1,16,8,8,80,1024,1476395008,2200096997376,1490,91.2312,15.0716,24115.6
1,CUTLASS,gemm,cutlass_tensorop_c1688gemm_128x64_16x3_tt_align1,not_verified,success,universal,16384,8192,2048,cf32:row,cf32:row,cf32:column,cf32:column,1,0,serial,1,1,heuristic,invalid,invalid,false,false,1,tensorop,cf32,128,64,16,1,1,1,0,0,0,3,4,2,1,16,8,8,80,1024,1476395008,2200096997376,1490,94.5811,14.5378,23261.5
1,CUTLASS,gemm,cutlass_tensorop_c1688gemm_128x64_16x3_ht_align1,not_verified,success,universal,16384,8192,2048,cf32:row,cf32:row,cf32:column,cf32:column,1,0,serial,1,1,heuristic,invalid,invalid,false,false,1,tensorop,cf32,128,64,16,1,1,1,0,0,0,3,4,2,1,16,8,8,80,1024,1476395008,2200096997376,1490,92.2696,14.902,23844.2
1,CUTLASS,gemm,cutlass_tensorop_c1688gemm_128x64_16x3_th_align1,not_verified,success,universal,16384,8192,2048,cf32:row,cf32:row,cf32:column,cf32:column,1,0,serial,1,1,heuristic,invalid,invalid,false,false,1,tensorop,cf32,128,64,16,1,1,1,0,0,0,3,4,2,1,16,8,8,80,1024,1476395008,2200096997376,1490,89.5543,15.3538,24567.2
1,CUTLASS,gemm,cutlass_tensorop_c1688gemm_128x64_16x3_hh_align1,not_verified,success,universal,16384,8192,2048,cf32:row,cf32:row,cf32:column,cf32:column,1,0,serial,1,1,heuristic,invalid,invalid,false,false,1,tensorop,cf32,128,64,16,1,1,1,0,0,0,3,4,2,1,16,8,8,80,1024,1476395008,2200096997376,1490,93.0714,14.7736,23638.8
1,CUTLASS,gemm,cutlass_tensorop_d884gemm_128x128_16x3_nn_align1,not_verified,success,universal,16384,8192,2048,f64:column,f64:column,f64:column,f64:column,1,0,serial,1,1,heuristic,invalid,invalid,false,false,1,tensorop,f64,128,128,16,1,1,1,0,0,0,3,4,2,1,8,8,4,80,1024,1476395008,550024249344,372,1005.79,1.36708,546.858
1,CUTLASS,gemm,cutlass_tensorop_d884gemm_128x128_16x3_nt_align1,not_verified,success,universal,16384,8192,2048,f64:column,f64:row,f64:column,f64:column,1,0,serial,1,1,heuristic,invalid,invalid,false,false,1,tensorop,f64,128,128,16,1,1,1,0,0,0,3,4,2,1,8,8,4,80,1024,1476395008,550024249344,372,1005.79,1.36708,546.855
1,CUTLASS,gemm,cutlass_tensorop_d884gemm_128x128_16x3_tn_align1,not_verified,success,universal,16384,8192,2048,f64:row,f64:column,f64:column,f64:column,1,0,serial,1,1,heuristic,invalid,invalid,false,false,1,tensorop,f64,128,128,16,1,1,1,0,0,0,3,4,2,1,8,8,4,80,1024,1476395008,550024249344,372,1005.93,1.36689,546.779
1,CUTLASS,gemm,cutlass_tensorop_d884gemm_128x128_16x3_tt_align1,not_verified,success,universal,16384,8192,2048,f64:row,f64:row,f64:column,f64:column,1,0,serial,1,1,heuristic,invalid,invalid,false,false,1,tensorop,f64,128,128,16,1,1,1,0,0,0,3,4,2,1,8,8,4,80,1024,1476395008,550024249344,372,1005.93,1.36689,546.782
1,CUTLASS,gemm,cutlass_tensorop_z884gemm_128x64_8x3_nn_align1,not_verified,success,universal,16384,8192,2048,cf64:column,cf64:column,cf64:column,cf64:column,1,0,serial,1,1,heuristic,invalid,invalid,false,false,1,tensorop,cf64,128,64,8,1,1,1,0,0,0,3,4,2,1,8,8,4,80,1024,2952790016,2200096997376,745,4021.28,0.683862,547.113
1,CUTLASS,gemm,cutlass_tensorop_z884gemm_128x64_8x3_cn_align1,not_verified,success,universal,16384,8192,2048,cf64:column,cf64:column,cf64:column,cf64:column,1,0,serial,1,1,heuristic,invalid,invalid,false,false,1,tensorop,cf64,128,64,8,1,1,1,0,0,0,3,4,2,1,8,8,4,80,1024,2952790016,2200096997376,745,4021.26,0.683865,547.116
1,CUTLASS,gemm,cutlass_tensorop_z884gemm_128x64_8x3_nc_align1,not_verified,success,universal,16384,8192,2048,cf64:column,cf64:column,cf64:column,cf64:column,1,0,serial,1,1,heuristic,invalid,invalid,false,false,1,tensorop,cf64,128,64,8,1,1,1,0,0,0,3,4,2,1,8,8,4,80,1024,2952790016,2200096997376,745,4021.26,0.683865,547.116
1,CUTLASS,gemm,cutlass_tensorop_z884gemm_128x64_8x3_cc_align1,not_verified,success,universal,16384,8192,2048,cf64:column,cf64:column,cf64:column,cf64:column,1,0,serial,1,1,heuristic,invalid,invalid,false,false,1,tensorop,cf64,128,64,8,1,1,1,0,0,0,3,4,2,1,8,8,4,80,1024,2952790016,2200096997376,745,4021.31,0.683856,547.109
1,CUTLASS,gemm,cutlass_tensorop_z884gemm_128x64_8x3_nt_align1,not_verified,success,universal,16384,8192,2048,cf64:column,cf64:row,cf64:column,cf64:column,1,0,serial,1,1,heuristic,invalid,invalid,false,false,1,tensorop,cf64,128,64,8,1,1,1,0,0,0,3,4,2,1,8,8,4,80,1024,2952790016,2200096997376,745,4021.24,0.683869,547.119
1,CUTLASS,gemm,cutlass_tensorop_z884gemm_128x64_8x3_ct_align1,not_verified,success,universal,16384,8192,2048,cf64:column,cf64:row,cf64:column,cf64:column,1,0,serial,1,1,heuristic,invalid,invalid,false,false,1,tensorop,cf64,128,64,8,1,1,1,0,0,0,3,4,2,1,8,8,4,80,1024,2952790016,2200096997376,745,4021.26,0.683866,547.117
1,CUTLASS,gemm,cutlass_tensorop_z884gemm_128x64_8x3_nh_align1,not_verified,success,universal,16384,8192,2048,cf64:column,cf64:row,cf64:column,cf64:column,1,0,serial,1,1,heuristic,invalid,invalid,false,false,1,tensorop,cf64,128,64,8,1,1,1,0,0,0,3,4,2,1,8,8,4,80,1024,2952790016,2200096997376,745,4021.24,0.683869,547.119
1,CUTLASS,gemm,cutlass_tensorop_z884gemm_128x64_8x3_ch_align1,not_verified,success,universal,16384,8192,2048,cf64:column,cf64:row,cf64:column,cf64:column,1,0,serial,1,1,heuristic,invalid,invalid,false,false,1,tensorop,cf64,128,64,8,1,1,1,0,0,0,3,4,2,1,8,8,4,80,1024,2952790016,2200096997376,745,4021.23,0.68387,547.12
1,CUTLASS,gemm,cutlass_tensorop_z884gemm_128x64_8x3_tn_align1,not_verified,success,universal,16384,8192,2048,cf64:row,cf64:column,cf64:column,cf64:column,1,0,serial,1,1,heuristic,invalid,invalid,false,false,1,tensorop,cf64,128,64,8,1,1,1,0,0,0,3,4,2,1,8,8,4,80,1024,2952790016,2200096997376,745,3989.98,0.689226,551.405
1,CUTLASS,gemm,cutlass_tensorop_z884gemm_128x64_8x3_hn_align1,not_verified,success,universal,16384,8192,2048,cf64:row,cf64:column,cf64:column,cf64:column,1,0,serial,1,1,heuristic,invalid,invalid,false,false,1,tensorop,cf64,128,64,8,1,1,1,0,0,0,3,4,2,1,8,8,4,80,1024,2952790016,2200096997376,745,3990.06,0.689213,551.395
1,CUTLASS,gemm,cutlass_tensorop_z884gemm_128x64_8x3_tc_align1,not_verified,success,universal,16384,8192,2048,cf64:row,cf64:column,cf64:column,cf64:column,1,0,serial,1,1,heuristic,invalid,invalid,false,false,1,tensorop,cf64,128,64,8,1,1,1,0,0,0,3,4,2,1,8,8,4,80,1024,2952790016,2200096997376,745,3989.96,0.68923,551.409
1,CUTLASS,gemm,cutlass_tensorop_z884gemm_128x64_8x3_hc_align1,not_verified,success,universal,16384,8192,2048,cf64:row,cf64:column,cf64:column,cf64:column,1,0,serial,1,1,heuristic,invalid,invalid,false,false,1,tensorop,cf64,128,64,8,1,1,1,0,0,0,3,4,2,1,8,8,4,80,1024,2952790016,2200096997376,745,3990.12,0.689203,551.387
1,CUTLASS,gemm,cutlass_tensorop_z884gemm_128x64_8x3_tt_align1,not_verified,success,universal,16384,8192,2048,cf64:row,cf64:row,cf64:column,cf64:column,1,0,serial,1,1,heuristic,invalid,invalid,false,false,1,tensorop,cf64,128,64,8,1,1,1,0,0,0,3,4,2,1,8,8,4,80,1024,2952790016,2200096997376,745,3989.84,0.689251,551.425
1,CUTLASS,gemm,cutlass_tensorop_z884gemm_128x64_8x3_ht_align1,not_verified,success,universal,16384,8192,2048,cf64:row,cf64:row,cf64:column,cf64:column,1,0,serial,1,1,heuristic,invalid,invalid,false,false,1,tensorop,cf64,128,64,8,1,1,1,0,0,0,3,4,2,1,8,8,4,80,1024,2952790016,2200096997376,745,3989.88,0.689243,551.419
1,CUTLASS,gemm,cutlass_tensorop_z884gemm_128x64_8x3_th_align1,not_verified,success,universal,16384,8192,2048,cf64:row,cf64:row,cf64:column,cf64:column,1,0,serial,1,1,heuristic,invalid,invalid,false,false,1,tensorop,cf64,128,64,8,1,1,1,0,0,0,3,4,2,1,8,8,4,80,1024,2952790016,2200096997376,745,3989.88,0.689244,551.419
1,CUTLASS,gemm,cutlass_tensorop_z884gemm_128x64_8x3_hh_align1,not_verified,success,universal,16384,8192,2048,cf64:row,cf64:row,cf64:column,cf64:column,1,0,serial,1,1,heuristic,invalid,invalid,false,false,1,tensorop,cf64,128,64,8,1,1,1,0,0,0,3,4,2,1,8,8,4,80,1024,2952790016,2200096997376,745,3989.9,0.68924,551.416
1,CUTLASS,gemm,cutlass_tensorop_gz884gemm_64x64_8x3_nn_align1,not_verified,success,universal,16384,8192,2048,cf64:column,cf64:column,cf64:column,cf64:column,1,0,serial,1,1,heuristic,invalid,invalid,false,false,1,tensorop,cf64,64,64,8,1,1,1,0,0,0,3,4,2,1,8,8,4,80,1024,2952790016,1650072748032,558,3150.12,0.872982,523.812
1,CUTLASS,gemm,cutlass_tensorop_gz884gemm_64x64_8x3_cn_align1,not_verified,success,universal,16384,8192,2048,cf64:column,cf64:column,cf64:column,cf64:column,1,0,serial,1,1,heuristic,invalid,invalid,false,false,1,tensorop,cf64,64,64,8,1,1,1,0,0,0,3,4,2,1,8,8,4,80,1024,2952790016,1650072748032,558,3150.12,0.872981,523.812
1,CUTLASS,gemm,cutlass_tensorop_gz884gemm_64x64_8x3_nc_align1,not_verified,success,universal,16384,8192,2048,cf64:column,cf64:column,cf64:column,cf64:column,1,0,serial,1,1,heuristic,invalid,invalid,false,false,1,tensorop,cf64,64,64,8,1,1,1,0,0,0,3,4,2,1,8,8,4,80,1024,2952790016,1650072748032,558,3150.13,0.872981,523.812
1,CUTLASS,gemm,cutlass_tensorop_gz884gemm_64x64_8x3_cc_align1,not_verified,success,universal,16384,8192,2048,cf64:column,cf64:column,cf64:column,cf64:column,1,0,serial,1,1,heuristic,invalid,invalid,false,false,1,tensorop,cf64,64,64,8,1,1,1,0,0,0,3,4,2,1,8,8,4,80,1024,2952790016,1650072748032,558,3150.12,0.872981,523.812
1,CUTLASS,gemm,cutlass_tensorop_gz884gemm_64x64_8x3_nt_align1,not_verified,success,universal,16384,8192,2048,cf64:column,cf64:row,cf64:column,cf64:column,1,0,serial,1,1,heuristic,invalid,invalid,false,false,1,tensorop,cf64,64,64,8,1,1,1,0,0,0,3,4,2,1,8,8,4,80,1024,2952790016,1650072748032,558,3151.02,0.872734,523.664
1,CUTLASS,gemm,cutlass_tensorop_gz884gemm_64x64_8x3_ct_align1,not_verified,success,universal,16384,8192,2048,cf64:column,cf64:row,cf64:column,cf64:column,1,0,serial,1,1,heuristic,invalid,invalid,false,false,1,tensorop,cf64,64,64,8,1,1,1,0,0,0,3,4,2,1,8,8,4,80,1024,2952790016,1650072748032,558,3151.03,0.872732,523.662
1,CUTLASS,gemm,cutlass_tensorop_gz884gemm_64x64_8x3_nh_align1,not_verified,success,universal,16384,8192,2048,cf64:column,cf64:row,cf64:column,cf64:column,1,0,serial,1,1,heuristic,invalid,invalid,false,false,1,tensorop,cf64,64,64,8,1,1,1,0,0,0,3,4,2,1,8,8,4,80,1024,2952790016,1650072748032,558,3151.02,0.872733,523.663
1,CUTLASS,gemm,cutlass_tensorop_gz884gemm_64x64_8x3_ch_align1,not_verified,success,universal,16384,8192,2048,cf64:column,cf64:row,cf64:column,cf64:column,1,0,serial,1,1,heuristic,invalid,invalid,false,false,1,tensorop,cf64,64,64,8,1,1,1,0,0,0,3,4,2,1,8,8,4,80,1024,2952790016,1650072748032,558,3151.02,0.872732,523.663
1,CUTLASS,gemm,cutlass_tensorop_gz884gemm_64x64_8x3_tn_align1,not_verified,success,universal,16384,8192,2048,cf64:row,cf64:column,cf64:column,cf64:column,1,0,serial,1,1,heuristic,invalid,invalid,false,false,1,tensorop,cf64,64,64,8,1,1,1,0,0,0,3,4,2,1,8,8,4,80,1024,2952790016,1650072748032,558,3151.55,0.872587,523.575
1,CUTLASS,gemm,cutlass_tensorop_gz884gemm_64x64_8x3_hn_align1,not_verified,success,universal,16384,8192,2048,cf64:row,cf64:column,cf64:column,cf64:column,1,0,serial,1,1,heuristic,invalid,invalid,false,false,1,tensorop,cf64,64,64,8,1,1,1,0,0,0,3,4,2,1,8,8,4,80,1024,2952790016,1650072748032,558,3151.43,0.872618,523.594
1,CUTLASS,gemm,cutlass_tensorop_gz884gemm_64x64_8x3_tc_align1,not_verified,success,universal,16384,8192,2048,cf64:row,cf64:column,cf64:column,cf64:column,1,0,serial,1,1,heuristic,invalid,invalid,false,false,1,tensorop,cf64,64,64,8,1,1,1,0,0,0,3,4,2,1,8,8,4,80,1024,2952790016,1650072748032,558,3151.52,0.872595,523.58
1,CUTLASS,gemm,cutlass_tensorop_gz884gemm_64x64_8x3_hc_align1,not_verified,success,universal,16384,8192,2048,cf64:row,cf64:column,cf64:column,cf64:column,1,0,serial,1,1,heuristic,invalid,invalid,false,false,1,tensorop,cf64,64,64,8,1,1,1,0,0,0,3,4,2,1,8,8,4,80,1024,2952790016,1650072748032,558,3151.52,0.872595,523.58
1,CUTLASS,gemm,cutlass_tensorop_gz884gemm_64x64_8x3_tt_align1,not_verified,success,universal,16384,8192,2048,cf64:row,cf64:row,cf64:column,cf64:column,1,0,serial,1,1,heuristic,invalid,invalid,false,false,1,tensorop,cf64,64,64,8,1,1,1,0,0,0,3,4,2,1,8,8,4,80,1024,2952790016,1650072748032,558,3155.92,0.871379,522.85
1,CUTLASS,gemm,cutlass_tensorop_gz884gemm_64x64_8x3_ht_align1,not_verified,success,universal,16384,8192,2048,cf64:row,cf64:row,cf64:column,cf64:column,1,0,serial,1,1,heuristic,invalid,invalid,false,false,1,tensorop,cf64,64,64,8,1,1,1,0,0,0,3,4,2,1,8,8,4,80,1024,2952790016,1650072748032,558,3155.68,0.871444,522.889
1,CUTLASS,gemm,cutlass_tensorop_gz884gemm_64x64_8x3_th_align1,not_verified,success,universal,16384,8192,2048,cf64:row,cf64:row,cf64:column,cf64:column,1,0,serial,1,1,heuristic,invalid,invalid,false,false,1,tensorop,cf64,64,64,8,1,1,1,0,0,0,3,4,2,1,8,8,4,80,1024,2952790016,1650072748032,558,3155.8,0.871411,522.87
1,CUTLASS,gemm,cutlass_tensorop_gz884gemm_64x64_8x3_hh_align1,not_verified,success,universal,16384,8192,2048,cf64:row,cf64:row,cf64:column,cf64:column,1,0,serial,1,1,heuristic,invalid,invalid,false,false,1,tensorop,cf64,64,64,8,1,1,1,0,0,0,3,4,2,1,8,8,4,80,1024,2952790016,1650072748032,558,3155.83,0.871404,522.865
1,CUTLASS,gemm,cutlass_tensorop_s16816gemm_s8_f16_128x128_64x4_tn_align16,not_verified,success,universal,16384,8192,2048,s8:row,f16:column,f32:column,f32:column,1,0,serial,1,1,heuristic,invalid,invalid,false,false,1,tensorop,f32,128,128,64,1,1,1,0,0,0,4,2,2,1,16,8,16,80,1024,603979776,550024249344,910,4.50014,124.996,122224
1,CUTLASS,gemm,cutlass_tensorop_f16_s16816gemm_s8_f16_128x128_64x4_tn_align16,not_verified,success,universal,16384,8192,2048,s8:row,f16:column,f16:column,f16:column,1,0,serial,1,1,heuristic,invalid,invalid,false,false,1,tensorop,f32,128,128,64,1,1,1,0,0,0,4,2,2,1,16,8,16,80,1024,335544320,550024249344,1639,4.48137,69.7332,122736
1,CUTLASS,gemm,cutlass_tensorop_s16816gemm_u8_f16_128x128_64x4_tn_align16,not_verified,success,universal,16384,8192,2048,u8:row,f16:column,f32:column,f32:column,1,0,serial,1,1,heuristic,invalid,invalid,false,false,1,tensorop,f32,128,128,64,1,1,1,0,0,0,4,2,2,1,16,8,16,80,1024,603979776,550024249344,910,4.05914,138.576,135503
1,CUTLASS,gemm,cutlass_tensorop_f16_s16816gemm_u8_f16_128x128_64x4_tn_align16,not_verified,success,universal,16384,8192,2048,u8:row,f16:column,f16:column,f16:column,1,0,serial,1,1,heuristic,invalid,invalid,false,false,1,tensorop,f32,128,128,64,1,1,1,0,0,0,4,2,2,1,16,8,16,80,1024,335544320,550024249344,1639,4.03251,77.4951,136397
1,CUTLASS,gemm,cutlass_tensorop_s16816gemm_s8_bf16_128x128_64x4_tn_align16,not_verified,success,universal,16384,8192,2048,s8:row,bf16:column,f32:column,f32:column,1,0,serial,1,1,heuristic,invalid,invalid,false,false,1,tensorop,f32,128,128,64,1,1,1,0,0,0,4,2,2,1,16,8,16,80,1024,603979776,550024249344,910,4.60322,122.197,119487
1,CUTLASS,gemm,cutlass_tensorop_bf16_s16816gemm_s8_bf16_128x128_64x4_tn_align16,not_verified,success,universal,16384,8192,2048,s8:row,bf16:column,bf16:column,bf16:column,1,0,serial,1,1,heuristic,invalid,invalid,false,false,1,tensorop,f32,128,128,64,1,1,1,0,0,0,4,2,2,1,16,8,16,80,1024,335544320,550024249344,1639,4.59025,68.0791,119824
1,CUTLASS,gemm,cutlass_tensorop_s16816gemm_u8_bf16_128x128_64x4_tn_align16,not_verified,success,universal,16384,8192,2048,u8:row,bf16:column,f32:column,f32:column,1,0,serial,1,1,heuristic,invalid,invalid,false,false,1,tensorop,f32,128,128,64,1,1,1,0,0,0,4,2,2,1,16,8,16,80,1024,603979776,550024249344,910,4.53427,124.055,121304
1,CUTLASS,gemm,cutlass_tensorop_bf16_s16816gemm_u8_bf16_128x128_64x4_tn_align16,not_verified,success,universal,16384,8192,2048,u8:row,bf16:column,bf16:column,bf16:column,1,0,serial,1,1,heuristic,invalid,invalid,false,false,1,tensorop,f32,128,128,64,1,1,1,0,0,0,4,2,2,1,16,8,16,80,1024,335544320,550024249344,1639,4.52813,69.0131,121468
1,CUTLASS,gemm,cutlass_tensorop_h16816gemm_s8_f16_128x128_64x4_tn_align16,not_verified,success,universal,16384,8192,2048,s8:row,f16:column,f16:column,f16:column,1,0,serial,1,1,heuristic,invalid,invalid,false,false,1,tensorop,f16,128,128,64,1,1,1,0,0,0,4,2,2,1,16,8,16,80,1024,335544320,550024249344,1639,4.34449,71.9302,126603
1,CUTLASS,gemm,cutlass_tensorop_h16816gemm_u8_f16_128x128_64x4_tn_align16,not_verified,success,universal,16384,8192,2048,u8:row,f16:column,f16:column,f16:column,1,0,serial,1,1,heuristic,invalid,invalid,false,false,1,tensorop,f16,128,128,64,1,1,1,0,0,0,4,2,2,1,16,8,16,80,1024,335544320,550024249344,1639,4.25028,73.5245,129409
1,CUTLASS,gemm,cutlass_tensorop_s16816gemm_f16_s8_128x128_64x4_tn_align16,not_verified,success,universal,16384,8192,2048,f16:row,s8:column,f32:column,f32:column,1,0,serial,1,1,heuristic,invalid,invalid,false,false,1,tensorop,f32,128,128,64,1,1,1,0,0,0,4,2,2,1,16,8,16,80,1024,620756992,550024249344,886,4.31377,134.018,127504
1,CUTLASS,gemm,cutlass_tensorop_f16_s16816gemm_f16_s8_128x128_64x4_tn_align16,not_verified,success,universal,16384,8192,2048,f16:row,s8:column,f16:column,f16:column,1,0,serial,1,1,heuristic,invalid,invalid,false,false,1,tensorop,f32,128,128,64,1,1,1,0,0,0,4,2,2,1,16,8,16,80,1024,352321536,550024249344,1561,4.27725,76.714,128593
1,CUTLASS,gemm,cutlass_tensorop_s16816gemm_f16_u8_128x128_64x4_tn_align16,not_verified,success,universal,16384,8192,2048,f16:row,u8:column,f32:column,f32:column,1,0,serial,1,1,heuristic,invalid,invalid,false,false,1,tensorop,f32,128,128,64,1,1,1,0,0,0,4,2,2,1,16,8,16,80,1024,620756992,550024249344,886,4.19738,137.735,131040
1,CUTLASS,gemm,cutlass_tensorop_f16_s16816gemm_f16_u8_128x128_64x4_tn_align16,not_verified,success,universal,16384,8192,2048,f16:row,u8:column,f16:column,f16:column,1,0,serial,1,1,heuristic,invalid,invalid,false,false,1,tensorop,f32,128,128,64,1,1,1,0,0,0,4,2,2,1,16,8,16,80,1024,352321536,550024249344,1561,4.16495,78.7825,132060
1,CUTLASS,gemm,cutlass_tensorop_s16816gemm_bf16_s8_128x128_64x4_tn_align16,not_verified,success,universal,16384,8192,2048,bf16:row,s8:column,f32:column,f32:column,1,0,serial,1,1,heuristic,invalid,invalid,false,false,1,tensorop,f32,128,128,64,1,1,1,0,0,0,4,2,2,1,16,8,16,80,1024,620756992,550024249344,886,4.64691,124.411,118363
1,CUTLASS,gemm,cutlass_tensorop_bf16_s16816gemm_bf16_s8_128x128_64x4_tn_align16,not_verified,success,universal,16384,8192,2048,bf16:row,s8:column,bf16:column,bf16:column,1,0,serial,1,1,heuristic,invalid,invalid,false,false,1,tensorop,f32,128,128,64,1,1,1,0,0,0,4,2,2,1,16,8,16,80,1024,352321536,550024249344,1561,4.61551,71.0918,119169
1,CUTLASS,gemm,cutlass_tensorop_s16816gemm_bf16_u8_128x128_64x4_tn_align16,not_verified,success,universal,16384,8192,2048,bf16:row,u8:column,f32:column,f32:column,1,0,serial,1,1,heuristic,invalid,invalid,false,false,1,tensorop,f32,128,128,64,1,1,1,0,0,0,4,2,2,1,16,8,16,80,1024,620756992,550024249344,886,4.54315,127.252,121067
1,CUTLASS,gemm,cutlass_tensorop_bf16_s16816gemm_bf16_u8_128x128_64x4_tn_align16,not_verified,success,universal,16384,8192,2048,bf16:row,u8:column,bf16:column,bf16:column,1,0,serial,1,1,heuristic,invalid,invalid,false,false,1,tensorop,f32,128,128,64,1,1,1,0,0,0,4,2,2,1,16,8,16,80,1024,352321536,550024249344,1561,4.5213,72.5731,121652
1,CUTLASS,gemm,cutlass_tensorop_h16816gemm_f16_s8_128x128_64x4_tn_align16,not_verified,success,universal,16384,8192,2048,f16:row,s8:column,f16:column,f16:column,1,0,serial,1,1,heuristic,invalid,invalid,false,false,1,tensorop,f16,128,128,64,1,1,1,0,0,0,4,2,2,1,16,8,16,80,1024,352321536,550024249344,1561,4.23253,77.5245,129952
1,CUTLASS,gemm,cutlass_tensorop_h16816gemm_f16_u8_128x128_64x4_tn_align16,not_verified,success,universal,16384,8192,2048,f16:row,u8:column,f16:column,f16:column,1,0,serial,1,1,heuristic,invalid,invalid,false,false,1,tensorop,f16,128,128,64,1,1,1,0,0,0,4,2,2,1,16,8,16,80,1024,352321536,550024249344,1561,4.16393,78.8018,132093
1,CUTLASS,gemm,cutlass_tensorop_i16832gemm_s8_256x128_64x3_tn_align16,not_verified,success,universal,16384,8192,2048,s8:row,s8:column,s32:column,s32:column,1,0,serial,1,1,heuristic,invalid,invalid,false,false,1,tensorop,s32,256,128,64,1,1,1,0,0,0,3,4,2,1,16,8,32,80,1024,587202560,550024249344,936,2.52143,216.891,218140
1,CUTLASS,gemm,cutlass_tensorop_s8_i16832gemm_s8_256x128_64x3_tn_align16,not_verified,success,universal,16384,8192,2048,s8:row,s8:column,s8:column,s8:column,1,0,serial,1,1,heuristic,invalid,invalid,false,false,1,tensorop,s32,256,128,64,1,1,1,0,0,0,3,4,2,1,16,8,32,80,1024,184549376,550024249344,2980,2.03981,84.2604,269645
1,CUTLASS,gemm,cutlass_tensorop_i16832gemm_u8_256x128_64x3_tn_align16,not_verified,success,universal,16384,8192,2048,u8:row,u8:column,s32:column,s32:column,1,0,serial,1,1,heuristic,invalid,invalid,false,false,1,tensorop,s32,256,128,64,1,1,1,0,0,0,3,4,2,1,16,8,32,80,1024,587202560,550024249344,936,2.49344,219.326,220589
1,CUTLASS,gemm,cutlass_tensorop_u8_i16832gemm_u8_256x128_64x3_tn_align16,not_verified,success,universal,16384,8192,2048,u8:row,u8:column,u8:column,u8:column,1,0,serial,1,1,heuristic,invalid,invalid,false,false,1,tensorop,s32,256,128,64,1,1,1,0,0,0,3,4,2,1,16,8,32,80,1024,184549376,550024249344,2980,1.95311,88.0007,281615
1,CUTLASS,gemm,cutlass_tensorop_i16832gemm_s4_s8_256x128_64x3_tn_align32,not_verified,success,universal,16384,8192,2048,s4:row,s8:column,s32:column,s32:column,1,0,serial,1,1,heuristic,invalid,invalid,false,false,1,tensorop,s32,256,128,64,1,1,1,0,0,0,3,4,2,1,16,8,32,80,1024,570425344,550024249344,964,2.65353,200.205,207281
1,CUTLASS,gemm,cutlass_tensorop_s8_i16832gemm_s4_s8_256x128_64x3_tn_align32,not_verified,success,universal,16384,8192,2048,s4:row,s8:column,s8:column,s8:column,1,0,serial,1,1,heuristic,invalid,invalid,false,false,1,tensorop,s32,256,128,64,1,1,1,0,0,0,3,4,2,1,16,8,32,80,1024,167772160,550024249344,3278,2.41118,64.8023,228114
1,CUTLASS,gemm,cutlass_tensorop_i16832gemm_s8_s4_256x128_64x3_tn_align32,not_verified,success,universal,16384,8192,2048,s8:row,s4:column,s32:column,s32:column,1,0,serial,1,1,heuristic,invalid,invalid,false,false,1,tensorop,s32,256,128,64,1,1,1,0,0,0,3,4,2,1,16,8,32,80,1024,578813952,550024249344,950,2.74091,196.673,200672
1,CUTLASS,gemm,cutlass_tensorop_s8_i16832gemm_s8_s4_256x128_64x3_tn_align32,not_verified,success,universal,16384,8192,2048,s8:row,s4:column,s8:column,s8:column,1,0,serial,1,1,heuristic,invalid,invalid,false,false,1,tensorop,s32,256,128,64,1,1,1,0,0,0,3,4,2,1,16,8,32,80,1024,176160768,550024249344,3122,2.41698,67.8791,227567
1,CUTLASS,gemm,cutlass_tensorop_s8_i16832gemm_s8_256x128_64x3_n32t32_align16,not_verified,success,universal,16384,8192,2048,s8:nk32,s8:tk32,s8:nk32,s8:nk32,1,0,serial,1,1,heuristic,invalid,invalid,false,false,1,tensorop,s32,256,128,64,1,1,1,0,0,0,3,4,2,1,16,8,32,80,1024,184549376,550024249344,2980,1.9415,88.5267,283298
1,CUTLASS,gemm,cutlass_tensorop_u8_i16832gemm_u8_256x128_64x3_n32t32_align16,not_verified,success,universal,16384,8192,2048,u8:nk32,u8:tk32,u8:nk32,u8:nk32,1,0,serial,1,1,heuristic,invalid,invalid,false,false,1,tensorop,s32,256,128,64,1,1,1,0,0,0,3,4,2,1,16,8,32,80,1024,184549376,550024249344,2980,1.8647,92.1728,294966
1,CUTLASS,gemm,cutlass_tensorop_i16864gemm_s4_256x128_128x3_tn_align32,not_verified,success,universal,16384,8192,2048,s4:row,s4:column,s32:column,s32:column,1,0,serial,1,1,heuristic,invalid,invalid,false,false,1,tensorop,s32,256,128,128,1,1,1,0,0,0,3,4,2,1,16,8,64,80,1024,562036736,550024249344,978,1.66263,314.824,330815
1,CUTLASS,gemm,cutlass_tensorop_s4_i16864gemm_s4_256x128_128x3_tn_align32,not_verified,success,universal,16384,8192,2048,s4:row,s4:column,s4:column,s4:column,1,0,serial,1,1,heuristic,invalid,invalid,false,false,1,tensorop,s32,256,128,128,1,1,1,0,0,0,3,4,2,1,16,8,64,80,1024,92274688,550024249344,5960,1.12401,76.4561,489341
1,CUTLASS,gemm,cutlass_tensorop_i16864gemm_u4_256x128_128x3_tn_align32,not_verified,success,universal,16384,8192,2048,u4:row,u4:column,s32:column,s32:column,1,0,serial,1,1,heuristic,invalid,invalid,false,false,1,tensorop,s32,256,128,128,1,1,1,0,0,0,3,4,2,1,16,8,64,80,1024,562036736,550024249344,978,1.63567,320.014,336269
1,CUTLASS,gemm,cutlass_tensorop_u4_i16864gemm_u4_256x128_128x3_tn_align32,not_verified,success,universal,16384,8192,2048,u4:row,u4:column,u4:column,u4:column,1,0,serial,1,1,heuristic,invalid,invalid,false,false,1,tensorop,s32,256,128,128,1,1,1,0,0,0,3,4,2,1,16,8,64,80,1024,92274688,550024249344,5960,1.08032,79.5482,509131
1,CUTLASS,gemm,cutlass_tensorop_s4_i16864gemm_s4_256x128_128x3_n64t64_align32,not_verified,success,universal,16384,8192,2048,s4:nk64,s4:tk64,s4:nk64,s4:nk64,1,0,serial,1,1,heuristic,invalid,invalid,false,false,1,tensorop,s32,256,128,128,1,1,1,0,0,0,3,4,2,1,16,8,64,80,1024,92274688,550024249344,5960,1.04858,81.9564,524544
1,CUTLASS,gemm,cutlass_tensorop_u4_i16864gemm_u4_256x128_128x3_n64t64_align32,not_verified,success,universal,16384,8192,2048,u4:nk64,u4:tk64,u4:nk64,u4:nk64,1,0,serial,1,1,heuristic,invalid,invalid,false,false,1,tensorop,s32,256,128,128,1,1,1,0,0,0,3,4,2,1,16,8,64,80,1024,92274688,550024249344,5960,1.01581,84.6001,541465
1,CUTLASS,gemm,cutlass_tensorop_i168256xorgemm_b1_256x128_512x3_tn_align128,not_verified,success,universal,16384,8192,2048,b1:row,b1:column,s32:column,s32:column,1,0,serial,1,1,heuristic,invalid,invalid,false,false,1,tensorop,s32,256,128,512,1,1,1,0,0,0,3,4,2,1,16,8,256,80,1024,543162368,550024249344,1012,0.931157,543.259,590689
1,CUTLASS,gemm,cutlass_tensorop_i168256andgemm_b1_256x128_512x3_tn_align128,not_verified,success,universal,16384,8192,2048,b1:row,b1:column,s32:column,s32:column,1,0,serial,1,1,heuristic,invalid,invalid,false,false,1,tensorop,s32,256,128,512,1,1,1,0,0,0,3,4,2,1,16,8,256,80,1024,543162368,550024249344,1012,0.938325,539.109,586176
1,CUTLASS,gemm,cutlass_simt_sgemm_256x128_8x5_nn_align1,not_verified,success,universal,16384,8192,2048,f32:column,f32:column,f32:column,f32:column,1,0,serial,1,1,heuristic,invalid,invalid,false,false,1,simt,f32,256,128,8,1,1,1,0,0,0,5,4,2,1,1,1,1,50,1024,738197504,550024249344,745,22.0262,31.2128,24971.3
1,CUTLASS,gemm,cutlass_simt_sgemm_256x128_8x5_nt_align1,not_verified,success,universal,16384,8192,2048,f32:column,f32:row,f32:column,f32:column,1,0,serial,1,1,heuristic,invalid,invalid,false,false,1,simt,f32,256,128,8,1,1,1,0,0,0,5,4,2,1,1,1,1,50,1024,738197504,550024249344,745,20.709,33.1981,26559.6
1,CUTLASS,gemm,cutlass_simt_sgemm_256x128_8x5_tn_align1,not_verified,success,universal,16384,8192,2048,f32:row,f32:column,f32:column,f32:column,1,0,serial,1,1,heuristic,invalid,invalid,false,false,1,simt,f32,256,128,8,1,1,1,0,0,0,5,4,2,1,1,1,1,50,1024,738197504,550024249344,745,23.4687,29.2943,23436.5
1,CUTLASS,gemm,cutlass_simt_sgemm_256x128_8x5_tt_align1,not_verified,success,universal,16384,8192,2048,f32:row,f32:row,f32:column,f32:column,1,0,serial,1,1,heuristic,invalid,invalid,false,false,1,simt,f32,256,128,8,1,1,1,0,0,0,5,4,2,1,1,1,1,50,1024,738197504,550024249344,745,21.3016,32.2746,25820.8
1,CUTLASS,gemm,cutlass_simt_dgemm_128x128_8x3_nn_align1,not_verified,success,universal,16384,8192,2048,f64:column,f64:column,f64:column,f64:column,1,0,serial,1,1,heuristic,invalid,invalid,false,false,1,simt,f64,128,128,8,1,1,1,0,0,0,3,4,2,1,1,1,1,50,1024,1476395008,550024249344,372,857.818,1.6029,641.19
1,CUTLASS,gemm,cutlass_simt_dgemm_128x128_8x3_nt_align1,not_verified,success,universal,16384,8192,2048,f64:column,f64:row,f64:column,f64:column,1,0,serial,1,1,heuristic,invalid,invalid,false,false,1,simt,f64,128,128,8,1,1,1,0,0,0,3,4,2,1,1,1,1,50,1024,1476395008,550024249344,372,857.767,1.603,641.228
1,CUTLASS,gemm,cutlass_simt_dgemm_128x128_8x3_tn_align1,not_verified,success,universal,16384,8192,2048,f64:row,f64:column,f64:column,f64:column,1,0,serial,1,1,heuristic,invalid,invalid,false,false,1,simt,f64,128,128,8,1,1,1,0,0,0,3,4,2,1,1,1,1,50,1024,1476395008,550024249344,372,857.872,1.6028,641.15
1,CUTLASS,gemm,cutlass_simt_dgemm_128x128_8x3_tt_align1,not_verified,success,universal,16384,8192,2048,f64:row,f64:row,f64:column,f64:column,1,0,serial,1,1,heuristic,invalid,invalid,false,false,1,simt,f64,128,128,8,1,1,1,0,0,0,3,4,2,1,1,1,1,50,1024,1476395008,550024249344,372,857.832,1.60288,641.179
1,CUTLASS,gemm,cutlass_simt_cgemm_128x128_8x5_nn_align1,not_verified,success,universal,16384,8192,2048,cf32:column,cf32:column,cf32:column,cf32:column,1,0,serial,1,1,heuristic,invalid,invalid,false,false,1,simt,cf32,128,128,8,1,1,1,0,0,0,5,4,2,1,1,1,1,50,1024,1476395008,2200096997376,1490,80.6926,17.04,27265.2
1,CUTLASS,gemm,cutlass_simt_cgemm_128x128_8x5_cn_align1,not_verified,success,universal,16384,8192,2048,cf32:column,cf32:column,cf32:column,cf32:column,1,0,serial,1,1,heuristic,invalid,invalid,false,false,1,simt,cf32,128,128,8,1,1,1,0,0,0,5,4,2,1,1,1,1,50,1024,1476395008,2200096997376,1490,85.5357,16.0752,25721.4
1,CUTLASS,gemm,cutlass_simt_cgemm_128x128_8x5_nc_align1,not_verified,success,universal,16384,8192,2048,cf32:column,cf32:column,cf32:column,cf32:column,1,0,serial,1,1,heuristic,invalid,invalid,false,false,1,simt,cf32,128,128,8,1,1,1,0,0,0,5,4,2,1,1,1,1,50,1024,1476395008,2200096997376,1490,84.8138,16.212,25940.3
1,CUTLASS,gemm,cutlass_simt_cgemm_128x128_8x5_cc_align1,not_verified,success,universal,16384,8192,2048,cf32:column,cf32:column,cf32:column,cf32:column,1,0,serial,1,1,heuristic,invalid,invalid,false,false,1,simt,cf32,128,128,8,1,1,1,0,0,0,5,4,2,1,1,1,1,50,1024,1476395008,2200096997376,1490,96.3342,14.2732,22838.2
1,CUTLASS,gemm,cutlass_simt_cgemm_128x128_8x5_nt_align1,not_verified,success,universal,16384,8192,2048,cf32:column,cf32:row,cf32:column,cf32:column,1,0,serial,1,1,heuristic,invalid,invalid,false,false,1,simt,cf32,128,128,8,1,1,1,0,0,0,5,4,2,1,1,1,1,50,1024,1476395008,2200096997376,1490,80.2468,17.1346,27416.6
1,CUTLASS,gemm,cutlass_simt_cgemm_128x128_8x5_ct_align1,not_verified,success,universal,16384,8192,2048,cf32:column,cf32:row,cf32:column,cf32:column,1,0,serial,1,1,heuristic,invalid,invalid,false,false,1,simt,cf32,128,128,8,1,1,1,0,0,0,5,4,2,1,1,1,1,50,1024,1476395008,2200096997376,1490,84.7241,16.2292,25967.8
1,CUTLASS,gemm,cutlass_simt_cgemm_128x128_8x5_nh_align1,not_verified,success,universal,16384,8192,2048,cf32:column,cf32:row,cf32:column,cf32:column,1,0,serial,1,1,heuristic,invalid,invalid,false,false,1,simt,cf32,128,128,8,1,1,1,0,0,0,5,4,2,1,1,1,1,50,1024,1476395008,2200096997376,1490,83.8444,16.3994,26240.2
