profiling_results_2a6/m16384n8192k2048_rtx_6000_ada_generation.gemm.csv
Problem,Provider,OperationKind,Operation,Disposition,Status,gemm_kind,m,n,k,A,B,C,D,alpha,beta,split_k_mode,split_k_slices,batch_count,raster_order,runtime_input_datatype_a,runtime_input_datatype_b,use_pdl,enable_sm90_mixed_dtype_shuffle_test,swizzle_size,op_class,accum,cta_m,cta_n,cta_k,cluster_m,cluster_n,cluster_k,cluster_m_fallback,cluster_n_fallback,cluster_k_fallback,stages,warps_m,warps_n,warps_k,inst_m,inst_n,inst_k,min_cc,max_cc,Bytes,Flops,Flops/Byte,Runtime,GB/s,GFLOPs
1,CUTLASS,gemm,cutlass_simt_sgemm_128x128_8x2_nn_align1,not_verified,success,universal,16384,8192,2048,f32:column,f32:column,f32:column,f32:column,1,0,serial,1,1,heuristic,invalid,invalid,false,false,1,simt,f32,128,128,8,1,1,1,0,0,0,2,4,2,1,1,1,1,50,1024,738197504,550024249344,745,9.66178,71.1567,56927.8
1,CUTLASS,gemm,cutlass_simt_sgemm_128x128_8x2_nt_align1,not_verified,success,universal,16384,8192,2048,f32:column,f32:row,f32:column,f32:column,1,0,serial,1,1,heuristic,invalid,invalid,false,false,1,simt,f32,128,128,8,1,1,1,0,0,0,2,4,2,1,1,1,1,50,1024,738197504,550024249344,745,9.70069,70.8712,56699.5
1,CUTLASS,gemm,cutlass_simt_sgemm_128x128_8x2_tn_align1,not_verified,success,universal,16384,8192,2048,f32:row,f32:column,f32:column,f32:column,1,0,serial,1,1,heuristic,invalid,invalid,false,false,1,simt,f32,128,128,8,1,1,1,0,0,0,2,4,2,1,1,1,1,50,1024,738197504,550024249344,745,10.0031,68.7286,54985.3
1,CUTLASS,gemm,cutlass_simt_sgemm_128x128_8x2_tt_align1,not_verified,success,universal,16384,8192,2048,f32:row,f32:row,f32:column,f32:column,1,0,serial,1,1,heuristic,invalid,invalid,false,false,1,simt,f32,128,128,8,1,1,1,0,0,0,2,4,2,1,1,1,1,50,1024,738197504,550024249344,745,10.7073,64.2086,51369.2
1,CUTLASS,gemm,cutlass_simt_dgemm_128x128_8x2_nn_align1,not_verified,success,universal,16384,8192,2048,f64:column,f64:column,f64:column,f64:column,1,0,serial,1,1,heuristic,invalid,invalid,false,false,1,simt,f64,128,128,8,1,1,1,0,0,0,2,4,2,1,1,1,1,50,1024,1476395008,550024249344,372,363.554,3.78211,1512.91
1,CUTLASS,gemm,cutlass_simt_dgemm_128x128_8x2_nt_align1,not_verified,success,universal,16384,8192,2048,f64:column,f64:row,f64:column,f64:column,1,0,serial,1,1,heuristic,invalid,invalid,false,false,1,simt,f64,128,128,8,1,1,1,0,0,0,2,4,2,1,1,1,1,50,1024,1476395008,550024249344,372,363.524,3.78242,1513.03
1,CUTLASS,gemm,cutlass_simt_dgemm_128x128_8x2_tn_align1,not_verified,success,universal,16384,8192,2048,f64:row,f64:column,f64:column,f64:column,1,0,serial,1,1,heuristic,invalid,invalid,false,false,1,simt,f64,128,128,8,1,1,1,0,0,0,2,4,2,1,1,1,1,50,1024,1476395008,550024249344,372,363.531,3.78235,1513.01
1,CUTLASS,gemm,cutlass_simt_dgemm_128x128_8x2_tt_align1,not_verified,success,universal,16384,8192,2048,f64:row,f64:row,f64:column,f64:column,1,0,serial,1,1,heuristic,invalid,invalid,false,false,1,simt,f64,128,128,8,1,1,1,0,0,0,2,4,2,1,1,1,1,50,1024,1476395008,550024249344,372,363.602,3.78161,1512.71
1,CUTLASS,gemm,cutlass_simt_cgemm_128x64_8x2_nn_align1,not_verified,success,universal,16384,8192,2048,cf32:column,cf32:column,cf32:column,cf32:column,1,0,serial,1,1,heuristic,invalid,invalid,false,false,1,simt,cf32,128,64,8,1,1,1,0,0,0,2,2,2,1,1,1,1,50,1024,1476395008,2200096997376,1490,48.455,28.3768,45405
1,CUTLASS,gemm,cutlass_simt_cgemm_128x64_8x2_nt_align1,not_verified,success,universal,16384,8192,2048,cf32:column,cf32:row,cf32:column,cf32:column,1,0,serial,1,1,heuristic,invalid,invalid,false,false,1,simt,cf32,128,64,8,1,1,1,0,0,0,2,2,2,1,1,1,1,50,1024,1476395008,2200096997376,1490,43.4347,31.6567,50653
1,CUTLASS,gemm,cutlass_simt_cgemm_128x64_8x2_tn_align1,not_verified,success,universal,16384,8192,2048,cf32:row,cf32:column,cf32:column,cf32:column,1,0,serial,1,1,heuristic,invalid,invalid,false,false,1,simt,cf32,128,64,8,1,1,1,0,0,0,2,2,2,1,1,1,1,50,1024,1476395008,2200096997376,1490,49.9169,27.5458,44075.2
1,CUTLASS,gemm,cutlass_simt_cgemm_128x64_8x2_tt_align1,not_verified,success,universal,16384,8192,2048,cf32:row,cf32:row,cf32:column,cf32:column,1,0,serial,1,1,heuristic,invalid,invalid,false,false,1,simt,cf32,128,64,8,1,1,1,0,0,0,2,2,2,1,1,1,1,50,1024,1476395008,2200096997376,1490,44.7123,30.7522,49205.7
1,CUTLASS,gemm,cutlass_simt_hgemm_256x128_8x2_nn_align1,not_verified,success,universal,16384,8192,2048,f16:column,f16:column,f16:column,f16:column,1,0,serial,1,1,heuristic,invalid,invalid,false,false,1,simt,f16,256,128,8,1,1,1,0,0,0,2,4,2,1,1,1,1,50,1024,369098752,550024249344,1490,7.13455,48.181,77093.1
1,CUTLASS,gemm,cutlass_simt_hgemm_256x128_8x2_nt_align1,not_verified,success,universal,16384,8192,2048,f16:column,f16:row,f16:column,f16:column,1,0,serial,1,1,heuristic,invalid,invalid,false,false,1,simt,f16,256,128,8,1,1,1,0,0,0,2,4,2,1,1,1,1,50,1024,369098752,550024249344,1490,6.85261,50.1634,80265
1,CUTLASS,gemm,cutlass_simt_hgemm_256x128_8x2_tn_align1,not_verified,success,universal,16384,8192,2048,f16:row,f16:column,f16:column,f16:column,1,0,serial,1,1,heuristic,invalid,invalid,false,false,1,simt,f16,256,128,8,1,1,1,0,0,0,2,4,2,1,1,1,1,50,1024,369098752,550024249344,1490,7.05502,48.7242,77962.1
1,CUTLASS,gemm,cutlass_simt_hgemm_256x128_8x2_tt_align1,not_verified,success,universal,16384,8192,2048,f16:row,f16:row,f16:column,f16:column,1,0,serial,1,1,heuristic,invalid,invalid,false,false,1,simt,f16,256,128,8,1,1,1,0,0,0,2,4,2,1,1,1,1,50,1024,369098752,550024249344,1490,6.88913,49.8974,79839.4
1,CUTLASS,gemm,cutlass_simt_igemm_s8_128x128_32x2_nn_align1,not_verified,success,universal,16384,8192,2048,s8:column,s8:column,s32:column,s32:column,1,0,serial,1,1,heuristic,invalid,invalid,false,false,1,simt,s32,128,128,32,1,1,1,0,0,0,2,4,2,1,1,1,4,50,1024,587202560,550024249344,936,3.54441,154.292,155181
1,CUTLASS,gemm,cutlass_simt_igemm_s8_128x128_32x2_nt_align1,not_verified,success,universal,16384,8192,2048,s8:column,s8:row,s32:column,s32:column,1,0,serial,1,1,heuristic,invalid,invalid,false,false,1,simt,s32,128,128,32,1,1,1,0,0,0,2,4,2,1,1,1,4,50,1024,587202560,550024249344,936,3.54236,154.382,155271
1,CUTLASS,gemm,cutlass_simt_igemm_s8_128x128_32x2_tn_align1,not_verified,success,universal,16384,8192,2048,s8:row,s8:column,s32:column,s32:column,1,0,serial,1,1,heuristic,invalid,invalid,false,false,1,simt,s32,128,128,32,1,1,1,0,0,0,2,4,2,1,1,1,4,50,1024,587202560,550024249344,936,3.56147,153.553,154437
1,CUTLASS,gemm,cutlass_simt_igemm_s8_128x128_32x2_tt_align1,not_verified,success,universal,16384,8192,2048,s8:row,s8:row,s32:column,s32:column,1,0,serial,1,1,heuristic,invalid,invalid,false,false,1,simt,s32,128,128,32,1,1,1,0,0,0,2,4,2,1,1,1,4,50,1024,587202560,550024249344,936,3.56352,153.465,154349
1,CUTLASS,gemm,cutlass_simt_s8_igemm_s8_128x128_32x2_nn_align1,not_verified,success,universal,16384,8192,2048,s8:column,s8:column,s8:column,s8:column,1,0,serial,1,1,heuristic,invalid,invalid,false,false,1,simt,s32,128,128,32,1,1,1,0,0,0,2,4,2,1,1,1,4,50,1024,184549376,550024249344,2980,3.46044,49.6686,158946
1,CUTLASS,gemm,cutlass_simt_s8_igemm_s8_128x128_32x2_nt_align1,not_verified,success,universal,16384,8192,2048,s8:column,s8:row,s8:column,s8:column,1,0,serial,1,1,heuristic,invalid,invalid,false,false,1,simt,s32,128,128,32,1,1,1,0,0,0,2,4,2,1,1,1,4,50,1024,184549376,550024249344,2980,3.46692,49.5757,158649
1,CUTLASS,gemm,cutlass_simt_s8_igemm_s8_128x128_32x2_tn_align1,not_verified,success,universal,16384,8192,2048,s8:row,s8:column,s8:column,s8:column,1,0,serial,1,1,heuristic,invalid,invalid,false,false,1,simt,s32,128,128,32,1,1,1,0,0,0,2,4,2,1,1,1,4,50,1024,184549376,550024249344,2980,3.4618,49.649,158884
1,CUTLASS,gemm,cutlass_simt_s8_igemm_s8_128x128_32x2_tt_align1,not_verified,success,universal,16384,8192,2048,s8:row,s8:row,s8:column,s8:column,1,0,serial,1,1,heuristic,invalid,invalid,false,false,1,simt,s32,128,128,32,1,1,1,0,0,0,2,4,2,1,1,1,4,50,1024,184549376,550024249344,2980,3.48399,49.3328,157872
1,CUTLASS,gemm,cutlass_tensorop_s1688gemm_f16_256x128_32x2_nn_align8,not_verified,success,universal,16384,8192,2048,f16:column,f16:column,f32:column,f32:column,1,0,serial,1,1,heuristic,invalid,invalid,false,false,1,tensorop,f32,256,128,32,1,1,1,0,0,0,2,4,2,1,16,8,8,75,1024,637534208,550024249344,862,2.37909,249.57,231191
1,CUTLASS,gemm,cutlass_tensorop_s1688gemm_f16_256x128_32x2_nt_align8,not_verified,success,universal,16384,8192,2048,f16:column,f16:row,f32:column,f32:column,1,0,serial,1,1,heuristic,invalid,invalid,false,false,1,tensorop,f32,256,128,32,1,1,1,0,0,0,2,4,2,1,16,8,8,75,1024,637534208,550024249344,862,2.32209,255.696,236866
1,CUTLASS,gemm,cutlass_tensorop_s1688gemm_f16_256x128_32x2_tn_align8,not_verified,success,universal,16384,8192,2048,f16:row,f16:column,f32:column,f32:column,1,0,serial,1,1,heuristic,invalid,invalid,false,false,1,tensorop,f32,256,128,32,1,1,1,0,0,0,2,4,2,1,16,8,8,75,1024,637534208,550024249344,862,2.39582,247.828,229577
1,CUTLASS,gemm,cutlass_tensorop_s1688gemm_f16_256x128_32x2_tt_align8,not_verified,success,universal,16384,8192,2048,f16:row,f16:row,f32:column,f32:column,1,0,serial,1,1,heuristic,invalid,invalid,false,false,1,tensorop,f32,256,128,32,1,1,1,0,0,0,2,4,2,1,16,8,8,75,1024,637534208,550024249344,862,2.36271,251.3,232794
1,CUTLASS,gemm,cutlass_tensorop_f16_s1688gemm_f16_256x128_32x2_nn_align8,not_verified,success,universal,16384,8192,2048,f16:column,f16:column,f16:column,f16:column,1,0,serial,1,1,heuristic,invalid,invalid,false,false,1,tensorop,f32,256,128,32,1,1,1,0,0,0,2,4,2,1,16,8,8,75,1024,369098752,550024249344,1490,2.15381,159.601,255372
1,CUTLASS,gemm,cutlass_tensorop_f16_s1688gemm_f16_256x128_32x2_nt_align8,not_verified,success,universal,16384,8192,2048,f16:column,f16:row,f16:column,f16:column,1,0,serial,1,1,heuristic,invalid,invalid,false,false,1,tensorop,f32,256,128,32,1,1,1,0,0,0,2,4,2,1,16,8,8,75,1024,369098752,550024249344,1490,2.08691,164.717,263559
1,CUTLASS,gemm,cutlass_tensorop_f16_s1688gemm_f16_256x128_32x2_tn_align8,not_verified,success,universal,16384,8192,2048,f16:row,f16:column,f16:column,f16:column,1,0,serial,1,1,heuristic,invalid,invalid,false,false,1,tensorop,f32,256,128,32,1,1,1,0,0,0,2,4,2,1,16,8,8,75,1024,369098752,550024249344,1490,2.1562,159.424,255089
1,CUTLASS,gemm,cutlass_tensorop_f16_s1688gemm_f16_256x128_32x2_tt_align8,not_verified,success,universal,16384,8192,2048,f16:row,f16:row,f16:column,f16:column,1,0,serial,1,1,heuristic,invalid,invalid,false,false,1,tensorop,f32,256,128,32,1,1,1,0,0,0,2,4,2,1,16,8,8,75,1024,369098752,550024249344,1490,2.10603,163.222,261167
1,CUTLASS,gemm,cutlass_tensorop_h1688gemm_256x128_32x2_nn_align8,not_verified,success,universal,16384,8192,2048,f16:column,f16:column,f16:column,f16:column,1,0,serial,1,1,heuristic,invalid,invalid,false,false,1,tensorop,f16,256,128,32,1,1,1,0,0,0,2,4,2,1,16,8,8,75,1024,369098752,550024249344,1490,2.13845,160.747,257207
1,CUTLASS,gemm,cutlass_tensorop_h1688gemm_256x128_32x2_nt_align8,not_verified,success,universal,16384,8192,2048,f16:column,f16:row,f16:column,f16:column,1,0,serial,1,1,heuristic,invalid,invalid,false,false,1,tensorop,f16,256,128,32,1,1,1,0,0,0,2,4,2,1,16,8,8,75,1024,369098752,550024249344,1490,1.89099,181.783,290866
1,CUTLASS,gemm,cutlass_tensorop_h1688gemm_256x128_32x2_tn_align8,not_verified,success,universal,16384,8192,2048,f16:row,f16:column,f16:column,f16:column,1,0,serial,1,1,heuristic,invalid,invalid,false,false,1,tensorop,f16,256,128,32,1,1,1,0,0,0,2,4,2,1,16,8,8,75,1024,369098752,550024249344,1490,2.05756,167.067,267319
1,CUTLASS,gemm,cutlass_tensorop_h1688gemm_256x128_32x2_tt_align8,not_verified,success,universal,16384,8192,2048,f16:row,f16:row,f16:column,f16:column,1,0,serial,1,1,heuristic,invalid,invalid,false,false,1,tensorop,f16,256,128,32,1,1,1,0,0,0,2,4,2,1,16,8,8,75,1024,369098752,550024249344,1490,1.94355,176.867,283000
1,CUTLASS,gemm,cutlass_tensorop_i8816gemm_s8_256x128_64x2_tn_align16,not_verified,success,universal,16384,8192,2048,s8:row,s8:column,s32:column,s32:column,1,0,serial,1,1,heuristic,invalid,invalid,false,false,1,tensorop,s32,256,128,64,1,1,1,0,0,0,2,4,2,1,8,8,16,75,1024,587202560,550024249344,936,1.23255,443.692,446247
1,CUTLASS,gemm,cutlass_tensorop_s8_i8816gemm_s8_256x128_64x2_tn_align16,not_verified,success,universal,16384,8192,2048,s8:row,s8:column,s8:column,s8:column,1,0,serial,1,1,heuristic,invalid,invalid,false,false,1,tensorop,s32,256,128,64,1,1,1,0,0,0,2,4,2,1,8,8,16,75,1024,184549376,550024249344,2980,1.1008,156.136,499659
1,CUTLASS,gemm,cutlass_tensorop_i8816gemm_u8_256x128_64x2_tn_align16,not_verified,success,universal,16384,8192,2048,u8:row,u8:column,s32:column,s32:column,1,0,serial,1,1,heuristic,invalid,invalid,false,false,1,tensorop,s32,256,128,64,1,1,1,0,0,0,2,4,2,1,8,8,16,75,1024,587202560,550024249344,936,1.01376,539.452,542559
1,CUTLASS,gemm,cutlass_tensorop_u8_i8816gemm_u8_256x128_64x2_tn_align16,not_verified,success,universal,16384,8192,2048,u8:row,u8:column,u8:column,u8:column,1,0,serial,1,1,heuristic,invalid,invalid,false,false,1,tensorop,s32,256,128,64,1,1,1,0,0,0,2,4,2,1,8,8,16,75,1024,184549376,550024249344,2980,0.863232,199.106,637169
1,CUTLASS,gemm,cutlass_tensorop_s8_i8816gemm_s8_256x128_64x2_n32t32_align16,not_verified,success,universal,16384,8192,2048,s8:nk32,s8:tk32,s8:nk32,s8:nk32,1,0,serial,1,1,heuristic,invalid,invalid,false,false,1,tensorop,s32,256,128,64,1,1,1,0,0,0,2,4,2,1,8,8,16,75,1024,184549376,550024249344,2980,1.00932,170.287,544944
1,CUTLASS,gemm,cutlass_tensorop_u8_i8816gemm_u8_256x128_64x2_n32t32_align16,not_verified,success,universal,16384,8192,2048,u8:nk32,u8:tk32,u8:nk32,u8:nk32,1,0,serial,1,1,heuristic,invalid,invalid,false,false,1,tensorop,s32,256,128,64,1,1,1,0,0,0,2,4,2,1,8,8,16,75,1024,184549376,550024249344,2980,0.811691,211.749,677628
1,CUTLASS,gemm,cutlass_tensorop_i8832gemm_s4_256x128_128x2_tn_align32,not_verified,success,universal,16384,8192,2048,s4:row,s4:column,s32:column,s32:column,1,0,serial,1,1,heuristic,invalid,invalid,false,false,1,tensorop,s32,256,128,128,1,1,1,0,0,0,2,4,2,1,8,8,32,75,1024,562036736,550024249344,978,0.762539,686.441,721307
1,CUTLASS,gemm,cutlass_tensorop_s4_i8832gemm_s4_256x128_128x2_tn_align32,not_verified,success,universal,16384,8192,2048,s4:row,s4:column,s4:column,s4:column,1,0,serial,1,1,heuristic,invalid,invalid,false,false,1,tensorop,s32,256,128,128,1,1,1,0,0,0,2,4,2,1,8,8,32,75,1024,92274688,550024249344,5960,0.562859,152.68,977198
1,CUTLASS,gemm,cutlass_tensorop_i8832gemm_u4_256x128_128x2_tn_align32,not_verified,success,universal,16384,8192,2048,u4:row,u4:column,s32:column,s32:column,1,0,serial,1,1,heuristic,invalid,invalid,false,false,1,tensorop,s32,256,128,128,1,1,1,0,0,0,2,4,2,1,8,8,32,75,1024,562036736,550024249344,978,0.733525,713.592,749837
1,CUTLASS,gemm,cutlass_tensorop_u4_i8832gemm_u4_256x128_128x2_tn_align32,not_verified,success,universal,16384,8192,2048,u4:row,u4:column,u4:column,u4:column,1,0,serial,1,1,heuristic,invalid,invalid,false,false,1,tensorop,s32,256,128,128,1,1,1,0,0,0,2,4,2,1,8,8,32,75,1024,92274688,550024249344,5960,0.474112,181.26,1.16011e+06
1,CUTLASS,gemm,cutlass_tensorop_s4_i8832gemm_s4_256x128_128x2_n64t64_align32,not_verified,success,universal,16384,8192,2048,s4:nk64,s4:tk64,s4:nk64,s4:nk64,1,0,serial,1,1,heuristic,invalid,invalid,false,false,1,tensorop,s32,256,128,128,1,1,1,0,0,0,2,4,2,1,8,8,32,75,1024,92274688,550024249344,5960,0.531797,161.598,1.03427e+06
1,CUTLASS,gemm,cutlass_tensorop_u4_i8832gemm_u4_256x128_128x2_n64t64_align32,not_verified,success,universal,16384,8192,2048,u4:nk64,u4:tk64,u4:nk64,u4:nk64,1,0,serial,1,1,heuristic,invalid,invalid,false,false,1,tensorop,s32,256,128,128,1,1,1,0,0,0,2,4,2,1,8,8,32,75,1024,92274688,550024249344,5960,0.442368,194.267,1.24336e+06
1,CUTLASS,gemm,cutlass_tensorop_i88128xorgemm_b1_256x128_512x2_tn_align128,not_verified,success,universal,16384,8192,2048,b1:row,b1:column,s32:column,s32:column,1,0,serial,1,1,heuristic,invalid,invalid,false,false,1,tensorop,s32,256,128,512,1,1,1,0,0,0,2,4,2,1,8,8,128,75,1024,543162368,550024249344,1012,0.643072,786.629,855307
1,CUTLASS,gemm,cutlass_tensorop_s16816gemm_f16_256x128_32x3_nn_align8,not_verified,success,universal,16384,8192,2048,f16:column,f16:column,f32:column,f32:column,1,0,serial,1,1,heuristic,invalid,invalid,false,false,1,tensorop,f32,256,128,32,1,1,1,0,0,0,3,4,2,1,16,8,16,80,1024,637534208,550024249344,862,1.80565,328.828,304612
1,CUTLASS,gemm,cutlass_tensorop_s16816gemm_f16_256x128_32x3_nt_align8,not_verified,success,universal,16384,8192,2048,f16:column,f16:row,f32:column,f32:column,1,0,serial,1,1,heuristic,invalid,invalid,false,false,1,tensorop,f32,256,128,32,1,1,1,0,0,0,3,4,2,1,16,8,16,80,1024,637534208,550024249344,862,1.72612,343.979,318647
1,CUTLASS,gemm,cutlass_tensorop_s16816gemm_f16_256x128_32x3_tn_align8,not_verified,success,universal,16384,8192,2048,f16:row,f16:column,f32:column,f32:column,1,0,serial,1,1,heuristic,invalid,invalid,false,false,1,tensorop,f32,256,128,32,1,1,1,0,0,0,3,4,2,1,16,8,16,80,1024,637534208,550024249344,862,1.83501,323.568,299739
1,CUTLASS,gemm,cutlass_tensorop_s16816gemm_f16_256x128_32x3_tt_align8,not_verified,success,universal,16384,8192,2048,f16:row,f16:row,f32:column,f32:column,1,0,serial,1,1,heuristic,invalid,invalid,false,false,1,tensorop,f32,256,128,32,1,1,1,0,0,0,3,4,2,1,16,8,16,80,1024,637534208,550024249344,862,1.74967,339.349,314358
1,CUTLASS,gemm,cutlass_tensorop_f16_s16816gemm_f16_256x128_32x3_nn_align8,not_verified,success,universal,16384,8192,2048,f16:column,f16:column,f16:column,f16:column,1,0,serial,1,1,heuristic,invalid,invalid,false,false,1,tensorop,f32,256,128,32,1,1,1,0,0,0,3,4,2,1,16,8,16,80,1024,369098752,550024249344,1490,1.69711,202.55,324095
1,CUTLASS,gemm,cutlass_tensorop_f16_s16816gemm_f16_256x128_32x3_nt_align8,not_verified,success,universal,16384,8192,2048,f16:column,f16:row,f16:column,f16:column,1,0,serial,1,1,heuristic,invalid,invalid,false,false,1,tensorop,f32,256,128,32,1,1,1,0,0,0,3,4,2,1,16,8,16,80,1024,369098752,550024249344,1490,1.64318,209.198,334732
1,CUTLASS,gemm,cutlass_tensorop_f16_s16816gemm_f16_256x128_32x3_tn_align8,not_verified,success,universal,16384,8192,2048,f16:row,f16:column,f16:column,f16:column,1,0,serial,1,1,heuristic,invalid,invalid,false,false,1,tensorop,f32,256,128,32,1,1,1,0,0,0,3,4,2,1,16,8,16,80,1024,369098752,550024249344,1490,1.70394,201.739,322796
1,CUTLASS,gemm,cutlass_tensorop_f16_s16816gemm_f16_256x128_32x3_tt_align8,not_verified,success,universal,16384,8192,2048,f16:row,f16:row,f16:column,f16:column,1,0,serial,1,1,heuristic,invalid,invalid,false,false,1,tensorop,f32,256,128,32,1,1,1,0,0,0,3,4,2,1,16,8,16,80,1024,369098752,550024249344,1490,1.664,206.581,330543
1,CUTLASS,gemm,cutlass_tensorop_h16816gemm_256x128_32x3_nn_align8,not_verified,success,universal,16384,8192,2048,f16:column,f16:column,f16:column,f16:column,1,0,serial,1,1,heuristic,invalid,invalid,false,false,1,tensorop,f16,256,128,32,1,1,1,0,0,0,3,4,2,1,16,8,16,80,1024,369098752,550024249344,1490,1.67561,205.15,328254
1,CUTLASS,gemm,cutlass_tensorop_h16816gemm_256x128_32x3_nt_align8,not_verified,success,universal,16384,8192,2048,f16:column,f16:row,f16:column,f16:column,1,0,serial,1,1,heuristic,invalid,invalid,false,false,1,tensorop,f16,256,128,32,1,1,1,0,0,0,3,4,2,1,16,8,16,80,1024,369098752,550024249344,1490,1.62031,212.151,339456
1,CUTLASS,gemm,cutlass_tensorop_h16816gemm_256x128_32x3_tn_align8,not_verified,success,universal,16384,8192,2048,f16:row,f16:column,f16:column,f16:column,1,0,serial,1,1,heuristic,invalid,invalid,false,false,1,tensorop,f16,256,128,32,1,1,1,0,0,0,3,4,2,1,16,8,16,80,1024,369098752,550024249344,1490,1.68346,204.193,326723
1,CUTLASS,gemm,cutlass_tensorop_h16816gemm_256x128_32x3_tt_align8,not_verified,success,universal,16384,8192,2048,f16:row,f16:row,f16:column,f16:column,1,0,serial,1,1,heuristic,invalid,invalid,false,false,1,tensorop,f16,256,128,32,1,1,1,0,0,0,3,4,2,1,16,8,16,80,1024,369098752,550024249344,1490,1.63601,210.115,336198
1,CUTLASS,gemm,cutlass_tensorop_s16816gemm_bf16_256x128_32x3_nn_align8,not_verified,success,universal,16384,8192,2048,bf16:column,bf16:column,f32:column,f32:column,1,0,serial,1,1,heuristic,invalid,invalid,false,false,1,tensorop,f32,256,128,32,1,1,1,0,0,0,3,4,2,1,16,8,16,80,1024,637534208,550024249344,862,1.87665,316.388,293088
1,CUTLASS,gemm,cutlass_tensorop_s16816gemm_bf16_256x128_32x3_nt_align8,not_verified,success,universal,16384,8192,2048,bf16:column,bf16:row,f32:column,f32:column,1,0,serial,1,1,heuristic,invalid,invalid,false,false,1,tensorop,f32,256,128,32,1,1,1,0,0,0,3,4,2,1,16,8,16,80,1024,637534208,550024249344,862,1.78347,332.919,308402
1,CUTLASS,gemm,cutlass_tensorop_s16816gemm_bf16_256x128_32x3_tn_align8,not_verified,success,universal,16384,8192,2048,bf16:row,bf16:column,f32:column,f32:column,1,0,serial,1,1,heuristic,invalid,invalid,false,false,1,tensorop,f32,256,128,32,1,1,1,0,0,0,3,4,2,1,16,8,16,80,1024,637534208,550024249344,862,1.88041,315.756,292503
1,CUTLASS,gemm,cutlass_tensorop_s16816gemm_bf16_256x128_32x3_tt_align8,not_verified,success,universal,16384,8192,2048,bf16:row,bf16:row,f32:column,f32:column,1,0,serial,1,1,heuristic,invalid,invalid,false,false,1,tensorop,f32,256,128,32,1,1,1,0,0,0,3,4,2,1,16,8,16,80,1024,637534208,550024249344,862,1.792,331.334,306933
1,CUTLASS,gemm,cutlass_tensorop_bf16_s16816gemm_bf16_256x128_32x3_nn_align8,not_verified,success,universal,16384,8192,2048,bf16:column,bf16:column,bf16:column,bf16:column,1,0,serial,1,1,heuristic,invalid,invalid,false,false,1,tensorop,f32,256,128,32,1,1,1,0,0,0,3,4,2,1,16,8,16,80,1024,369098752,550024249344,1490,1.74865,196.58,314542
1,CUTLASS,gemm,cutlass_tensorop_bf16_s16816gemm_bf16_256x128_32x3_nt_align8,not_verified,success,universal,16384,8192,2048,bf16:column,bf16:row,bf16:column,bf16:column,1,0,serial,1,1,heuristic,invalid,invalid,false,false,1,tensorop,f32,256,128,32,1,1,1,0,0,0,3,4,2,1,16,8,16,80,1024,369098752,550024249344,1490,1.69199,203.163,325075
1,CUTLASS,gemm,cutlass_tensorop_bf16_s16816gemm_bf16_256x128_32x3_tn_align8,not_verified,success,universal,16384,8192,2048,bf16:row,bf16:column,bf16:column,bf16:column,1,0,serial,1,1,heuristic,invalid,invalid,false,false,1,tensorop,f32,256,128,32,1,1,1,0,0,0,3,4,2,1,16,8,16,80,1024,369098752,550024249344,1490,1.7606,195.246,312408
1,CUTLASS,gemm,cutlass_tensorop_bf16_s16816gemm_bf16_256x128_32x3_tt_align8,not_verified,success,universal,16384,8192,2048,bf16:row,bf16:row,bf16:column,bf16:column,1,0,serial,1,1,heuristic,invalid,invalid,false,false,1,tensorop,f32,256,128,32,1,1,1,0,0,0,3,4,2,1,16,8,16,80,1024,369098752,550024249344,1490,1.70837,201.215,321958
1,CUTLASS,gemm,cutlass_tensorop_s1688gemm_tf32_256x128_16x3_nn_align4,not_verified,success,universal,16384,8192,2048,tf32:column,tf32:column,f32:column,f32:column,1,0,serial,1,1,heuristic,invalid,invalid,false,false,1,tensorop,f32,256,128,16,1,1,1,0,0,0,3,4,2,1,16,8,8,80,1024,738197504,550024249344,745,3.30069,208.29,166639
1,CUTLASS,gemm,cutlass_tensorop_s1688gemm_tf32_256x128_16x3_nt_align4,not_verified,success,universal,16384,8192,2048,tf32:column,tf32:row,f32:column,f32:column,1,0,serial,1,1,heuristic,invalid,invalid,false,false,1,tensorop,f32,256,128,16,1,1,1,0,0,0,3,4,2,1,16,8,8,80,1024,738197504,550024249344,745,3.24881,211.616,169300
1,CUTLASS,gemm,cutlass_tensorop_s1688gemm_tf32_256x128_16x3_tn_align4,not_verified,success,universal,16384,8192,2048,tf32:row,tf32:column,f32:column,f32:column,1,0,serial,1,1,heuristic,invalid,invalid,false,false,1,tensorop,f32,256,128,16,1,1,1,0,0,0,3,4,2,1,16,8,8,80,1024,738197504,550024249344,745,3.30889,207.774,166226
1,CUTLASS,gemm,cutlass_tensorop_s1688gemm_tf32_256x128_16x3_tt_align4,not_verified,success,universal,16384,8192,2048,tf32:row,tf32:row,f32:column,f32:column,1,0,serial,1,1,heuristic,invalid,invalid,false,false,1,tensorop,f32,256,128,16,1,1,1,0,0,0,3,4,2,1,16,8,8,80,1024,738197504,550024249344,745,3.24403,211.928,169550
1,CUTLASS,gemm,cutlass_tensorop_tf32_s1688gemm_tf32_256x128_16x3_nn_align4,not_verified,success,universal,16384,8192,2048,tf32:column,tf32:column,tf32:column,tf32:column,1,0,serial,1,1,heuristic,invalid,invalid,false,false,1,tensorop,f32,256,128,16,1,1,1,0,0,0,3,4,2,1,16,8,8,80,1024,738197504,550024249344,745,3.3635,204.4,163527
1,CUTLASS,gemm,cutlass_tensorop_tf32_s1688gemm_tf32_256x128_16x3_nt_align4,not_verified,success,universal,16384,8192,2048,tf32:column,tf32:row,tf32:column,tf32:column,1,0,serial,1,1,heuristic,invalid,invalid,false,false,1,tensorop,f32,256,128,16,1,1,1,0,0,0,3,4,2,1,16,8,8,80,1024,738197504,550024249344,745,3.3321,206.327,165069
1,CUTLASS,gemm,cutlass_tensorop_tf32_s1688gemm_tf32_256x128_16x3_tn_align4,not_verified,success,universal,16384,8192,2048,tf32:row,tf32:column,tf32:column,tf32:column,1,0,serial,1,1,heuristic,invalid,invalid,false,false,1,tensorop,f32,256,128,16,1,1,1,0,0,0,3,4,2,1,16,8,8,80,1024,738197504,550024249344,745,3.37237,203.862,163097
1,CUTLASS,gemm,cutlass_tensorop_tf32_s1688gemm_tf32_256x128_16x3_tt_align4,not_verified,success,universal,16384,8192,2048,tf32:row,tf32:row,tf32:column,tf32:column,1,0,serial,1,1,heuristic,invalid,invalid,false,false,1,tensorop,f32,256,128,16,1,1,1,0,0,0,3,4,2,1,16,8,8,80,1024,738197504,550024249344,745,3.32663,206.665,165340
1,CUTLASS,gemm,cutlass_tensorop_s1688tf32gemm_256x128_16x3_nn_align4,not_verified,success,universal,16384,8192,2048,f32:column,f32:column,f32:column,f32:column,1,0,serial,1,1,heuristic,invalid,invalid,false,false,1,tensorop,f32,256,128,16,1,1,1,0,0,0,3,4,2,1,16,8,8,80,1024,738197504,550024249344,745,3.42733,200.594,160482
1,CUTLASS,gemm,cutlass_tensorop_s1688tf32gemm_256x128_16x3_nt_align4,not_verified,success,universal,16384,8192,2048,f32:column,f32:row,f32:column,f32:column,1,0,serial,1,1,heuristic,invalid,invalid,false,false,1,tensorop,f32,256,128,16,1,1,1,0,0,0,3,4,2,1,16,8,8,80,1024,738197504,550024249344,745,3.38295,203.225,162587
1,CUTLASS,gemm,cutlass_tensorop_s1688tf32gemm_256x128_16x3_tn_align4,not_verified,success,universal,16384,8192,2048,f32:row,f32:column,f32:column,f32:column,1,0,serial,1,1,heuristic,invalid,invalid,false,false,1,tensorop,f32,256,128,16,1,1,1,0,0,0,3,4,2,1,16,8,8,80,1024,738197504,550024249344,745,3.44678,199.461,159576
1,CUTLASS,gemm,cutlass_tensorop_s1688tf32gemm_256x128_16x3_tt_align4,not_verified,success,universal,16384,8192,2048,f32:row,f32:row,f32:column,f32:column,1,0,serial,1,1,heuristic,invalid,invalid,false,false,1,tensorop,f32,256,128,16,1,1,1,0,0,0,3,4,2,1,16,8,8,80,1024,738197504,550024249344,745,3.37545,203.677,162949
1,CUTLASS,gemm,cutlass_tensorop_s1688f16gemm_256x128_16x3_nn_align4,not_verified,success,universal,16384,8192,2048,f32:column,f32:column,f32:column,f32:column,1,0,serial,1,1,heuristic,invalid,invalid,false,false,1,tensorop,f32,256,128,16,1,1,1,0,0,0,3,4,2,1,16,8,8,75,1024,738197504,550024249344,745,2.66786,257.697,206167
1,CUTLASS,gemm,cutlass_tensorop_s1688f16gemm_256x128_16x3_nt_align4,not_verified,success,universal,16384,8192,2048,f32:column,f32:row,f32:column,f32:column,1,0,serial,1,1,heuristic,invalid,invalid,false,false,1,tensorop,f32,256,128,16,1,1,1,0,0,0,3,4,2,1,16,8,8,75,1024,738197504,550024249344,745,2.57195,267.307,213855
1,CUTLASS,gemm,cutlass_tensorop_s1688f16gemm_256x128_16x3_tn_align4,not_verified,success,universal,16384,8192,2048,f32:row,f32:column,f32:column,f32:column,1,0,serial,1,1,heuristic,invalid,invalid,false,false,1,tensorop,f32,256,128,16,1,1,1,0,0,0,3,4,2,1,16,8,8,75,1024,738197504,550024249344,745,2.69551,255.054,204052
1,CUTLASS,gemm,cutlass_tensorop_s1688f16gemm_256x128_16x3_tt_align4,not_verified,success,universal,16384,8192,2048,f32:row,f32:row,f32:column,f32:column,1,0,serial,1,1,heuristic,invalid,invalid,false,false,1,tensorop,f32,256,128,16,1,1,1,0,0,0,3,4,2,1,16,8,8,75,1024,738197504,550024249344,745,2.54839,269.778,215832
1,CUTLASS,gemm,cutlass_tensorop_s1688bf16gemm_256x128_16x3_nn_align4,not_verified,success,universal,16384,8192,2048,f32:column,f32:column,f32:column,f32:column,1,0,serial,1,1,heuristic,invalid,invalid,false,false,1,tensorop,f32,256,128,16,1,1,1,0,0,0,3,4,2,1,16,8,8,80,1024,738197504,550024249344,745,2.70711,253.96,203177
1,CUTLASS,gemm,cutlass_tensorop_s1688bf16gemm_256x128_16x3_nt_align4,not_verified,success,universal,16384,8192,2048,f32:column,f32:row,f32:column,f32:column,1,0,serial,1,1,heuristic,invalid,invalid,false,false,1,tensorop,f32,256,128,16,1,1,1,0,0,0,3,4,2,1,16,8,8,80,1024,738197504,550024249344,745,2.60506,263.91,211137
1,CUTLASS,gemm,cutlass_tensorop_s1688bf16gemm_256x128_16x3_tn_align4,not_verified,success,universal,16384,8192,2048,f32:row,f32:column,f32:column,f32:column,1,0,serial,1,1,heuristic,invalid,invalid,false,false,1,tensorop,f32,256,128,16,1,1,1,0,0,0,3,4,2,1,16,8,8,80,1024,738197504,550024249344,745,2.72282,252.496,202006
1,CUTLASS,gemm,cutlass_tensorop_s1688bf16gemm_256x128_16x3_tt_align4,not_verified,success,universal,16384,8192,2048,f32:row,f32:row,f32:column,f32:column,1,0,serial,1,1,heuristic,invalid,invalid,false,false,1,tensorop,f32,256,128,16,1,1,1,0,0,0,3,4,2,1,16,8,8,80,1024,738197504,550024249344,745,2.57263,267.236,213798
1,CUTLASS,gemm,cutlass_tensorop_s1688gemm_128x128_16x4_nn_align4,not_verified,success,universal,16384,8192,2048,f32:column,f32:column,f32:column,f32:column,1,0,serial,1,1,heuristic,invalid,invalid,false,false,1,tensorop,f32,128,128,16,1,1,1,0,0,0,4,4,2,1,16,8,8,80,1024,738197504,550024249344,745,10.7001,64.2516,51403.6
1,CUTLASS,gemm,cutlass_tensorop_s1688gemm_128x128_16x4_nt_align4,not_verified,success,universal,16384,8192,2048,f32:column,f32:row,f32:column,f32:column,1,0,serial,1,1,heuristic,invalid,invalid,false,false,1,tensorop,f32,128,128,16,1,1,1,0,0,0,4,4,2,1,16,8,8,80,1024,738197504,550024249344,745,10.8186,63.5482,50840.8
1,CUTLASS,gemm,cutlass_tensorop_s1688gemm_128x128_16x4_tn_align4,not_verified,success,universal,16384,8192,2048,f32:row,f32:column,f32:column,f32:column,1,0,serial,1,1,heuristic,invalid,invalid,false,false,1,tensorop,f32,128,128,16,1,1,1,0,0,0,4,4,2,1,16,8,8,80,1024,738197504,550024249344,745,9.68704,70.9711,56779.4
1,CUTLASS,gemm,cutlass_tensorop_s1688gemm_128x128_16x4_tt_align4,not_verified,success,universal,16384,8192,2048,f32:row,f32:row,f32:column,f32:column,1,0,serial,1,1,heuristic,invalid,invalid,false,false,1,tensorop,f32,128,128,16,1,1,1,0,0,0,4,4,2,1,16,8,8,80,1024,738197504,550024249344,745,10.0816,68.1934,54557.1
1,CUTLASS,gemm,cutlass_tensorop_c1688gemm_128x64_16x3_nn_align1,not_verified,success,universal,16384,8192,2048,cf32:column,cf32:column,cf32:column,cf32:column,1,0,serial,1,1,heuristic,invalid,invalid,false,false,1,tensorop,cf32,128,64,16,1,1,1,0,0,0,3,4,2,1,16,8,8,80,1024,1476395008,2200096997376,1490,45.6929,30.0922,48149.6
1,CUTLASS,gemm,cutlass_tensorop_c1688gemm_128x64_16x3_cn_align1,not_verified,success,universal,16384,8192,2048,cf32:column,cf32:column,cf32:column,cf32:column,1,0,serial,1,1,heuristic,invalid,invalid,false,false,1,tensorop,cf32,128,64,16,1,1,1,0,0,0,3,4,2,1,16,8,8,80,1024,1476395008,2200096997376,1490,44.7956,30.695,49114.2
1,CUTLASS,gemm,cutlass_tensorop_c1688gemm_128x64_16x3_nc_align1,not_verified,success,universal,16384,8192,2048,cf32:column,cf32:column,cf32:column,cf32:column,1,0,serial,1,1,heuristic,invalid,invalid,false,false,1,tensorop,cf32,128,64,16,1,1,1,0,0,0,3,4,2,1,16,8,8,80,1024,1476395008,2200096997376,1490,43.2872,31.7646,50825.6
1,CUTLASS,gemm,cutlass_tensorop_c1688gemm_128x64_16x3_cc_align1,not_verified,success,universal,16384,8192,2048,cf32:column,cf32:column,cf32:column,cf32:column,1,0,serial,1,1,heuristic,invalid,invalid,false,false,1,tensorop,cf32,128,64,16,1,1,1,0,0,0,3,4,2,1,16,8,8,80,1024,1476395008,2200096997376,1490,45.3693,30.3068,48493
1,CUTLASS,gemm,cutlass_tensorop_c1688gemm_128x64_16x3_nt_align1,not_verified,success,universal,16384,8192,2048,cf32:column,cf32:row,cf32:column,cf32:column,1,0,serial,1,1,heuristic,invalid,invalid,false,false,1,tensorop,cf32,128,64,16,1,1,1,0,0,0,3,4,2,1,16,8,8,80,1024,1476395008,2200096997376,1490,44.0269,31.2309,49971.7
1,CUTLASS,gemm,cutlass_tensorop_c1688gemm_128x64_16x3_ct_align1,not_verified,success,universal,16384,8192,2048,cf32:column,cf32:row,cf32:column,cf32:column,1,0,serial,1,1,heuristic,invalid,invalid,false,false,1,tensorop,cf32,128,64,16,1,1,1,0,0,0,3,4,2,1,16,8,8,80,1024,1476395008,2200096997376,1490,44.557,30.8594,49377.2
1,CUTLASS,gemm,cutlass_tensorop_c1688gemm_128x64_16x3_nh_align1,not_verified,success,universal,16384,8192,2048,cf32:column,cf32:row,cf32:column,cf32:column,1,0,serial,1,1,heuristic,invalid,invalid,false,false,1,tensorop,cf32,128,64,16,1,1,1,0,0,0,3,4,2,1,16,8,8,80,1024,1476395008,2200096997376,1490,44.2249,31.0911,49748
1,CUTLASS,gemm,cutlass_tensorop_c1688gemm_128x64_16x3_ch_align1,not_verified,success,universal,16384,8192,2048,cf32:column,cf32:row,cf32:column,cf32:column,1,0,serial,1,1,heuristic,invalid,invalid,false,false,1,tensorop,cf32,128,64,16,1,1,1,0,0,0,3,4,2,1,16,8,8,80,1024,1476395008,2200096997376,1490,44.5078,30.8934,49431.7
1,CUTLASS,gemm,cutlass_tensorop_c1688gemm_128x64_16x3_tn_align1,not_verified,success,universal,16384,8192,2048,cf32:row,cf32:column,cf32:column,cf32:column,1,0,serial,1,1,heuristic,invalid,invalid,false,false,1,tensorop,cf32,128,64,16,1,1,1,0,0,0,3,4,2,1,16,8,8,80,1024,1476395008,2200096997376,1490,44.4334,30.9452,49514.5
1,CUTLASS,gemm,cutlass_tensorop_c1688gemm_128x64_16x3_hn_align1,not_verified,success,universal,16384,8192,2048,cf32:row,cf32:column,cf32:column,cf32:column,1,0,serial,1,1,heuristic,invalid,invalid,false,false,1,tensorop,cf32,128,64,16,1,1,1,0,0,0,3,4,2,1,16,8,8,80,1024,1476395008,2200096997376,1490,45.2195,30.4072,48653.7
1,CUTLASS,gemm,cutlass_tensorop_c1688gemm_128x64_16x3_tc_align1,not_verified,success,universal,16384,8192,2048,cf32:row,cf32:column,cf32:column,cf32:column,1,0,serial,1,1,heuristic,invalid,invalid,false,false,1,tensorop,cf32,128,64,16,1,1,1,0,0,0,3,4,2,1,16,8,8,80,1024,1476395008,2200096997376,1490,44.4153,30.9578,49534.6
1,CUTLASS,gemm,cutlass_tensorop_c1688gemm_128x64_16x3_hc_align1,not_verified,success,universal,16384,8192,2048,cf32:row,cf32:column,cf32:column,cf32:column,1,0,serial,1,1,heuristic,invalid,invalid,false,false,1,tensorop,cf32,128,64,16,1,1,1,0,0,0,3,4,2,1,16,8,8,80,1024,1476395008,2200096997376,1490,44.472,30.9183,49471.5
1,CUTLASS,gemm,cutlass_tensorop_c1688gemm_128x64_16x3_tt_align1,not_verified,success,universal,16384,8192,2048,cf32:row,cf32:row,cf32:column,cf32:column,1,0,serial,1,1,heuristic,invalid,invalid,false,false,1,tensorop,cf32,128,64,16,1,1,1,0,0,0,3,4,2,1,16,8,8,80,1024,1476395008,2200096997376,1490,43.8996,31.3215,50116.6
1,CUTLASS,gemm,cutlass_tensorop_c1688gemm_128x64_16x3_ht_align1,not_verified,success,universal,16384,8192,2048,cf32:row,cf32:row,cf32:column,cf32:column,1,0,serial,1,1,heuristic,invalid,invalid,false,false,1,tensorop,cf32,128,64,16,1,1,1,0,0,0,3,4,2,1,16,8,8,80,1024,1476395008,2200096997376,1490,43.9402,31.2925,50070.3
1,CUTLASS,gemm,cutlass_tensorop_c1688gemm_128x64_16x3_th_align1,not_verified,success,universal,16384,8192,2048,cf32:row,cf32:row,cf32:column,cf32:column,1,0,serial,1,1,heuristic,invalid,invalid,false,false,1,tensorop,cf32,128,64,16,1,1,1,0,0,0,3,4,2,1,16,8,8,80,1024,1476395008,2200096997376,1490,42.767,32.1509,51443.8
1,CUTLASS,gemm,cutlass_tensorop_c1688gemm_128x64_16x3_hh_align1,not_verified,success,universal,16384,8192,2048,cf32:row,cf32:row,cf32:column,cf32:column,1,0,serial,1,1,heuristic,invalid,invalid,false,false,1,tensorop,cf32,128,64,16,1,1,1,0,0,0,3,4,2,1,16,8,8,80,1024,1476395008,2200096997376,1490,44.0549,31.2111,49939.9
1,CUTLASS,gemm,cutlass_tensorop_d884gemm_128x128_16x3_nn_align1,not_verified,success,universal,16384,8192,2048,f64:column,f64:column,f64:column,f64:column,1,0,serial,1,1,heuristic,invalid,invalid,false,false,1,tensorop,f64,128,128,16,1,1,1,0,0,0,3,4,2,1,8,8,4,80,1024,1476395008,550024249344,372,416.125,3.3043,1321.78
1,CUTLASS,gemm,cutlass_tensorop_d884gemm_128x128_16x3_nt_align1,not_verified,success,universal,16384,8192,2048,f64:column,f64:row,f64:column,f64:column,1,0,serial,1,1,heuristic,invalid,invalid,false,false,1,tensorop,f64,128,128,16,1,1,1,0,0,0,3,4,2,1,8,8,4,80,1024,1476395008,550024249344,372,414.023,3.32107,1328.49
1,CUTLASS,gemm,cutlass_tensorop_d884gemm_128x128_16x3_tn_align1,not_verified,success,universal,16384,8192,2048,f64:row,f64:column,f64:column,f64:column,1,0,serial,1,1,heuristic,invalid,invalid,false,false,1,tensorop,f64,128,128,16,1,1,1,0,0,0,3,4,2,1,8,8,4,80,1024,1476395008,550024249344,372,414.032,3.321,1328.46
1,CUTLASS,gemm,cutlass_tensorop_d884gemm_128x128_16x3_tt_align1,not_verified,success,universal,16384,8192,2048,f64:row,f64:row,f64:column,f64:column,1,0,serial,1,1,heuristic,invalid,invalid,false,false,1,tensorop,f64,128,128,16,1,1,1,0,0,0,3,4,2,1,8,8,4,80,1024,1476395008,550024249344,372,414.016,3.32113,1328.51
1,CUTLASS,gemm,cutlass_tensorop_z884gemm_128x64_8x3_nn_align1,not_verified,success,universal,16384,8192,2048,cf64:column,cf64:column,cf64:column,cf64:column,1,0,serial,1,1,heuristic,invalid,invalid,false,false,1,tensorop,cf64,128,64,8,1,1,1,0,0,0,3,4,2,1,8,8,4,80,1024,2952790016,2200096997376,745,1654.77,1.66187,1329.55
1,CUTLASS,gemm,cutlass_tensorop_z884gemm_128x64_8x3_cn_align1,not_verified,success,universal,16384,8192,2048,cf64:column,cf64:column,cf64:column,cf64:column,1,0,serial,1,1,heuristic,invalid,invalid,false,false,1,tensorop,cf64,128,64,8,1,1,1,0,0,0,3,4,2,1,8,8,4,80,1024,2952790016,2200096997376,745,1654.77,1.66186,1329.55
1,CUTLASS,gemm,cutlass_tensorop_z884gemm_128x64_8x3_nc_align1,not_verified,success,universal,16384,8192,2048,cf64:column,cf64:column,cf64:column,cf64:column,1,0,serial,1,1,heuristic,invalid,invalid,false,false,1,tensorop,cf64,128,64,8,1,1,1,0,0,0,3,4,2,1,8,8,4,80,1024,2952790016,2200096997376,745,1654.76,1.66187,1329.55
1,CUTLASS,gemm,cutlass_tensorop_z884gemm_128x64_8x3_cc_align1,not_verified,success,universal,16384,8192,2048,cf64:column,cf64:column,cf64:column,cf64:column,1,0,serial,1,1,heuristic,invalid,invalid,false,false,1,tensorop,cf64,128,64,8,1,1,1,0,0,0,3,4,2,1,8,8,4,80,1024,2952790016,2200096997376,745,1654.76,1.66187,1329.55
1,CUTLASS,gemm,cutlass_tensorop_z884gemm_128x64_8x3_nt_align1,not_verified,success,universal,16384,8192,2048,cf64:column,cf64:row,cf64:column,cf64:column,1,0,serial,1,1,heuristic,invalid,invalid,false,false,1,tensorop,cf64,128,64,8,1,1,1,0,0,0,3,4,2,1,8,8,4,80,1024,2952790016,2200096997376,745,1661.91,1.65473,1323.84
1,CUTLASS,gemm,cutlass_tensorop_z884gemm_128x64_8x3_ct_align1,not_verified,success,universal,16384,8192,2048,cf64:column,cf64:row,cf64:column,cf64:column,1,0,serial,1,1,heuristic,invalid,invalid,false,false,1,tensorop,cf64,128,64,8,1,1,1,0,0,0,3,4,2,1,8,8,4,80,1024,2952790016,2200096997376,745,1663.89,1.65276,1322.26
1,CUTLASS,gemm,cutlass_tensorop_z884gemm_128x64_8x3_nh_align1,not_verified,success,universal,16384,8192,2048,cf64:column,cf64:row,cf64:column,cf64:column,1,0,serial,1,1,heuristic,invalid,invalid,false,false,1,tensorop,cf64,128,64,8,1,1,1,0,0,0,3,4,2,1,8,8,4,80,1024,2952790016,2200096997376,745,1663.88,1.65276,1322.27
1,CUTLASS,gemm,cutlass_tensorop_z884gemm_128x64_8x3_ch_align1,not_verified,success,universal,16384,8192,2048,cf64:column,cf64:row,cf64:column,cf64:column,1,0,serial,1,1,heuristic,invalid,invalid,false,false,1,tensorop,cf64,128,64,8,1,1,1,0,0,0,3,4,2,1,8,8,4,80,1024,2952790016,2200096997376,745,1663.89,1.65276,1322.26
1,CUTLASS,gemm,cutlass_tensorop_z884gemm_128x64_8x3_tn_align1,not_verified,success,universal,16384,8192,2048,cf64:row,cf64:column,cf64:column,cf64:column,1,0,serial,1,1,heuristic,invalid,invalid,false,false,1,tensorop,cf64,128,64,8,1,1,1,0,0,0,3,4,2,1,8,8,4,80,1024,2952790016,2200096997376,745,1663.88,1.65277,1322.27
1,CUTLASS,gemm,cutlass_tensorop_z884gemm_128x64_8x3_hn_align1,not_verified,success,universal,16384,8192,2048,cf64:row,cf64:column,cf64:column,cf64:column,1,0,serial,1,1,heuristic,invalid,invalid,false,false,1,tensorop,cf64,128,64,8,1,1,1,0,0,0,3,4,2,1,8,8,4,80,1024,2952790016,2200096997376,745,1663.88,1.65277,1322.27
1,CUTLASS,gemm,cutlass_tensorop_z884gemm_128x64_8x3_tc_align1,not_verified,success,universal,16384,8192,2048,cf64:row,cf64:column,cf64:column,cf64:column,1,0,serial,1,1,heuristic,invalid,invalid,false,false,1,tensorop,cf64,128,64,8,1,1,1,0,0,0,3,4,2,1,8,8,4,80,1024,2952790016,2200096997376,745,1663.88,1.65277,1322.27
1,CUTLASS,gemm,cutlass_tensorop_z884gemm_128x64_8x3_hc_align1,not_verified,success,universal,16384,8192,2048,cf64:row,cf64:column,cf64:column,cf64:column,1,0,serial,1,1,heuristic,invalid,invalid,false,false,1,tensorop,cf64,128,64,8,1,1,1,0,0,0,3,4,2,1,8,8,4,80,1024,2952790016,2200096997376,745,1663.87,1.65277,1322.27
1,CUTLASS,gemm,cutlass_tensorop_z884gemm_128x64_8x3_tt_align1,not_verified,success,universal,16384,8192,2048,cf64:row,cf64:row,cf64:column,cf64:column,1,0,serial,1,1,heuristic,invalid,invalid,false,false,1,tensorop,cf64,128,64,8,1,1,1,0,0,0,3,4,2,1,8,8,4,80,1024,2952790016,2200096997376,745,1663.87,1.65277,1322.28
1,CUTLASS,gemm,cutlass_tensorop_z884gemm_128x64_8x3_ht_align1,not_verified,success,universal,16384,8192,2048,cf64:row,cf64:row,cf64:column,cf64:column,1,0,serial,1,1,heuristic,invalid,invalid,false,false,1,tensorop,cf64,128,64,8,1,1,1,0,0,0,3,4,2,1,8,8,4,80,1024,2952790016,2200096997376,745,1663.88,1.65277,1322.27
1,CUTLASS,gemm,cutlass_tensorop_z884gemm_128x64_8x3_th_align1,not_verified,success,universal,16384,8192,2048,cf64:row,cf64:row,cf64:column,cf64:column,1,0,serial,1,1,heuristic,invalid,invalid,false,false,1,tensorop,cf64,128,64,8,1,1,1,0,0,0,3,4,2,1,8,8,4,80,1024,2952790016,2200096997376,745,1663.87,1.65277,1322.27
1,CUTLASS,gemm,cutlass_tensorop_z884gemm_128x64_8x3_hh_align1,not_verified,success,universal,16384,8192,2048,cf64:row,cf64:row,cf64:column,cf64:column,1,0,serial,1,1,heuristic,invalid,invalid,false,false,1,tensorop,cf64,128,64,8,1,1,1,0,0,0,3,4,2,1,8,8,4,80,1024,2952790016,2200096997376,745,1663.87,1.65277,1322.28
1,CUTLASS,gemm,cutlass_tensorop_gz884gemm_64x64_8x3_nn_align1,not_verified,success,universal,16384,8192,2048,cf64:column,cf64:column,cf64:column,cf64:column,1,0,serial,1,1,heuristic,invalid,invalid,false,false,1,tensorop,cf64,64,64,8,1,1,1,0,0,0,3,4,2,1,8,8,4,80,1024,2952790016,1650072748032,558,1313.32,2.09393,1256.42
1,CUTLASS,gemm,cutlass_tensorop_gz884gemm_64x64_8x3_cn_align1,not_verified,success,universal,16384,8192,2048,cf64:column,cf64:column,cf64:column,cf64:column,1,0,serial,1,1,heuristic,invalid,invalid,false,false,1,tensorop,cf64,64,64,8,1,1,1,0,0,0,3,4,2,1,8,8,4,80,1024,2952790016,1650072748032,558,1313.32,2.09393,1256.42
1,CUTLASS,gemm,cutlass_tensorop_gz884gemm_64x64_8x3_nc_align1,not_verified,success,universal,16384,8192,2048,cf64:column,cf64:column,cf64:column,cf64:column,1,0,serial,1,1,heuristic,invalid,invalid,false,false,1,tensorop,cf64,64,64,8,1,1,1,0,0,0,3,4,2,1,8,8,4,80,1024,2952790016,1650072748032,558,1313.32,2.09393,1256.41
1,CUTLASS,gemm,cutlass_tensorop_gz884gemm_64x64_8x3_cc_align1,not_verified,success,universal,16384,8192,2048,cf64:column,cf64:column,cf64:column,cf64:column,1,0,serial,1,1,heuristic,invalid,invalid,false,false,1,tensorop,cf64,64,64,8,1,1,1,0,0,0,3,4,2,1,8,8,4,80,1024,2952790016,1650072748032,558,1313.32,2.09394,1256.42
1,CUTLASS,gemm,cutlass_tensorop_gz884gemm_64x64_8x3_nt_align1,not_verified,success,universal,16384,8192,2048,cf64:column,cf64:row,cf64:column,cf64:column,1,0,serial,1,1,heuristic,invalid,invalid,false,false,1,tensorop,cf64,64,64,8,1,1,1,0,0,0,3,4,2,1,8,8,4,80,1024,2952790016,1650072748032,558,1314.01,2.09283,1255.76
1,CUTLASS,gemm,cutlass_tensorop_gz884gemm_64x64_8x3_ct_align1,not_verified,success,universal,16384,8192,2048,cf64:column,cf64:row,cf64:column,cf64:column,1,0,serial,1,1,heuristic,invalid,invalid,false,false,1,tensorop,cf64,64,64,8,1,1,1,0,0,0,3,4,2,1,8,8,4,80,1024,2952790016,1650072748032,558,1314.01,2.09283,1255.76
1,CUTLASS,gemm,cutlass_tensorop_gz884gemm_64x64_8x3_nh_align1,not_verified,success,universal,16384,8192,2048,cf64:column,cf64:row,cf64:column,cf64:column,1,0,serial,1,1,heuristic,invalid,invalid,false,false,1,tensorop,cf64,64,64,8,1,1,1,0,0,0,3,4,2,1,8,8,4,80,1024,2952790016,1650072748032,558,1314,2.09285,1255.77
1,CUTLASS,gemm,cutlass_tensorop_gz884gemm_64x64_8x3_ch_align1,not_verified,success,universal,16384,8192,2048,cf64:column,cf64:row,cf64:column,cf64:column,1,0,serial,1,1,heuristic,invalid,invalid,false,false,1,tensorop,cf64,64,64,8,1,1,1,0,0,0,3,4,2,1,8,8,4,80,1024,2952790016,1650072748032,558,1314,2.09284,1255.76
1,CUTLASS,gemm,cutlass_tensorop_gz884gemm_64x64_8x3_tn_align1,not_verified,success,universal,16384,8192,2048,cf64:row,cf64:column,cf64:column,cf64:column,1,0,serial,1,1,heuristic,invalid,invalid,false,false,1,tensorop,cf64,64,64,8,1,1,1,0,0,0,3,4,2,1,8,8,4,80,1024,2952790016,1650072748032,558,1316.34,2.08913,1253.53
1,CUTLASS,gemm,cutlass_tensorop_gz884gemm_64x64_8x3_hn_align1,not_verified,success,universal,16384,8192,2048,cf64:row,cf64:column,cf64:column,cf64:column,1,0,serial,1,1,heuristic,invalid,invalid,false,false,1,tensorop,cf64,64,64,8,1,1,1,0,0,0,3,4,2,1,8,8,4,80,1024,2952790016,1650072748032,558,1316.32,2.08916,1253.55
1,CUTLASS,gemm,cutlass_tensorop_gz884gemm_64x64_8x3_tc_align1,not_verified,success,universal,16384,8192,2048,cf64:row,cf64:column,cf64:column,cf64:column,1,0,serial,1,1,heuristic,invalid,invalid,false,false,1,tensorop,cf64,64,64,8,1,1,1,0,0,0,3,4,2,1,8,8,4,80,1024,2952790016,1650072748032,558,1316.34,2.08912,1253.53
1,CUTLASS,gemm,cutlass_tensorop_gz884gemm_64x64_8x3_hc_align1,not_verified,success,universal,16384,8192,2048,cf64:row,cf64:column,cf64:column,cf64:column,1,0,serial,1,1,heuristic,invalid,invalid,false,false,1,tensorop,cf64,64,64,8,1,1,1,0,0,0,3,4,2,1,8,8,4,80,1024,2952790016,1650072748032,558,1316.34,2.08912,1253.53
1,CUTLASS,gemm,cutlass_tensorop_gz884gemm_64x64_8x3_tt_align1,not_verified,success,universal,16384,8192,2048,cf64:row,cf64:row,cf64:column,cf64:column,1,0,serial,1,1,heuristic,invalid,invalid,false,false,1,tensorop,cf64,64,64,8,1,1,1,0,0,0,3,4,2,1,8,8,4,80,1024,2952790016,1650072748032,558,1314.3,2.09237,1255.47
1,CUTLASS,gemm,cutlass_tensorop_gz884gemm_64x64_8x3_ht_align1,not_verified,success,universal,16384,8192,2048,cf64:row,cf64:row,cf64:column,cf64:column,1,0,serial,1,1,heuristic,invalid,invalid,false,false,1,tensorop,cf64,64,64,8,1,1,1,0,0,0,3,4,2,1,8,8,4,80,1024,2952790016,1650072748032,558,1314.32,2.09234,1255.46
1,CUTLASS,gemm,cutlass_tensorop_gz884gemm_64x64_8x3_th_align1,not_verified,success,universal,16384,8192,2048,cf64:row,cf64:row,cf64:column,cf64:column,1,0,serial,1,1,heuristic,invalid,invalid,false,false,1,tensorop,cf64,64,64,8,1,1,1,0,0,0,3,4,2,1,8,8,4,80,1024,2952790016,1650072748032,558,1314.3,2.09236,1255.47
1,CUTLASS,gemm,cutlass_tensorop_gz884gemm_64x64_8x3_hh_align1,not_verified,success,universal,16384,8192,2048,cf64:row,cf64:row,cf64:column,cf64:column,1,0,serial,1,1,heuristic,invalid,invalid,false,false,1,tensorop,cf64,64,64,8,1,1,1,0,0,0,3,4,2,1,8,8,4,80,1024,2952790016,1650072748032,558,1314.32,2.09234,1255.46
1,CUTLASS,gemm,cutlass_tensorop_s16816gemm_s8_f16_128x128_64x4_tn_align16,not_verified,success,universal,16384,8192,2048,s8:row,f16:column,f32:column,f32:column,1,0,serial,1,1,heuristic,invalid,invalid,false,false,1,tensorop,f32,128,128,64,1,1,1,0,0,0,4,2,2,1,16,8,16,80,1024,603979776,550024249344,910,2.14084,262.747,256920
1,CUTLASS,gemm,cutlass_tensorop_f16_s16816gemm_s8_f16_128x128_64x4_tn_align16,not_verified,success,universal,16384,8192,2048,s8:row,f16:column,f16:column,f16:column,1,0,serial,1,1,heuristic,invalid,invalid,false,false,1,tensorop,f32,128,128,64,1,1,1,0,0,0,4,2,2,1,16,8,16,80,1024,335544320,550024249344,1639,2.09169,149.401,262957
1,CUTLASS,gemm,cutlass_tensorop_s16816gemm_u8_f16_128x128_64x4_tn_align16,not_verified,success,universal,16384,8192,2048,u8:row,f16:column,f32:column,f32:column,1,0,serial,1,1,heuristic,invalid,invalid,false,false,1,tensorop,f32,128,128,64,1,1,1,0,0,0,4,2,2,1,16,8,16,80,1024,603979776,550024249344,910,1.87699,299.682,293035
1,CUTLASS,gemm,cutlass_tensorop_f16_s16816gemm_u8_f16_128x128_64x4_tn_align16,not_verified,success,universal,16384,8192,2048,u8:row,f16:column,f16:column,f16:column,1,0,serial,1,1,heuristic,invalid,invalid,false,false,1,tensorop,f32,128,128,64,1,1,1,0,0,0,4,2,2,1,16,8,16,80,1024,335544320,550024249344,1639,1.83501,170.299,299739
1,CUTLASS,gemm,cutlass_tensorop_s16816gemm_s8_bf16_128x128_64x4_tn_align16,not_verified,success,universal,16384,8192,2048,s8:row,bf16:column,f32:column,f32:column,1,0,serial,1,1,heuristic,invalid,invalid,false,false,1,tensorop,f32,128,128,64,1,1,1,0,0,0,4,2,2,1,16,8,16,80,1024,603979776,550024249344,910,2.23403,251.788,246203
1,CUTLASS,gemm,cutlass_tensorop_bf16_s16816gemm_s8_bf16_128x128_64x4_tn_align16,not_verified,success,universal,16384,8192,2048,s8:row,bf16:column,bf16:column,bf16:column,1,0,serial,1,1,heuristic,invalid,invalid,false,false,1,tensorop,f32,128,128,64,1,1,1,0,0,0,4,2,2,1,16,8,16,80,1024,335544320,550024249344,1639,2.19102,142.628,251036
1,CUTLASS,gemm,cutlass_tensorop_s16816gemm_u8_bf16_128x128_64x4_tn_align16,not_verified,success,universal,16384,8192,2048,u8:row,bf16:column,f32:column,f32:column,1,0,serial,1,1,heuristic,invalid,invalid,false,false,1,tensorop,f32,128,128,64,1,1,1,0,0,0,4,2,2,1,16,8,16,80,1024,603979776,550024249344,910,2.11797,265.584,259694
1,CUTLASS,gemm,cutlass_tensorop_bf16_s16816gemm_u8_bf16_128x128_64x4_tn_align16,not_verified,success,universal,16384,8192,2048,u8:row,bf16:column,bf16:column,bf16:column,1,0,serial,1,1,heuristic,invalid,invalid,false,false,1,tensorop,f32,128,128,64,1,1,1,0,0,0,4,2,2,1,16,8,16,80,1024,335544320,550024249344,1639,2.07701,150.456,264815
1,CUTLASS,gemm,cutlass_tensorop_h16816gemm_s8_f16_128x128_64x4_tn_align16,not_verified,success,universal,16384,8192,2048,s8:row,f16:column,f16:column,f16:column,1,0,serial,1,1,heuristic,invalid,invalid,false,false,1,tensorop,f16,128,128,64,1,1,1,0,0,0,4,2,2,1,16,8,16,80,1024,335544320,550024249344,1639,2.03298,153.715,270551
1,CUTLASS,gemm,cutlass_tensorop_h16816gemm_u8_f16_128x128_64x4_tn_align16,not_verified,success,universal,16384,8192,2048,u8:row,f16:column,f16:column,f16:column,1,0,serial,1,1,heuristic,invalid,invalid,false,false,1,tensorop,f16,128,128,64,1,1,1,0,0,0,4,2,2,1,16,8,16,80,1024,335544320,550024249344,1639,1.89577,164.841,290133
1,CUTLASS,gemm,cutlass_tensorop_s16816gemm_f16_s8_128x128_64x4_tn_align16,not_verified,success,universal,16384,8192,2048,f16:row,s8:column,f32:column,f32:column,1,0,serial,1,1,heuristic,invalid,invalid,false,false,1,tensorop,f32,128,128,64,1,1,1,0,0,0,4,2,2,1,16,8,16,80,1024,620756992,550024249344,886,2.08452,277.342,263861
1,CUTLASS,gemm,cutlass_tensorop_f16_s16816gemm_f16_s8_128x128_64x4_tn_align16,not_verified,success,universal,16384,8192,2048,f16:row,s8:column,f16:column,f16:column,1,0,serial,1,1,heuristic,invalid,invalid,false,false,1,tensorop,f32,128,128,64,1,1,1,0,0,0,4,2,2,1,16,8,16,80,1024,352321536,550024249344,1561,2.03503,161.238,270278
1,CUTLASS,gemm,cutlass_tensorop_s16816gemm_f16_u8_128x128_64x4_tn_align16,not_verified,success,universal,16384,8192,2048,f16:row,u8:column,f32:column,f32:column,1,0,serial,1,1,heuristic,invalid,invalid,false,false,1,tensorop,f32,128,128,64,1,1,1,0,0,0,4,2,2,1,16,8,16,80,1024,620756992,550024249344,886,1.95959,295.023,280683
1,CUTLASS,gemm,cutlass_tensorop_f16_s16816gemm_f16_u8_128x128_64x4_tn_align16,not_verified,success,universal,16384,8192,2048,f16:row,u8:column,f16:column,f16:column,1,0,serial,1,1,heuristic,invalid,invalid,false,false,1,tensorop,f32,128,128,64,1,1,1,0,0,0,4,2,2,1,16,8,16,80,1024,352321536,550024249344,1561,1.91454,171.386,287288
1,CUTLASS,gemm,cutlass_tensorop_s16816gemm_bf16_s8_128x128_64x4_tn_align16,not_verified,success,universal,16384,8192,2048,bf16:row,s8:column,f32:column,f32:column,1,0,serial,1,1,heuristic,invalid,invalid,false,false,1,tensorop,f32,128,128,64,1,1,1,0,0,0,4,2,2,1,16,8,16,80,1024,620756992,550024249344,886,2.25348,256.547,244077
1,CUTLASS,gemm,cutlass_tensorop_bf16_s16816gemm_bf16_s8_128x128_64x4_tn_align16,not_verified,success,universal,16384,8192,2048,bf16:row,s8:column,bf16:column,bf16:column,1,0,serial,1,1,heuristic,invalid,invalid,false,false,1,tensorop,f32,128,128,64,1,1,1,0,0,0,4,2,2,1,16,8,16,80,1024,352321536,550024249344,1561,2.20979,148.487,248903
1,CUTLASS,gemm,cutlass_tensorop_s16816gemm_bf16_u8_128x128_64x4_tn_align16,not_verified,success,universal,16384,8192,2048,bf16:row,u8:column,f32:column,f32:column,1,0,serial,1,1,heuristic,invalid,invalid,false,false,1,tensorop,f32,128,128,64,1,1,1,0,0,0,4,2,2,1,16,8,16,80,1024,620756992,550024249344,886,2.16098,267.529,254525
1,CUTLASS,gemm,cutlass_tensorop_bf16_s16816gemm_bf16_u8_128x128_64x4_tn_align16,not_verified,success,universal,16384,8192,2048,bf16:row,u8:column,bf16:column,bf16:column,1,0,serial,1,1,heuristic,invalid,invalid,false,false,1,tensorop,f32,128,128,64,1,1,1,0,0,0,4,2,2,1,16,8,16,80,1024,352321536,550024249344,1561,2.12173,154.65,259234
1,CUTLASS,gemm,cutlass_tensorop_h16816gemm_f16_s8_128x128_64x4_tn_align16,not_verified,success,universal,16384,8192,2048,f16:row,s8:column,f16:column,f16:column,1,0,serial,1,1,heuristic,invalid,invalid,false,false,1,tensorop,f16,128,128,64,1,1,1,0,0,0,4,2,2,1,16,8,16,80,1024,352321536,550024249344,1561,2.00397,163.738,274468
1,CUTLASS,gemm,cutlass_tensorop_h16816gemm_f16_u8_128x128_64x4_tn_align16,not_verified,success,universal,16384,8192,2048,f16:row,u8:column,f16:column,f16:column,1,0,serial,1,1,heuristic,invalid,invalid,false,false,1,tensorop,f16,128,128,64,1,1,1,0,0,0,4,2,2,1,16,8,16,80,1024,352321536,550024249344,1561,1.90293,172.431,289040
1,CUTLASS,gemm,cutlass_tensorop_i16832gemm_s8_256x128_64x3_tn_align16,not_verified,success,universal,16384,8192,2048,s8:row,s8:column,s32:column,s32:column,1,0,serial,1,1,heuristic,invalid,invalid,false,false,1,tensorop,s32,256,128,64,1,1,1,0,0,0,3,4,2,1,16,8,32,80,1024,587202560,550024249344,936,1.09773,498.188,501057
1,CUTLASS,gemm,cutlass_tensorop_s8_i16832gemm_s8_256x128_64x3_tn_align16,not_verified,success,universal,16384,8192,2048,s8:row,s8:column,s8:column,s8:column,1,0,serial,1,1,heuristic,invalid,invalid,false,false,1,tensorop,s32,256,128,64,1,1,1,0,0,0,3,4,2,1,16,8,32,80,1024,184549376,550024249344,2980,0.969387,177.303,567394
1,CUTLASS,gemm,cutlass_tensorop_i16832gemm_u8_256x128_64x3_tn_align16,not_verified,success,universal,16384,8192,2048,u8:row,u8:column,s32:column,s32:column,1,0,serial,1,1,heuristic,invalid,invalid,false,false,1,tensorop,s32,256,128,64,1,1,1,0,0,0,3,4,2,1,16,8,32,80,1024,587202560,550024249344,936,0.939349,582.185,585537
1,CUTLASS,gemm,cutlass_tensorop_u8_i16832gemm_u8_256x128_64x3_tn_align16,not_verified,success,universal,16384,8192,2048,u8:row,u8:column,u8:column,u8:column,1,0,serial,1,1,heuristic,invalid,invalid,false,false,1,tensorop,s32,256,128,64,1,1,1,0,0,0,3,4,2,1,16,8,32,80,1024,184549376,550024249344,2980,0.832853,206.369,660410
1,CUTLASS,gemm,cutlass_tensorop_i16832gemm_s4_s8_256x128_64x3_tn_align32,not_verified,success,universal,16384,8192,2048,s4:row,s8:column,s32:column,s32:column,1,0,serial,1,1,heuristic,invalid,invalid,false,false,1,tensorop,s32,256,128,64,1,1,1,0,0,0,3,4,2,1,16,8,32,80,1024,570425344,550024249344,964,1.30287,407.754,422164
1,CUTLASS,gemm,cutlass_tensorop_s8_i16832gemm_s4_s8_256x128_64x3_tn_align32,not_verified,success,universal,16384,8192,2048,s4:row,s8:column,s8:column,s8:column,1,0,serial,1,1,heuristic,invalid,invalid,false,false,1,tensorop,s32,256,128,64,1,1,1,0,0,0,3,4,2,1,16,8,32,80,1024,167772160,550024249344,3278,1.152,135.634,477452
1,CUTLASS,gemm,cutlass_tensorop_i16832gemm_s8_s4_256x128_64x3_tn_align32,not_verified,success,universal,16384,8192,2048,s8:row,s4:column,s32:column,s32:column,1,0,serial,1,1,heuristic,invalid,invalid,false,false,1,tensorop,s32,256,128,64,1,1,1,0,0,0,3,4,2,1,16,8,32,80,1024,578813952,550024249344,950,1.27215,423.742,432358
1,CUTLASS,gemm,cutlass_tensorop_s8_i16832gemm_s8_s4_256x128_64x3_tn_align32,not_verified,success,universal,16384,8192,2048,s8:row,s4:column,s8:column,s8:column,1,0,serial,1,1,heuristic,invalid,invalid,false,false,1,tensorop,s32,256,128,64,1,1,1,0,0,0,3,4,2,1,16,8,32,80,1024,176160768,550024249344,3122,1.1363,144.383,484049
1,CUTLASS,gemm,cutlass_tensorop_s8_i16832gemm_s8_256x128_64x3_n32t32_align16,not_verified,success,universal,16384,8192,2048,s8:nk32,s8:tk32,s8:nk32,s8:nk32,1,0,serial,1,1,heuristic,invalid,invalid,false,false,1,tensorop,s32,256,128,64,1,1,1,0,0,0,3,4,2,1,16,8,32,80,1024,184549376,550024249344,2980,0.902485,190.446,609455
1,CUTLASS,gemm,cutlass_tensorop_u8_i16832gemm_u8_256x128_64x3_n32t32_align16,not_verified,success,universal,16384,8192,2048,u8:nk32,u8:tk32,u8:nk32,u8:nk32,1,0,serial,1,1,heuristic,invalid,invalid,false,false,1,tensorop,s32,256,128,64,1,1,1,0,0,0,3,4,2,1,16,8,32,80,1024,184549376,550024249344,2980,0.789163,217.794,696972
1,CUTLASS,gemm,cutlass_tensorop_i16864gemm_s4_256x128_128x3_tn_align32,not_verified,success,universal,16384,8192,2048,s4:row,s4:column,s32:column,s32:column,1,0,serial,1,1,heuristic,invalid,invalid,false,false,1,tensorop,s32,256,128,128,1,1,1,0,0,0,3,4,2,1,16,8,64,80,1024,562036736,550024249344,978,0.718848,728.162,765147
1,CUTLASS,gemm,cutlass_tensorop_s4_i16864gemm_s4_256x128_128x3_tn_align32,not_verified,success,universal,16384,8192,2048,s4:row,s4:column,s4:column,s4:column,1,0,serial,1,1,heuristic,invalid,invalid,false,false,1,tensorop,s32,256,128,128,1,1,1,0,0,0,3,4,2,1,16,8,64,80,1024,92274688,550024249344,5960,0.518827,165.638,1.06013e+06
1,CUTLASS,gemm,cutlass_tensorop_i16864gemm_u4_256x128_128x3_tn_align32,not_verified,success,universal,16384,8192,2048,u4:row,u4:column,s32:column,s32:column,1,0,serial,1,1,heuristic,invalid,invalid,false,false,1,tensorop,s32,256,128,128,1,1,1,0,0,0,3,4,2,1,16,8,64,80,1024,562036736,550024249344,978,0.721579,725.406,762251
1,CUTLASS,gemm,cutlass_tensorop_u4_i16864gemm_u4_256x128_128x3_tn_align32,not_verified,success,universal,16384,8192,2048,u4:row,u4:column,u4:column,u4:column,1,0,serial,1,1,heuristic,invalid,invalid,false,false,1,tensorop,s32,256,128,128,1,1,1,0,0,0,3,4,2,1,16,8,64,80,1024,92274688,550024249344,5960,0.467968,183.64,1.17535e+06
1,CUTLASS,gemm,cutlass_tensorop_s4_i16864gemm_s4_256x128_128x3_n64t64_align32,not_verified,success,universal,16384,8192,2048,s4:nk64,s4:tk64,s4:nk64,s4:nk64,1,0,serial,1,1,heuristic,invalid,invalid,false,false,1,tensorop,s32,256,128,128,1,1,1,0,0,0,3,4,2,1,16,8,64,80,1024,92274688,550024249344,5960,0.489131,175.694,1.12449e+06
1,CUTLASS,gemm,cutlass_tensorop_u4_i16864gemm_u4_256x128_128x3_n64t64_align32,not_verified,success,universal,16384,8192,2048,u4:nk64,u4:tk64,u4:nk64,u4:nk64,1,0,serial,1,1,heuristic,invalid,invalid,false,false,1,tensorop,s32,256,128,128,1,1,1,0,0,0,3,4,2,1,16,8,64,80,1024,92274688,550024249344,5960,0.438955,195.778,1.25303e+06
1,CUTLASS,gemm,cutlass_tensorop_i168256xorgemm_b1_256x128_512x3_tn_align128,not_verified,success,universal,16384,8192,2048,b1:row,b1:column,s32:column,s32:column,1,0,serial,1,1,heuristic,invalid,invalid,false,false,1,tensorop,s32,256,128,512,1,1,1,0,0,0,3,4,2,1,16,8,256,80,1024,543162368,550024249344,1012,0.647168,781.651,849894
1,CUTLASS,gemm,cutlass_tensorop_i168256andgemm_b1_256x128_512x3_tn_align128,not_verified,success,universal,16384,8192,2048,b1:row,b1:column,s32:column,s32:column,1,0,serial,1,1,heuristic,invalid,invalid,false,false,1,tensorop,s32,256,128,512,1,1,1,0,0,0,3,4,2,1,16,8,256,80,1024,543162368,550024249344,1012,0.643413,786.212,854854
1,CUTLASS,gemm,cutlass_simt_sgemm_256x128_8x5_nn_align1,not_verified,success,universal,16384,8192,2048,f32:column,f32:column,f32:column,f32:column,1,0,serial,1,1,heuristic,invalid,invalid,false,false,1,simt,f32,256,128,8,1,1,1,0,0,0,5,4,2,1,1,1,1,50,1024,738197504,550024249344,745,9.86214,69.711,55771.3
1,CUTLASS,gemm,cutlass_simt_sgemm_256x128_8x5_nt_align1,not_verified,success,universal,16384,8192,2048,f32:column,f32:row,f32:column,f32:column,1,0,serial,1,1,heuristic,invalid,invalid,false,false,1,simt,f32,256,128,8,1,1,1,0,0,0,5,4,2,1,1,1,1,50,1024,738197504,550024249344,745,9.89696,69.4658,55575.1
1,CUTLASS,gemm,cutlass_simt_sgemm_256x128_8x5_tn_align1,not_verified,success,universal,16384,8192,2048,f32:row,f32:column,f32:column,f32:column,1,0,serial,1,1,heuristic,invalid,invalid,false,false,1,simt,f32,256,128,8,1,1,1,0,0,0,5,4,2,1,1,1,1,50,1024,738197504,550024249344,745,9.83757,69.8852,55910.6
1,CUTLASS,gemm,cutlass_simt_sgemm_256x128_8x5_tt_align1,not_verified,success,universal,16384,8192,2048,f32:row,f32:row,f32:column,f32:column,1,0,serial,1,1,heuristic,invalid,invalid,false,false,1,simt,f32,256,128,8,1,1,1,0,0,0,5,4,2,1,1,1,1,50,1024,738197504,550024249344,745,10.0666,68.2951,54638.5
1,CUTLASS,gemm,cutlass_simt_dgemm_128x128_8x3_nn_align1,not_verified,success,universal,16384,8192,2048,f64:column,f64:column,f64:column,f64:column,1,0,serial,1,1,heuristic,invalid,invalid,false,false,1,simt,f64,128,128,8,1,1,1,0,0,0,3,4,2,1,1,1,1,50,1024,1476395008,550024249344,372,365.078,3.76632,1506.6
1,CUTLASS,gemm,cutlass_simt_dgemm_128x128_8x3_nt_align1,not_verified,success,universal,16384,8192,2048,f64:column,f64:row,f64:column,f64:column,1,0,serial,1,1,heuristic,invalid,invalid,false,false,1,simt,f64,128,128,8,1,1,1,0,0,0,3,4,2,1,1,1,1,50,1024,1476395008,550024249344,372,365.052,3.76659,1506.7
1,CUTLASS,gemm,cutlass_simt_dgemm_128x128_8x3_tn_align1,not_verified,success,universal,16384,8192,2048,f64:row,f64:column,f64:column,f64:column,1,0,serial,1,1,heuristic,invalid,invalid,false,false,1,simt,f64,128,128,8,1,1,1,0,0,0,3,4,2,1,1,1,1,50,1024,1476395008,550024249344,372,365.103,3.76606,1506.49
1,CUTLASS,gemm,cutlass_simt_dgemm_128x128_8x3_tt_align1,not_verified,success,universal,16384,8192,2048,f64:row,f64:row,f64:column,f64:column,1,0,serial,1,1,heuristic,invalid,invalid,false,false,1,simt,f64,128,128,8,1,1,1,0,0,0,3,4,2,1,1,1,1,50,1024,1476395008,550024249344,372,365.076,3.76634,1506.6
1,CUTLASS,gemm,cutlass_simt_cgemm_128x128_8x5_nn_align1,not_verified,success,universal,16384,8192,2048,cf32:column,cf32:column,cf32:column,cf32:column,1,0,serial,1,1,heuristic,invalid,invalid,false,false,1,simt,cf32,128,128,8,1,1,1,0,0,0,5,4,2,1,1,1,1,50,1024,1476395008,2200096997376,1490,47.1822,29.1424,46629.8
1,CUTLASS,gemm,cutlass_simt_cgemm_128x128_8x5_cn_align1,not_verified,success,universal,16384,8192,2048,cf32:column,cf32:column,cf32:column,cf32:column,1,0,serial,1,1,heuristic,invalid,invalid,false,false,1,simt,cf32,128,128,8,1,1,1,0,0,0,5,4,2,1,1,1,1,50,1024,1476395008,2200096997376,1490,48.4103,28.4031,45446.9
1,CUTLASS,gemm,cutlass_simt_cgemm_128x128_8x5_nc_align1,not_verified,success,universal,16384,8192,2048,cf32:column,cf32:column,cf32:column,cf32:column,1,0,serial,1,1,heuristic,invalid,invalid,false,false,1,simt,cf32,128,128,8,1,1,1,0,0,0,5,4,2,1,1,1,1,50,1024,1476395008,2200096997376,1490,45.7305,30.0675,48110.1
1,CUTLASS,gemm,cutlass_simt_cgemm_128x128_8x5_cc_align1,not_verified,success,universal,16384,8192,2048,cf32:column,cf32:column,cf32:column,cf32:column,1,0,serial,1,1,heuristic,invalid,invalid,false,false,1,simt,cf32,128,128,8,1,1,1,0,0,0,5,4,2,1,1,1,1,50,1024,1476395008,2200096997376,1490,47.4812,28.9588,46336.2
1,CUTLASS,gemm,cutlass_simt_cgemm_128x128_8x5_nt_align1,not_verified,success,universal,16384,8192,2048,cf32:column,cf32:row,cf32:column,cf32:column,1,0,serial,1,1,heuristic,invalid,invalid,false,false,1,simt,cf32,128,128,8,1,1,1,0,0,0,5,4,2,1,1,1,1,50,1024,1476395008,2200096997376,1490,42.9841,31.9886,51184
1,CUTLASS,gemm,cutlass_simt_cgemm_128x128_8x5_ct_align1,not_verified,success,universal,16384,8192,2048,cf32:column,cf32:row,cf32:column,cf32:column,1,0,serial,1,1,heuristic,invalid,invalid,false,false,1,simt,cf32,128,128,8,1,1,1,0,0,0,5,4,2,1,1,1,1,50,1024,1476395008,2200096997376,1490,43.0558,31.9353,51098.8
1,CUTLASS,gemm,cutlass_simt_cgemm_128x128_8x5_nh_align1,not_verified,success,universal,16384,8192,2048,cf32:column,cf32:row,cf32:column,cf32:column,1,0,serial,1,1,heuristic,invalid,invalid,false,false,1,simt,cf32,128,128,8,1,1,1,0,0,0,5,4,2,1,1,1,1,50,1024,1476395008,2200096997376,1490,44.0013,31.2491,50000.7
