profiling_results_2a6/m65536n32768k8192_rtx_6000_ada_generation.gemm.csv
Problem,Provider,OperationKind,Operation,Disposition,Status,gemm_kind,m,n,k,A,B,C,D,alpha,beta,split_k_mode,split_k_slices,batch_count,raster_order,runtime_input_datatype_a,runtime_input_datatype_b,use_pdl,enable_sm90_mixed_dtype_shuffle_test,swizzle_size,op_class,accum,cta_m,cta_n,cta_k,cluster_m,cluster_n,cluster_k,cluster_m_fallback,cluster_n_fallback,cluster_k_fallback,stages,warps_m,warps_n,warps_k,inst_m,inst_n,inst_k,min_cc,max_cc,Bytes,Flops,Flops/Byte,Runtime,GB/s,GFLOPs
1,CUTLASS,gemm,cutlass_tensorop_s1688gemm_f16_256x128_32x2_nn_align8,not_verified,success,universal,65536,32768,8192,f16:column,f16:column,f32:column,f32:column,1,0,serial,1,1,heuristic,invalid,invalid,false,false,1,tensorop,f32,256,128,32,1,1,1,0,0,0,2,4,2,1,16,8,8,75,1024,10200547328,35188667056128,3449,184.974,51.3587,190236
1,CUTLASS,gemm,cutlass_tensorop_s1688gemm_f16_256x128_32x2_nt_align8,not_verified,success,universal,65536,32768,8192,f16:column,f16:row,f32:column,f32:column,1,0,serial,1,1,heuristic,invalid,invalid,false,false,1,tensorop,f32,256,128,32,1,1,1,0,0,0,2,4,2,1,16,8,8,75,1024,10200547328,35188667056128,3449,183.912,51.655,191334
1,CUTLASS,gemm,cutlass_tensorop_s1688gemm_f16_256x128_32x2_tn_align8,not_verified,success,universal,65536,32768,8192,f16:row,f16:column,f32:column,f32:column,1,0,serial,1,1,heuristic,invalid,invalid,false,false,1,tensorop,f32,256,128,32,1,1,1,0,0,0,2,4,2,1,16,8,8,75,1024,10200547328,35188667056128,3449,189.213,50.208,185974
1,CUTLASS,gemm,cutlass_tensorop_s1688gemm_f16_256x128_32x2_tt_align8,not_verified,success,universal,65536,32768,8192,f16:row,f16:row,f32:column,f32:column,1,0,serial,1,1,heuristic,invalid,invalid,false,false,1,tensorop,f32,256,128,32,1,1,1,0,0,0,2,4,2,1,16,8,8,75,1024,10200547328,35188667056128,3449,188.146,50.4928,187029
1,CUTLASS,gemm,cutlass_tensorop_f16_s1688gemm_f16_256x128_32x2_nn_align8,not_verified,success,universal,65536,32768,8192,f16:column,f16:column,f16:column,f16:column,1,0,serial,1,1,heuristic,invalid,invalid,false,false,1,tensorop,f32,256,128,32,1,1,1,0,0,0,2,4,2,1,16,8,8,75,1024,5905580032,35188667056128,5958,184.459,29.817,190767
1,CUTLASS,gemm,cutlass_tensorop_f16_s1688gemm_f16_256x128_32x2_nt_align8,not_verified,success,universal,65536,32768,8192,f16:column,f16:row,f16:column,f16:column,1,0,serial,1,1,heuristic,invalid,invalid,false,false,1,tensorop,f32,256,128,32,1,1,1,0,0,0,2,4,2,1,16,8,8,75,1024,5905580032,35188667056128,5958,182.226,30.1823,193104
1,CUTLASS,gemm,cutlass_tensorop_f16_s1688gemm_f16_256x128_32x2_tn_align8,not_verified,success,universal,65536,32768,8192,f16:row,f16:column,f16:column,f16:column,1,0,serial,1,1,heuristic,invalid,invalid,false,false,1,tensorop,f32,256,128,32,1,1,1,0,0,0,2,4,2,1,16,8,8,75,1024,5905580032,35188667056128,5958,192.244,28.6095,183042
1,CUTLASS,gemm,cutlass_tensorop_f16_s1688gemm_f16_256x128_32x2_tt_align8,not_verified,success,universal,65536,32768,8192,f16:row,f16:row,f16:column,f16:column,1,0,serial,1,1,heuristic,invalid,invalid,false,false,1,tensorop,f32,256,128,32,1,1,1,0,0,0,2,4,2,1,16,8,8,75,1024,5905580032,35188667056128,5958,184.995,29.7306,190214
1,CUTLASS,gemm,cutlass_tensorop_s16816gemm_f16_256x128_32x3_nn_align8,not_verified,success,universal,65536,32768,8192,f16:column,f16:column,f32:column,f32:column,1,0,serial,1,1,heuristic,invalid,invalid,false,false,1,tensorop,f32,256,128,32,1,1,1,0,0,0,3,4,2,1,16,8,16,80,1024,10200547328,35188667056128,3449,170.077,55.857,206898
1,CUTLASS,gemm,cutlass_tensorop_s16816gemm_f16_256x128_32x3_nt_align8,not_verified,success,universal,65536,32768,8192,f16:column,f16:row,f32:column,f32:column,1,0,serial,1,1,heuristic,invalid,invalid,false,false,1,tensorop,f32,256,128,32,1,1,1,0,0,0,3,4,2,1,16,8,16,80,1024,10200547328,35188667056128,3449,162.043,58.6266,217157
1,CUTLASS,gemm,cutlass_tensorop_s16816gemm_f16_256x128_32x3_tn_align8,not_verified,success,universal,65536,32768,8192,f16:row,f16:column,f32:column,f32:column,1,0,serial,1,1,heuristic,invalid,invalid,false,false,1,tensorop,f32,256,128,32,1,1,1,0,0,0,3,4,2,1,16,8,16,80,1024,10200547328,35188667056128,3449,175.609,54.0974,200381
1,CUTLASS,gemm,cutlass_tensorop_s16816gemm_f16_256x128_32x3_tt_align8,not_verified,success,universal,65536,32768,8192,f16:row,f16:row,f32:column,f32:column,1,0,serial,1,1,heuristic,invalid,invalid,false,false,1,tensorop,f32,256,128,32,1,1,1,0,0,0,3,4,2,1,16,8,16,80,1024,10200547328,35188667056128,3449,167.337,56.7718,210287
1,CUTLASS,gemm,cutlass_tensorop_f16_s16816gemm_f16_256x128_32x3_nn_align8,not_verified,success,universal,65536,32768,8192,f16:column,f16:column,f16:column,f16:column,1,0,serial,1,1,heuristic,invalid,invalid,false,false,1,tensorop,f32,256,128,32,1,1,1,0,0,0,3,4,2,1,16,8,16,80,1024,5905580032,35188667056128,5958,172.997,31.7924,203406
1,CUTLASS,gemm,cutlass_tensorop_f16_s16816gemm_f16_256x128_32x3_nt_align8,not_verified,success,universal,65536,32768,8192,f16:column,f16:row,f16:column,f16:column,1,0,serial,1,1,heuristic,invalid,invalid,false,false,1,tensorop,f32,256,128,32,1,1,1,0,0,0,3,4,2,1,16,8,16,80,1024,5905580032,35188667056128,5958,159.233,34.5406,220989
1,CUTLASS,gemm,cutlass_tensorop_f16_s16816gemm_f16_256x128_32x3_tn_align8,not_verified,success,universal,65536,32768,8192,f16:row,f16:column,f16:column,f16:column,1,0,serial,1,1,heuristic,invalid,invalid,false,false,1,tensorop,f32,256,128,32,1,1,1,0,0,0,3,4,2,1,16,8,16,80,1024,5905580032,35188667056128,5958,175.191,31.3942,200858
1,CUTLASS,gemm,cutlass_tensorop_f16_s16816gemm_f16_256x128_32x3_tt_align8,not_verified,success,universal,65536,32768,8192,f16:row,f16:row,f16:column,f16:column,1,0,serial,1,1,heuristic,invalid,invalid,false,false,1,tensorop,f32,256,128,32,1,1,1,0,0,0,3,4,2,1,16,8,16,80,1024,5905580032,35188667056128,5958,165.262,33.2806,212927
1,CUTLASS,gemm,cutlass_tensorop_s16816gemm_bf16_256x128_32x3_nn_align8,not_verified,success,universal,65536,32768,8192,bf16:column,bf16:column,f32:column,f32:column,1,0,serial,1,1,heuristic,invalid,invalid,false,false,1,tensorop,f32,256,128,32,1,1,1,0,0,0,3,4,2,1,16,8,16,80,1024,10200547328,35188667056128,3449,187.304,50.7197,187869
1,CUTLASS,gemm,cutlass_tensorop_s16816gemm_bf16_256x128_32x3_nt_align8,not_verified,success,universal,65536,32768,8192,bf16:column,bf16:row,f32:column,f32:column,1,0,serial,1,1,heuristic,invalid,invalid,false,false,1,tensorop,f32,256,128,32,1,1,1,0,0,0,3,4,2,1,16,8,16,80,1024,10200547328,35188667056128,3449,178.178,53.3174,197491
1,CUTLASS,gemm,cutlass_tensorop_s16816gemm_bf16_256x128_32x3_tn_align8,not_verified,success,universal,65536,32768,8192,bf16:row,bf16:column,f32:column,f32:column,1,0,serial,1,1,heuristic,invalid,invalid,false,false,1,tensorop,f32,256,128,32,1,1,1,0,0,0,3,4,2,1,16,8,16,80,1024,10200547328,35188667056128,3449,192.132,49.4451,183148
1,CUTLASS,gemm,cutlass_tensorop_s16816gemm_bf16_256x128_32x3_tt_align8,not_verified,success,universal,65536,32768,8192,bf16:row,bf16:row,f32:column,f32:column,1,0,serial,1,1,heuristic,invalid,invalid,false,false,1,tensorop,f32,256,128,32,1,1,1,0,0,0,3,4,2,1,16,8,16,80,1024,10200547328,35188667056128,3449,182.295,52.1134,193032
1,CUTLASS,gemm,cutlass_tensorop_bf16_s16816gemm_bf16_256x128_32x3_nn_align8,not_verified,success,universal,65536,32768,8192,bf16:column,bf16:column,bf16:column,bf16:column,1,0,serial,1,1,heuristic,invalid,invalid,false,false,1,tensorop,f32,256,128,32,1,1,1,0,0,0,3,4,2,1,16,8,16,80,1024,5905580032,35188667056128,5958,187.758,29.2931,187415
1,CUTLASS,gemm,cutlass_tensorop_bf16_s16816gemm_bf16_256x128_32x3_nt_align8,not_verified,success,universal,65536,32768,8192,bf16:column,bf16:row,bf16:column,bf16:column,1,0,serial,1,1,heuristic,invalid,invalid,false,false,1,tensorop,f32,256,128,32,1,1,1,0,0,0,3,4,2,1,16,8,16,80,1024,5905580032,35188667056128,5958,174.682,31.4858,201444
1,CUTLASS,gemm,cutlass_tensorop_bf16_s16816gemm_bf16_256x128_32x3_tn_align8,not_verified,success,universal,65536,32768,8192,bf16:row,bf16:column,bf16:column,bf16:column,1,0,serial,1,1,heuristic,invalid,invalid,false,false,1,tensorop,f32,256,128,32,1,1,1,0,0,0,3,4,2,1,16,8,16,80,1024,5905580032,35188667056128,5958,190.988,28.7976,184245
1,CUTLASS,gemm,cutlass_tensorop_bf16_s16816gemm_bf16_256x128_32x3_tt_align8,not_verified,success,universal,65536,32768,8192,bf16:row,bf16:row,bf16:column,bf16:column,1,0,serial,1,1,heuristic,invalid,invalid,false,false,1,tensorop,f32,256,128,32,1,1,1,0,0,0,3,4,2,1,16,8,16,80,1024,5905580032,35188667056128,5958,178.84,30.7538,196761
1,CUTLASS,gemm,cutlass_tensorop_s1688f16gemm_256x128_16x3_nn_align4,not_verified,success,universal,65536,32768,8192,f32:column,f32:column,f32:column,f32:column,1,0,serial,1,1,heuristic,invalid,invalid,false,false,1,tensorop,f32,256,128,16,1,1,1,0,0,0,3,4,2,1,16,8,8,75,1024,11811160064,35188667056128,2979,294.096,37.4028,119650
1,CUTLASS,gemm,cutlass_tensorop_s1688f16gemm_256x128_16x3_nt_align4,not_verified,success,universal,65536,32768,8192,f32:column,f32:row,f32:column,f32:column,1,0,serial,1,1,heuristic,invalid,invalid,false,false,1,tensorop,f32,256,128,16,1,1,1,0,0,0,3,4,2,1,16,8,8,75,1024,11811160064,35188667056128,2979,280.44,39.224,125476
1,CUTLASS,gemm,cutlass_tensorop_s1688f16gemm_256x128_16x3_tn_align4,not_verified,success,universal,65536,32768,8192,f32:row,f32:column,f32:column,f32:column,1,0,serial,1,1,heuristic,invalid,invalid,false,false,1,tensorop,f32,256,128,16,1,1,1,0,0,0,3,4,2,1,16,8,8,75,1024,11811160064,35188667056128,2979,294.851,37.3069,119344
1,CUTLASS,gemm,cutlass_tensorop_s1688f16gemm_256x128_16x3_tt_align4,not_verified,success,universal,65536,32768,8192,f32:row,f32:row,f32:column,f32:column,1,0,serial,1,1,heuristic,invalid,invalid,false,false,1,tensorop,f32,256,128,16,1,1,1,0,0,0,3,4,2,1,16,8,8,75,1024,11811160064,35188667056128,2979,279.057,39.4184,126098
1,CUTLASS,gemm,cutlass_tensorop_s1688bf16gemm_256x128_16x3_nn_align4,not_verified,success,universal,65536,32768,8192,f32:column,f32:column,f32:column,f32:column,1,0,serial,1,1,heuristic,invalid,invalid,false,false,1,tensorop,f32,256,128,16,1,1,1,0,0,0,3,4,2,1,16,8,8,80,1024,11811160064,35188667056128,2979,304.92,36.075,115403
1,CUTLASS,gemm,cutlass_tensorop_s1688bf16gemm_256x128_16x3_nt_align4,not_verified,success,universal,65536,32768,8192,f32:column,f32:row,f32:column,f32:column,1,0,serial,1,1,heuristic,invalid,invalid,false,false,1,tensorop,f32,256,128,16,1,1,1,0,0,0,3,4,2,1,16,8,8,80,1024,11811160064,35188667056128,2979,293.129,37.5262,120045
1,CUTLASS,gemm,cutlass_tensorop_s1688bf16gemm_256x128_16x3_tn_align4,not_verified,success,universal,65536,32768,8192,f32:row,f32:column,f32:column,f32:column,1,0,serial,1,1,heuristic,invalid,invalid,false,false,1,tensorop,f32,256,128,16,1,1,1,0,0,0,3,4,2,1,16,8,8,80,1024,11811160064,35188667056128,2979,305.126,36.0507,115325
1,CUTLASS,gemm,cutlass_tensorop_s1688bf16gemm_256x128_16x3_tt_align4,not_verified,success,universal,65536,32768,8192,f32:row,f32:row,f32:column,f32:column,1,0,serial,1,1,heuristic,invalid,invalid,false,false,1,tensorop,f32,256,128,16,1,1,1,0,0,0,3,4,2,1,16,8,8,80,1024,11811160064,35188667056128,2979,289.126,38.0457,121707
1,CUTLASS,gemm,cutlass_tensorop_s16816gemm_s8_f16_128x128_64x4_tn_align16,not_verified,success,universal,65536,32768,8192,s8:row,f16:column,f32:column,f32:column,1,0,serial,1,1,heuristic,invalid,invalid,false,false,1,tensorop,f32,128,128,64,1,1,1,0,0,0,4,2,2,1,16,8,16,80,1024,9663676416,35188667056128,3641,230.528,39.0408,152644
1,CUTLASS,gemm,cutlass_tensorop_f16_s16816gemm_s8_f16_128x128_64x4_tn_align16,not_verified,success,universal,65536,32768,8192,s8:row,f16:column,f16:column,f16:column,1,0,serial,1,1,heuristic,invalid,invalid,false,false,1,tensorop,f32,128,128,64,1,1,1,0,0,0,4,2,2,1,16,8,16,80,1024,5368709120,35188667056128,6554,225.284,22.1942,156197
1,CUTLASS,gemm,cutlass_tensorop_s16816gemm_u8_f16_128x128_64x4_tn_align16,not_verified,success,universal,65536,32768,8192,u8:row,f16:column,f32:column,f32:column,1,0,serial,1,1,heuristic,invalid,invalid,false,false,1,tensorop,f32,128,128,64,1,1,1,0,0,0,4,2,2,1,16,8,16,80,1024,9663676416,35188667056128,3641,198.633,45.3096,177154
1,CUTLASS,gemm,cutlass_tensorop_f16_s16816gemm_u8_f16_128x128_64x4_tn_align16,not_verified,success,universal,65536,32768,8192,u8:row,f16:column,f16:column,f16:column,1,0,serial,1,1,heuristic,invalid,invalid,false,false,1,tensorop,f32,128,128,64,1,1,1,0,0,0,4,2,2,1,16,8,16,80,1024,5368709120,35188667056128,6554,196.422,25.4554,179148
1,CUTLASS,gemm,cutlass_tensorop_s16816gemm_s8_bf16_128x128_64x4_tn_align16,not_verified,success,universal,65536,32768,8192,s8:row,bf16:column,f32:column,f32:column,1,0,serial,1,1,heuristic,invalid,invalid,false,false,1,tensorop,f32,128,128,64,1,1,1,0,0,0,4,2,2,1,16,8,16,80,1024,9663676416,35188667056128,3641,247.906,36.3041,141944
1,CUTLASS,gemm,cutlass_tensorop_bf16_s16816gemm_s8_bf16_128x128_64x4_tn_align16,not_verified,success,universal,65536,32768,8192,s8:row,bf16:column,bf16:column,bf16:column,1,0,serial,1,1,heuristic,invalid,invalid,false,false,1,tensorop,f32,128,128,64,1,1,1,0,0,0,4,2,2,1,16,8,16,80,1024,5368709120,35188667056128,6554,242.974,20.5783,144825
1,CUTLASS,gemm,cutlass_tensorop_s16816gemm_u8_bf16_128x128_64x4_tn_align16,not_verified,success,universal,65536,32768,8192,u8:row,bf16:column,f32:column,f32:column,1,0,serial,1,1,heuristic,invalid,invalid,false,false,1,tensorop,f32,128,128,64,1,1,1,0,0,0,4,2,2,1,16,8,16,80,1024,9663676416,35188667056128,3641,220.734,40.773,159416
1,CUTLASS,gemm,cutlass_tensorop_bf16_s16816gemm_u8_bf16_128x128_64x4_tn_align16,not_verified,success,universal,65536,32768,8192,u8:row,bf16:column,bf16:column,bf16:column,1,0,serial,1,1,heuristic,invalid,invalid,false,false,1,tensorop,f32,128,128,64,1,1,1,0,0,0,4,2,2,1,16,8,16,80,1024,5368709120,35188667056128,6554,217.477,22.9909,161804
1,CUTLASS,gemm,cutlass_tensorop_h16816gemm_s8_f16_128x128_64x4_tn_align16,not_verified,success,universal,65536,32768,8192,s8:row,f16:column,f16:column,f16:column,1,0,serial,1,1,heuristic,invalid,invalid,false,false,1,tensorop,f16,128,128,64,1,1,1,0,0,0,4,2,2,1,16,8,16,80,1024,5368709120,35188667056128,6554,219.307,22.7991,160454
1,CUTLASS,gemm,cutlass_tensorop_h16816gemm_u8_f16_128x128_64x4_tn_align16,not_verified,success,universal,65536,32768,8192,u8:row,f16:column,f16:column,f16:column,1,0,serial,1,1,heuristic,invalid,invalid,false,false,1,tensorop,f16,128,128,64,1,1,1,0,0,0,4,2,2,1,16,8,16,80,1024,5368709120,35188667056128,6554,190.257,26.2802,184953
1,CUTLASS,gemm,cutlass_tensorop_s16816gemm_f16_s8_128x128_64x4_tn_align16,not_verified,success,universal,65536,32768,8192,f16:row,s8:column,f32:column,f32:column,1,0,serial,1,1,heuristic,invalid,invalid,false,false,1,tensorop,f32,128,128,64,1,1,1,0,0,0,4,2,2,1,16,8,16,80,1024,9932111872,35188667056128,3542,220.01,42.0434,159941
1,CUTLASS,gemm,cutlass_tensorop_f16_s16816gemm_f16_s8_128x128_64x4_tn_align16,not_verified,success,universal,65536,32768,8192,f16:row,s8:column,f16:column,f16:column,1,0,serial,1,1,heuristic,invalid,invalid,false,false,1,tensorop,f32,128,128,64,1,1,1,0,0,0,4,2,2,1,16,8,16,80,1024,5637144576,35188667056128,6242,221.912,23.658,158570
1,CUTLASS,gemm,cutlass_tensorop_s16816gemm_f16_u8_128x128_64x4_tn_align16,not_verified,success,universal,65536,32768,8192,f16:row,u8:column,f32:column,f32:column,1,0,serial,1,1,heuristic,invalid,invalid,false,false,1,tensorop,f32,128,128,64,1,1,1,0,0,0,4,2,2,1,16,8,16,80,1024,9932111872,35188667056128,3542,201.231,45.967,174867
1,CUTLASS,gemm,cutlass_tensorop_f16_s16816gemm_f16_u8_128x128_64x4_tn_align16,not_verified,success,universal,65536,32768,8192,f16:row,u8:column,f16:column,f16:column,1,0,serial,1,1,heuristic,invalid,invalid,false,false,1,tensorop,f32,128,128,64,1,1,1,0,0,0,4,2,2,1,16,8,16,80,1024,5637144576,35188667056128,6242,194.057,27.0539,181331
1,CUTLASS,gemm,cutlass_tensorop_s16816gemm_bf16_s8_128x128_64x4_tn_align16,not_verified,success,universal,65536,32768,8192,bf16:row,s8:column,f32:column,f32:column,1,0,serial,1,1,heuristic,invalid,invalid,false,false,1,tensorop,f32,128,128,64,1,1,1,0,0,0,4,2,2,1,16,8,16,80,1024,9932111872,35188667056128,3542,239.246,38.6631,147081
1,CUTLASS,gemm,cutlass_tensorop_bf16_s16816gemm_bf16_s8_128x128_64x4_tn_align16,not_verified,success,universal,65536,32768,8192,bf16:row,s8:column,bf16:column,bf16:column,1,0,serial,1,1,heuristic,invalid,invalid,false,false,1,tensorop,f32,128,128,64,1,1,1,0,0,0,4,2,2,1,16,8,16,80,1024,5637144576,35188667056128,6242,234.279,22.4092,150200
1,CUTLASS,gemm,cutlass_tensorop_s16816gemm_bf16_u8_128x128_64x4_tn_align16,not_verified,success,universal,65536,32768,8192,bf16:row,u8:column,f32:column,f32:column,1,0,serial,1,1,heuristic,invalid,invalid,false,false,1,tensorop,f32,128,128,64,1,1,1,0,0,0,4,2,2,1,16,8,16,80,1024,9932111872,35188667056128,3542,221.528,41.7554,158845
1,CUTLASS,gemm,cutlass_tensorop_bf16_s16816gemm_bf16_u8_128x128_64x4_tn_align16,not_verified,success,universal,65536,32768,8192,bf16:row,u8:column,bf16:column,bf16:column,1,0,serial,1,1,heuristic,invalid,invalid,false,false,1,tensorop,f32,128,128,64,1,1,1,0,0,0,4,2,2,1,16,8,16,80,1024,5637144576,35188667056128,6242,216.44,24.2562,162579
1,CUTLASS,gemm,cutlass_tensorop_h16816gemm_f16_s8_128x128_64x4_tn_align16,not_verified,success,universal,65536,32768,8192,f16:row,s8:column,f16:column,f16:column,1,0,serial,1,1,heuristic,invalid,invalid,false,false,1,tensorop,f16,128,128,64,1,1,1,0,0,0,4,2,2,1,16,8,16,80,1024,5637144576,35188667056128,6242,209.367,25.0756,168072
1,CUTLASS,gemm,cutlass_tensorop_h16816gemm_f16_u8_128x128_64x4_tn_align16,not_verified,success,universal,65536,32768,8192,f16:row,u8:column,f16:column,f16:column,1,0,serial,1,1,heuristic,invalid,invalid,false,false,1,tensorop,f16,128,128,64,1,1,1,0,0,0,4,2,2,1,16,8,16,80,1024,5637144576,35188667056128,6242,188.313,27.8791,186862
